Unnamed: 0,dialogue,utterance_id,utterance_type,utterance_text,labels,bounds
263,20230130_123240_973928,5,bot,"Du sagst, dass die menschliche Subjektivtät für eine Entscheidung notwendig ist. Das ist möglich. Der Einwand, die jurKI hätte keine eigenen Emotionen und Empfindungen ist insoweit hinfällig, als dass auch Richter:innen nicht nach ihren eigenen Gefühlen, sondern auf der Grundlage des Gesetzes entscheiden.","['intro_27', 'Z.P1-1', 'intro_2', 'Z.P1-1-1']","[(0, 15), (15, 81), (81, 98), (98, 307)]"
264,20230130_123240_973928,6,user,"Natürlich handeln Richter:innen nicht ausschließlich nach Gefühl und müssen sich an das Gesetz halten, trotzdem halte ich Mitgefühl als essenziell für das Treffen richterlicher Entscheidungen.",['Z.P1-1'],"[(0, 193)]"
265,20230130_123240_973928,7,bot,"Du merkst an, dass KI keine Werte befolgt. Darauf geht unser Szenario wie folgt ein: Die jurKI ist ein zertifizierter Service des Staates, der die moralischen Leitlinien und Regeln vorgibt. Hierfür werden insb. auch die Erkenntnisse der Philosophie und Computerwissenschaft hinzugezogen und z.B. in ein passendes Diskriminierungsgesetz übersetzt.","['intro_28', 'Z.K6', 'intro_55', 'Z.K6-1']","[(0, 19), (19, 43), (43, 85), (85, 347)]"
266,20230130_115721_479348,0,user,Memschen sollten über Menschen entscheiden,['Z.K2'],"[(0, 43)]"
267,20230130_115721_479348,1,bot,"Dein Argument ist, dass die KI nicht akzeptiert wird. Dein Argument ist nicht spezifisch bzgl. der jurKI sondern gilt für viele fortgeschrittliche Innovationen. Die Pandemie hat bereits dafür gesorgt, dass die Technik viel mehr an Akzeptanz gewinnt. Warum die jurKI als Richter:in nicht an Akzeptanz hinzugewinnen sollte, ist nicht ersichtlich.","['intro_25', 'Z.K9', 'intro_57', 'Z.K9-1']","[(0, 24), (24, 54), (54, 161), (161, 345)]"
268,20230130_115721_479348,2,user,Weil richterlicher Entscheidung manchmal Subjekt sind und Menschen am besten subjektiv entscheiden können,['Z.P1-1'],"[(0, 105)]"
269,20230130_115721_479348,3,bot,"Du sagst, dass KI keine Werte befolgt. Das ist im Szenario bereits berücksichtigt: Die jurKI ist ein zertifizierter Service des Staates, der die moralischen Leitlinien und Regeln vorgibt. Hierfür werden insb. auch die Erkenntnisse der Philosophie und Computerwissenschaft hinzugezogen und z.B. in ein passendes Diskriminierungsgesetz übersetzt.","['intro_27', 'Z.K6', 'intro_56', 'Z.K6-1']","[(0, 15), (15, 39), (39, 83), (83, 345)]"
270,20230130_115721_479348,4,user,Aber die Gesetze sind zum Teil aus Auslegungssache dann würde die programmiere das entscheiden,['Z.P1-2'],"[(0, 94)]"
271,20230130_115721_479348,5,bot,"Mit anderen Worten, KI könnte von fehlerhaften Urteilen falsch lernen und Leitlinien sowie sonstige Regeln verletzen. Das ist im Szenario bereits berücksichtigt: Neben der Umsetzung der Regeln und Leitlinien wird eine jurKI ausschließlich aus selektierten Fällen, die gerade nicht vorurteilsbehaftet und diskriminierend sind, lernen und somit bestehende Vorurteile oder Diskriminierungen nicht berücksichtigen.","['intro_32', 'Z.K6-1-1', 'intro_56', 'Z.K6-1-1-1']","[(0, 20), (20, 118), (118, 162), (162, 411)]"
272,20230130_115721_479348,6,user,Es geht nicht um Diskreminierung sondern dass manche Probleme Auslegungssache sind,['Z.P1-2'],"[(0, 82)]"
273,20230130_115721_479348,7,bot,"Ich bin mir nicht sicher, was du genau meinst. Kannst du das anders formulieren?",['intro_61'],"[(0, 81)]"
274,20230130_115721_479348,8,user,Nein,['DISSENT'],"[(0, 4)]"
275,20230130_115721_479348,9,bot,Das verstehe ich. Um auch noch einmal eine andere Seite zu beleuchten: Durch den Einsatz der jurKI kann der Faktor Subjektivität bei Gerichtsurteilen ausgeräumt werden. Eine jurKI lässt sich nicht etwa durch Mitgefühl von den objektiven Fakten ablenken. Dies führt zu mehr Gerechtigkeit.,"['intro_1', 'z_trans_13', 'Z.P1']","[(0, 18), (18, 71), (71, 288)]"
276,20230130_115721_479348,10,user,Mitgefühl ist manchmal wichtig,['Z.K2'],"[(0, 31)]"
277,20230130_115721_479348,11,bot,"Ich bin mir nicht sicher, was du genau meinst. Kannst du das anders ausdrücken?",['intro_62'],"[(0, 80)]"
278,20230130_115721_479348,12,user,Nein,['DISSENT'],"[(0, 4)]"
279,20230130_115721_479348,13,bot,"Das ist möglich. Um auch noch einmal eine andere Seite zu beleuchten: Die jurKI kann eine hohe Komplexität an Datenmengen verarbeiten und darauf trainiert werden, so viele Korrelationen wie möglich zu identifizieren und dadurch die Faktoren aufdecken, die ein/e menschliche/r Richter:in übersehen könnte.","['intro_2', 'z_trans_13', 'Z.P4']","[(0, 17), (17, 70), (70, 305)]"
280,20230130_115721_479348,14,user,Ok du hast recht,['CONSENT'],"[(0, 16)]"
281,20230130_115721_479348,15,bot,"Kurz zusammengefasst, KI befolgt keine Werte. Das ist im Szenario bereits berücksichtigt: Dieser Einwand beruht auf einem technisch überholten Bild und setzt ein idealisiertes Bild von Richter:innen voraus. Das Lernverfahren erfolgt mittlerweile Bottom-Up, also bspw. zunächst anhand kleinerer und einfacher Fälle bis hin zu komplexen und schwierigen Sachverhalten, und der jurKI können Werte beigebracht werden, etwa durch das sog. supervised learning.","['intro_24', 'Z.K6', 'intro_56', 'Z.K6-2']","[(0, 22), (22, 46), (46, 90), (90, 455)]"
282,20230130_115721_479348,16,user,Ok,['OTHER'],"[(0, 2)]"
283,20230130_115721_479348,17,bot,"Ich bin mir nicht sicher, was du genau meinst. Kannst du das anders formulieren?",['intro_61'],"[(0, 81)]"
284,20230130_115721_479348,18,user,Du hast recht,['CONSENT'],"[(0, 13)]"
285,20230130_115721_479348,19,bot,Das mag sein. Ansprechen möchte ich noch: Transparenz und Interpretierbarkeit könnten Zurechnungshindernisse bei der jurKI überwinden. Die jurKI folgt einem strikten Regelwerk und wäre hierdurch durchaus in der Lage ihre Entscheidung zu begründen.,"['intro_3', 'z_trans_11', 'Z.K2-1']","[(0, 14), (14, 42), (42, 248)]"
286,20230130_130815_853042,0,user,"Hab Bedenken, dass die von KI-Urteilen betroffenen Menschen Urteile, die zu ihrem Nachteil ausfallen, sehr viel häufiger anzweifeln würden, als wenn das Urteil von einem menschlichen Richter ausgesprochen wurde.",['Z.P8-2'],"[(0, 212)]"
287,20230130_130815_853042,1,bot,"Kurz zusammengefasst, KI befolgt keine Werte. Das ist im Szenario bereits berücksichtigt: Die jurKI ist ein zertifizierter Service des Staates, der die moralischen Leitlinien und Regeln vorgibt. Hierfür werden insb. auch die Erkenntnisse der Philosophie und Computerwissenschaft hinzugezogen und z.B. in ein passendes Diskriminierungsgesetz übersetzt.","['intro_24', 'Z.K6', 'intro_56', 'Z.K6-1']","[(0, 22), (22, 46), (46, 90), (90, 352)]"
288,20230130_130815_853042,2,user,"Hast mich falsch verstanden. Ich bezweifle nicht die Kompetenz der KI, sondern die Akzeptanz deren Urteile seitens der verurteilten.","['OTHER', 'Z.P8-2']","[(0, 29), (29, 133)]"
289,20230130_130815_853042,3,bot,"Du sagst, dass KI keine Werte befolgt. Darauf geht unser Szenario wie folgt ein: Dieser Einwand beruht auf einem technisch überholten Bild und setzt ein idealisiertes Bild von Richter:innen voraus. Das Lernverfahren erfolgt mittlerweile Bottom-Up, also bspw. zunächst anhand kleinerer und einfacher Fälle bis hin zu komplexen und schwierigen Sachverhalten, und der jurKI können Werte beigebracht werden, etwa durch das sog. supervised learning.","['intro_27', 'Z.K6', 'intro_55', 'Z.K6-2']","[(0, 15), (15, 39), (39, 81), (81, 446)]"
290,20230130_130815_853042,4,user,"Nein, das sage ich nicht. Ich sage, die verurteilten werden KI-Urteile viel wahrscheinlicher anzweifeln, als die von Menschen-Richtern. Ganz unabhängig von der Qualität der KI-Urteile.","['DISSENT', 'Z.P8-2']","[(0, 26), (26, 185)]"
291,20230130_130815_853042,5,bot,"Ich bin mir nicht sicher, was du genau meinst. Kannst du das anders formulieren?",['intro_61'],"[(0, 81)]"
292,20230130_130815_853042,6,user,"Menschen sind gegenüber ""Maschinen"", also einer KI, sehr viel misstrauischer als gegenüber anderer Menschen (Richter).",['Z.K9'],"[(0, 119)]"
293,20230130_130815_853042,7,bot,Das verstehe ich. Ansprechen möchte ich noch: Durch den Einsatz der jurKI kann der Faktor Subjektivität bei Gerichtsurteilen ausgeräumt werden. Eine jurKI lässt sich nicht etwa durch Mitgefühl von den objektiven Fakten ablenken. Dies führt zu mehr Gerechtigkeit.,"['intro_1', 'z_trans_11', 'Z.P1']","[(0, 18), (18, 46), (46, 263)]"
294,20230130_130815_853042,8,user,"Das ist mir bewusst, dennoch glaube ich, dass KI Urteile nicht zu weniger, sondern zu mehr Berufungen führen würden. Verurteilte oder ihre Anwälte würden beispielsweise auch mMn sehr häufig ""fehlerhafte KI"" plädieren und einen erneuten Prozess verlangen",['Z.P8-2'],"[(0, 254)]"
295,20230130_130815_853042,9,bot,"Du sagst, dass KI keine Werte befolgt. Das ist im Szenario bereits berücksichtigt: Vorschläge aus der Praxis für ethische Grundsätze des Einsatzes von jurKI in der Justiz liegen bereits vor, etwa von der Europäischen Kommission für die Effizienz der Justiz des Europarates (CEPEJ). Der Einsatz der jurKI müsste natürlich auch diesen Grundsätzen folgen.","['intro_27', 'Z.K6', 'intro_56', 'Z.K6-3']","[(0, 15), (15, 39), (39, 83), (83, 353)]"
296,20230130_130815_853042,10,user,"Du wiederholst dich, nein das sage ich nicht. Siehe vorletzte Antwort",['OTHER'],"[(0, 70)]"
297,20230130_130815_853042,11,bot,"Ich bin mir nicht sicher, was du genau meinst. Kannst du das anders ausdrücken?",['intro_62'],"[(0, 80)]"
298,20230130_130815_853042,12,user,"Menschen sind gegenüber ""Maschinen"", also einer KI, sehr viel misstrauischer als gegenüber anderer Menschen (Richter",['Z.K9'],"[(0, 116)]"
299,20230130_130815_853042,13,bot,"Das verstehe ich. Aber hast Du schon einmal daran gedacht: Neben der Umsetzung der Regeln und Leitlinien wird eine jurKI ausschließlich aus selektierten Fällen, die gerade nicht vorurteilsbehaftet und diskriminierend sind, lernen und somit bestehende Vorurteile oder Diskriminierungen nicht berücksichtigen.","['intro_1', 'z_trans_2', 'Z.K6-1-1-1']","[(0, 18), (18, 59), (59, 308)]"
300,20230130_130815_853042,14,user,"Nochmal: ich bezweifle nicht die Qualität und Kompetenz der KI, sondern die (nicht)Akzeptanz der verurteilten über die Urteile einfach nur aufgrund der Tatsache, dass sie von einem Programm, etwas nicht menschlichem, verurteilt wurden.",['Z.P8-2'],"[(0, 236)]"
301,20230130_130815_853042,15,bot,"Dein Argument ist, dass KI keine Werte befolgt. Darauf geht unser Szenario wie folgt ein: Ansprechen möchte ich noch: Die jurKI kann eine hohe Komplexität an Datenmengen verarbeiten und darauf trainiert werden, so viele Korrelationen wie möglich zu identifizieren und dadurch die Faktoren aufdecken, die ein/e menschliche/r Richter:in übersehen könnte.","['intro_25', 'Z.K6', 'intro_55', 'z_trans_11', 'Z.P4']","[(0, 24), (24, 48), (48, 90), (90, 118), (118, 353)]"
302,20230130_130815_853042,16,user,"Ok wir drehen uns im Kreis, wie lange noch bis ich mein Getränk bekomme?",['OTHER'],"[(0, 72)]"
303,20230130_130815_853042,17,bot,"Ich bin mir nicht sicher, was du genau meinst. Kannst du das anders formulieren?",['intro_61'],"[(0, 81)]"
304,20230130_121135_495457,0,user,Bei gerichtlichen Entscheidungen geht es um individuelle Einschätzungen von Situationen die können von der KI eventuell nicht so gut getroffen werden,['Z.K4'],"[(0, 149)]"
305,20230130_121135_495457,1,bot,"Du sagst, dass KI sich irren kann. Das ist möglich, aber nicht sehr wahrscheinlich. Die jurKI wird außerdem Fälle, die sie nicht selbst beurteilen kann, an menschliche Richter:innen delegieren und würde aus diesen für zukünftige, ähnliche Fälle lernen.","['intro_27', 'Z.K10', 'intro_58', 'Z.K10-2']","[(0, 15), (15, 35), (35, 84), (84, 253)]"
306,20230130_121135_495457,2,user,Es geht mir nicht um Fehlurteile die können ja auch bei menschlichen Richtern geschehen,['Z.K10-1'],"[(0, 87)]"
307,20230130_121135_495457,3,bot,"Du merkst an, dass KI keine Werte befolgt. Darauf geht unser Szenario wie folgt ein: Die jurKI ist ein zertifizierter Service des Staates, der die moralischen Leitlinien und Regeln vorgibt. Hierfür werden insb. auch die Erkenntnisse der Philosophie und Computerwissenschaft hinzugezogen und z.B. in ein passendes Diskriminierungsgesetz übersetzt.","['intro_28', 'Z.K6', 'intro_55', 'Z.K6-1']","[(0, 19), (19, 43), (43, 85), (85, 347)]"
308,20230130_121135_495457,4,user,Und wenn die KI von den programmiererInnen mit diskriminierenden Inhalten entwickelt wird,['Z.K6-1-1'],"[(0, 89)]"
309,20230130_121135_495457,5,bot,"Kurz zusammengefasst, KI könnte von fehlerhaften Urteilen falsch lernen und Leitlinien sowie sonstige Regeln verletzen. Darauf geht unser Szenario wie folgt ein: Neben der Umsetzung der Regeln und Leitlinien wird eine jurKI ausschließlich aus selektierten Fällen, die gerade nicht vorurteilsbehaftet und diskriminierend sind, lernen und somit bestehende Vorurteile oder Diskriminierungen nicht berücksichtigen.","['intro_24', 'Z.K6-1-1', 'intro_55', 'Z.K6-1-1-1']","[(0, 22), (22, 120), (120, 162), (162, 411)]"
310,20230130_121135_495457,6,user,Aber gerichtliche Urteile sind ja nicht nur schwarz und weiß sondern müssen viele Informationen mit einbeziehen,['Z.P4-1'],"[(0, 111)]"
311,20230130_121135_495457,7,bot,"Du meinst also, dass KI von fehlerhaften Urteilen falsch lernen und Leitlinien sowie sonstige Regeln verletzen könnte. Das ist im Szenario bereits berücksichtigt: Aber hast Du schon einmal daran gedacht: Durch den Einsatz der jurKI kann der Faktor Subjektivität bei Gerichtsurteilen ausgeräumt werden. Eine jurKI lässt sich nicht etwa durch Mitgefühl von den objektiven Fakten ablenken. Dies führt zu mehr Gerechtigkeit.","['intro_23', 'Z.K6-1-1', 'intro_56', 'z_trans_2', 'Z.P1']","[(0, 21), (21, 119), (119, 163), (163, 204), (204, 421)]"
312,20230130_121135_495457,8,user,Das stimmt und wahrscheinlich kann sie sogar unabhängiger ihr Urteil fällen als ein menscj,['Z.P3'],"[(0, 90)]"
313,20230130_121135_495457,9,bot,"Du merkst an, dass KI keine Werte befolgt. Darauf geht unser Szenario wie folgt ein: Dieser Einwand beruht auf einem technisch überholten Bild und setzt ein idealisiertes Bild von Richter:innen voraus. Das Lernverfahren erfolgt mittlerweile Bottom-Up, also bspw. zunächst anhand kleinerer und einfacher Fälle bis hin zu komplexen und schwierigen Sachverhalten, und der jurKI können Werte beigebracht werden, etwa durch das sog. supervised learning.","['intro_28', 'Z.K6', 'intro_55', 'Z.K6-2']","[(0, 19), (19, 43), (43, 85), (85, 450)]"
314,20230130_121135_495457,10,user,Allerdings können Fehlurteile der ki dann nicht einfach widerrufen werden wenn diese offiziell genutzt wird,['Z.P3-1'],"[(0, 108)]"
315,20230130_121135_495457,11,bot,"Du argumentierst, dass KI keine Werte befolgt. Das ist im Szenario bereits berücksichtigt: Vorschläge aus der Praxis für ethische Grundsätze des Einsatzes von jurKI in der Justiz liegen bereits vor, etwa von der Europäischen Kommission für die Effizienz der Justiz des Europarates (CEPEJ). Der Einsatz der jurKI müsste natürlich auch diesen Grundsätzen folgen.","['intro_26', 'Z.K6', 'intro_56', 'Z.K6-3']","[(0, 23), (23, 47), (47, 91), (91, 361)]"
316,20230130_122726_494547,0,user,"Im Falle eines Präzedenzfalles kann eine Ki nicht differenziert entscheiden, da es vorher noch keinen solchen Fall gab",['FAQ.1'],"[(0, 119)]"
317,20230130_122726_494547,1,bot,"Dir scheint also unklar zu sein, welche Art von Fällen diese KI verhandelt. Unsere jurKI ist auf zivilrechtliche Verfahren spezialisiert, wobei wir das Familienrecht als Teilgebiet explizit nicht hinzuzählen. Strafrechtliche Verfahren schließen wir in unserem Szenario ebenfalls aus. Um hier einen neuen Punkt in die Diskussion einzubringen: Durch den Einsatz der jurKI kann der Faktor Subjektivität bei Gerichtsurteilen ausgeräumt werden. Eine jurKI lässt sich nicht etwa durch Mitgefühl von den objektiven Fakten ablenken. Dies führt zu mehr Gerechtigkeit.","['intro_38', 'FAQ.1', 'FAQ.1-1', 'faq_trans_1', 'Z.P1']","[(0, 33), (33, 76), (76, 284), (284, 342), (342, 559)]"
318,20230130_122726_494547,2,user,Aber eine Ki kann auch durch die subjektivität weniger menschlich entscheiden und so die Situation von Menschen drastisch verschlechtern,['Z.P1-1'],"[(0, 137)]"
319,20230130_122726_494547,3,bot,"Mit anderen Worten, die subjektive Wirkung leidet. Das ist möglich. In Deutschland sitzen die Menschen bereits durchschnittlich über 10h am Tag vor einem Bildschirm. Das zeigt, dass die Menschen keine echte Persönlichkeit vor sich brauchen, auch nicht bei Entscheidungen. Der menschliche Aspekt wird immer weiter in den Hintergrund gedrängt.","['intro_32', 'Z.K11', 'intro_2', 'Z.K11-1']","[(0, 20), (20, 51), (51, 68), (68, 342)]"
320,20230130_122726_494547,4,user,Aber die Menschen die 10h vor dem Bildschirm sitzen interagieren trotzdem menschlich,['Z.K11-1'],"[(0, 84)]"
321,20230130_122726_494547,5,bot,"Du sagst, dass die KI nicht akzeptiert wird. Dein Argument ist nicht spezifisch bzgl. der jurKI sondern gilt für viele fortgeschrittliche Innovationen. Die Pandemie hat bereits dafür gesorgt, dass die Technik viel mehr an Akzeptanz gewinnt. Warum die jurKI als Richter:in nicht an Akzeptanz hinzugewinnen sollte, ist nicht ersichtlich.","['intro_27', 'Z.K9', 'intro_57', 'Z.K9-1']","[(0, 15), (15, 45), (45, 152), (152, 336)]"
322,20230130_122726_494547,6,user,Weil es trotzdem manipulierbar ist durch beispielsweise Hacker,['Z.K14'],"[(0, 63)]"
323,20230130_122726_494547,7,bot,"Ich bin mir nicht sicher, was du genau meinst. Kannst du das anders formulieren?",['intro_61'],"[(0, 81)]"
324,20230130_120133_886216,0,user,Das Urteil sollte am Ende von einem Menschen ausgeübt werden,['NZ.K10'],"[(0, 60)]"
325,20230130_120133_886216,1,bot,"Mit anderen Worten, KI befolgt keine Werte. Das ist im Szenario bereits berücksichtigt: Die jurKI ist ein zertifizierter Service des Staates, der die moralischen Leitlinien und Regeln vorgibt. Hierfür werden insb. auch die Erkenntnisse der Philosophie und Computerwissenschaft hinzugezogen und z.B. in ein passendes Diskriminierungsgesetz übersetzt.","['intro_32', 'Z.K6', 'intro_56', 'Z.K6-1']","[(0, 20), (20, 44), (44, 88), (88, 350)]"
326,20230130_120133_886216,2,user,Ist die KI immer zuverlässig?,['OTHER'],"[(0, 29)]"
327,20230130_120133_886216,3,bot,"Dein Argument ist, dass KI keine Werte befolgt. Darauf geht unser Szenario wie folgt ein: Dieser Einwand beruht auf einem technisch überholten Bild und setzt ein idealisiertes Bild von Richter:innen voraus. Das Lernverfahren erfolgt mittlerweile Bottom-Up, also bspw. zunächst anhand kleinerer und einfacher Fälle bis hin zu komplexen und schwierigen Sachverhalten, und der jurKI können Werte beigebracht werden, etwa durch das sog. supervised learning.","['intro_25', 'Z.K6', 'intro_55', 'Z.K6-2']","[(0, 24), (24, 48), (48, 90), (90, 455)]"
328,20230130_120857_980064,0,user,Menschliche Fehler und menschliches Handeln kann nur von menschlicher Intelligenz beurteilt werden,['Z.P1-1'],"[(0, 98)]"
329,20230130_120857_980064,1,bot,"Du argumentierst, dass Bei der KI strukturelle Fehler möglich sind. Das kann ich nachvollziehen. Direkt dazu: Ein fehlerhaftes Urteil durch die jurKI hat die gleiche Tragweite und Auswirkung wie ein fehlerhaftes Urteil durch eine:n menschliche:n Richter:in. Daher besteht kein Grund hier von weitreichenderen Schäden bei der jurKI als Richter:in auszugehen.","['intro_26', 'Z.P3-1', 'intro_48', 'Z.P3-1-2']","[(0, 23), (23, 68), (68, 110), (110, 358)]"
330,20230130_120857_980064,2,user,Ich meine dass durch  eine KI nicht alle umstände eines komplexen Falles betrachtet und winbezogen werden können.,['Z.P4-1'],"[(0, 113)]"
331,20230130_120857_980064,3,bot,"Dir scheint also unklar zu sein, welche Art von Fällen diese KI verhandelt. Unsere jurKI ist auf zivilrechtliche Verfahren spezialisiert, wobei wir das Familienrecht als Teilgebiet explizit nicht hinzuzählen. Strafrechtliche Verfahren schließen wir in unserem Szenario ebenfalls aus. Was denkst du denn darüber: Durch den Einsatz der jurKI kann der Faktor Subjektivität bei Gerichtsurteilen ausgeräumt werden. Eine jurKI lässt sich nicht etwa durch Mitgefühl von den objektiven Fakten ablenken. Dies führt zu mehr Gerechtigkeit.","['intro_38', 'FAQ.1', 'FAQ.1-1', 'faq_trans_2', 'Z.P1']","[(0, 33), (33, 76), (76, 284), (284, 312), (312, 529)]"
332,20230130_120857_980064,4,user,Mitgefühl ist jedoch auch Bestandteil eines für mich fairen Verfahrens,['Z.P1-1'],"[(0, 70)]"
333,20230130_120857_980064,5,bot,"Ich bin mir nicht sicher, was du genau meinst. Kannst du das anders formulieren?",['intro_61'],"[(0, 81)]"
334,20230130_120857_980064,6,user,"Dadurch dass ein jurKI kein Mitgefühl sind Urteile zwar einheitlich, jedoch nicht automatisch fairer",['Z.P1-1'],"[(0, 100)]"
335,20230130_120857_980064,7,bot,"Das ist möglich. Um auch noch einmal eine andere Seite zu beleuchten: Neben der Umsetzung der Regeln und Leitlinien wird eine jurKI ausschließlich aus selektierten Fällen, die gerade nicht vorurteilsbehaftet und diskriminierend sind, lernen und somit bestehende Vorurteile oder Diskriminierungen nicht berücksichtigen.","['intro_2', 'z_trans_13', 'Z.K6-1-1-1']","[(0, 17), (17, 70), (70, 319)]"
336,20230130_120857_980064,8,user,"Diesem Argument stimme ich zu, jedoch kann auch Diskriminierung den Fallhergang beeinflussen, was wiederum nicht vom jurKI berücksichtigt werden kann.","['CONSENT', 'Z.P4-1']","[(0, 30), (30, 150)]"
337,20230130_120857_980064,9,bot,"Ich bin mir nicht sicher, was du genau meinst. Kannst du das anders ausdrücken?",['intro_62'],"[(0, 80)]"
338,20230130_120857_980064,10,user,Jedoch wie selektiert man die Fälle,['Z.K6-1-1-1'],"[(0, 35)]"
339,20230130_120857_980064,11,bot,"Das mag sein. Aber hast Du schon einmal daran gedacht: Die jurKI kann eine hohe Komplexität an Datenmengen verarbeiten und darauf trainiert werden, so viele Korrelationen wie möglich zu identifizieren und dadurch die Faktoren aufdecken, die ein/e menschliche/r Richter:in übersehen könnte.","['intro_3', 'z_trans_2', 'Z.P4']","[(0, 14), (14, 55), (55, 290)]"
340,20230130_120857_980064,12,user,Wie stark die Faktoren berücksichtigen  werden soll kann die jurKI nicht einbeziehen,['Z.P4-1'],"[(0, 84)]"
341,20230130_120857_980064,13,bot,"Du sagst, dass eine KI auch nicht stets alle Faktoren aufdecken kann. Da gebe ich dir recht. Darüber hinaus finde ich, dass hier noch folgendes beachtet werden sollte: Massenverfahren nehmen zu und das Justiz-System ist überlastet. Richter:innen haben meist nicht genügend Zeit, die Fälle innerhalb ihrer regulären Arbeitszeit zu erledigen. Eine jurKI arbeitet losgelöst von einer Arbeitszeit 24/7. Das ist im Interesse aller Beteiligten.","['intro_27', 'Z.P4-1', 'intro_6', 'z_trans_1', 'Z.P2']","[(0, 15), (15, 70), (70, 93), (93, 168), (168, 439)]"
342,20230130_120857_980064,14,user,Stimmt bei ausgewählten trivialen Fällen,['CONSENT'],"[(0, 40)]"
343,20230130_120857_980064,15,bot,"Dir scheint also unklar zu sein, welche Art von Fällen diese KI verhandelt. Um hier einen neuen Punkt in die Diskussion einzubringen: Die jurKI ist ein zertifizierter Service des Staates, der die moralischen Leitlinien und Regeln vorgibt. Hierfür werden insb. auch die Erkenntnisse der Philosophie und Computerwissenschaft hinzugezogen und z.B. in ein passendes Diskriminierungsgesetz übersetzt.","['intro_38', 'FAQ.1', 'faq_trans_1', 'Z.K6-1']","[(0, 33), (33, 76), (76, 134), (134, 396)]"
344,20230130_120857_980064,16,user,Die moralischen Leitlinien und Regeln sind allerdings auch im Wandel dies müsste auch berücksichtigt werde,['Z.K6'],"[(0, 107)]"
345,20230130_120857_980064,17,bot,"Du merkst an, dass KI keine Werte befolgt. Das ist im Szenario bereits berücksichtigt: Dieser Einwand beruht auf einem technisch überholten Bild und setzt ein idealisiertes Bild von Richter:innen voraus. Das Lernverfahren erfolgt mittlerweile Bottom-Up, also bspw. zunächst anhand kleinerer und einfacher Fälle bis hin zu komplexen und schwierigen Sachverhalten, und der jurKI können Werte beigebracht werden, etwa durch das sog. supervised learning.","['intro_28', 'Z.K6', 'intro_56', 'Z.K6-2']","[(0, 19), (19, 43), (43, 87), (87, 452)]"
346,20230130_115812_386445,0,user,Moral schwierig zu definieren,['Z.K6'],"[(0, 29)]"
347,20230130_115812_386445,1,bot,"Ich bin mir nicht sicher, was du genau meinst. Kannst du das anders formulieren?",['intro_61'],"[(0, 81)]"
348,20230130_115812_386445,2,user,Ki können nicht moralisch handeln,['Z.K6'],"[(0, 33)]"
349,20230130_115812_386445,3,bot,Das verstehe ich. Ansprechen möchte ich noch: Durch den Einsatz der jurKI kann der Faktor Subjektivität bei Gerichtsurteilen ausgeräumt werden. Eine jurKI lässt sich nicht etwa durch Mitgefühl von den objektiven Fakten ablenken. Dies führt zu mehr Gerechtigkeit.,"['intro_1', 'z_trans_11', 'Z.P1']","[(0, 18), (18, 46), (46, 263)]"
350,20230130_115812_386445,4,user,Aber mitgefühl ist manchmal wichtig,['Z.K2'],"[(0, 35)]"
351,20230130_115812_386445,5,bot,"Ich bin mir nicht sicher, was du genau meinst. Kannst du das anders ausdrücken?",['intro_62'],"[(0, 80)]"
352,20230130_115812_386445,6,user,Aber KI können nicht äußere Umstände miteinbeziehen,['Z.P4-1'],"[(0, 51)]"
353,20230130_115812_386445,7,bot,"Das mag sein. Ansprechen möchte ich noch: Neben der Umsetzung der Regeln und Leitlinien wird eine jurKI ausschließlich aus selektierten Fällen, die gerade nicht vorurteilsbehaftet und diskriminierend sind, lernen und somit bestehende Vorurteile oder Diskriminierungen nicht berücksichtigen.","['intro_3', 'z_trans_11', 'Z.K6-1-1-1']","[(0, 14), (14, 42), (42, 291)]"
354,20230130_115812_386445,8,user,KI können manipuliert werden,['Z.K14'],"[(0, 28)]"
