Unnamed: 0,dialogue,utterance_id,utterance_type,utterance_text,labels,bounds
181,20230130_122507_078392,5,bot,Das ist möglich. Aber hast Du schon einmal daran gedacht: Durch den Einsatz der jurKI kann der Faktor Subjektivität bei Gerichtsurteilen ausgeräumt werden. Eine jurKI lässt sich nicht etwa durch Mitgefühl von den objektiven Fakten ablenken. Dies führt zu mehr Gerechtigkeit.,"['intro_2', 'z_trans_2', 'Z.P1']","[(0, 17), (17, 58), (58, 275)]"
182,20230130_122507_078392,6,user,"Aber objektive Fakten sind auch nicht immer die vollkommene Wahrheit,",['OTHER'],"[(0, 69)]"
183,20230130_122507_078392,7,bot,"Mit anderen Worten, eine KI kann auch nicht stets alle Faktoren aufdecken. Dem würde ich zustimmen. Aber zu beachten ist: Die jurKI kann eine hohe Komplexität an Datenmengen verarbeiten und darauf trainiert werden, so viele Korrelationen wie möglich zu identifizieren und dadurch die Faktoren aufdecken, die ein/e menschliche/r Richter:in übersehen könnte.","['intro_32', 'Z.P4-1', 'intro_4', 'z_trans_12', 'Z.P4']","[(0, 20), (20, 75), (75, 100), (100, 122), (122, 357)]"
184,20230130_122507_078392,8,user,Was ist mit dem Heinz Dilemma?,['OTHER'],"[(0, 30)]"
185,20230130_122507_078392,9,bot,"Ich bin mir nicht sicher, was du genau meinst. Kannst du das anders ausdrücken?",['intro_62'],"[(0, 80)]"
186,20230130_122507_078392,10,user,Oder mit RWE/Lützerath?,['OTHER'],"[(0, 23)]"
187,20230130_122507_078392,11,bot,"Das mag sein. Aber hast Du schon einmal daran gedacht: Neben der Umsetzung der Regeln und Leitlinien wird eine jurKI ausschließlich aus selektierten Fällen, die gerade nicht vorurteilsbehaftet und diskriminierend sind, lernen und somit bestehende Vorurteile oder Diskriminierungen nicht berücksichtigen.","['intro_3', 'z_trans_2', 'Z.K6-1-1-1']","[(0, 14), (14, 55), (55, 304)]"
188,20230130_122507_078392,12,user,"Aber die richtige Bildung und Aufklärung ist ein Faktor, der Vorurteile abschaffen kann",['OTHER'],"[(0, 87)]"
189,20230130_122507_078392,13,bot,"Mit anderen Worten, eine KI kann auch nicht stets alle Faktoren aufdecken. Ich denke damit liegst du richtig. Darüber hinaus finde ich, dass hier noch folgendes beachtet werden sollte: Massenverfahren nehmen zu und das Justiz-System ist überlastet. Richter:innen haben meist nicht genügend Zeit, die Fälle innerhalb ihrer regulären Arbeitszeit zu erledigen. Eine jurKI arbeitet losgelöst von einer Arbeitszeit 24/7. Das ist im Interesse aller Beteiligten.","['intro_32', 'Z.P4-1', 'intro_5', 'z_trans_1', 'Z.P2']","[(0, 20), (20, 75), (75, 110), (110, 185), (185, 456)]"
190,20230130_122507_078392,14,user,"Aber vielleicht bringt genau die Wartezeit neue Betrachtungsweisen oder Beweise ans Licht, die in kürzerer Zeit nicht berücksichtigt werden konnten",['Z.P2-2'],"[(0, 147)]"
191,20230130_122507_078392,15,bot,"Ich bin mir nicht sicher, was du genau meinst. Kannst du das anders ausdrücken?",['intro_62'],"[(0, 80)]"
192,20230130_122507_078392,16,user,"Die reguläre Arbeitszeit von Richter*innen sorgt manchmal dafür, dass Sachen auch einen anderen Blickwinkel erhalten",['Z.P2-2'],"[(0, 116)]"
193,20230130_122507_078392,17,bot,"Das mag sein. Ansprechen möchte ich noch: Die jurKI ist ein zertifizierter Service des Staates, der die moralischen Leitlinien und Regeln vorgibt. Hierfür werden insb. auch die Erkenntnisse der Philosophie und Computerwissenschaft hinzugezogen und z.B. in ein passendes Diskriminierungsgesetz übersetzt.","['intro_3', 'z_trans_11', 'Z.K6-1']","[(0, 14), (14, 42), (42, 304)]"
194,20230130_122507_078392,18,user,"Das ist wichtig ,v.a. der moralische Aspekt",['OTHER'],"[(0, 44)]"
195,20230130_122507_078392,19,bot,"Ich bin mir nicht sicher, was du genau meinst. Kannst du das anders ausdrücken?",['intro_62'],"[(0, 80)]"
196,20230130_122507_078392,20,user,Der moralische Leitfaden ist zielführend,['Z.K6-1'],"[(0, 40)]"
197,20230130_122507_078392,21,bot,Das mag sein. Um auch noch einmal eine andere Seite zu beleuchten: Transparenz und Interpretierbarkeit könnten Zurechnungshindernisse bei der jurKI überwinden. Die jurKI folgt einem strikten Regelwerk und wäre hierdurch durchaus in der Lage ihre Entscheidung zu begründen.,"['intro_3', 'z_trans_13', 'Z.K2-1']","[(0, 14), (14, 67), (67, 273)]"
198,20230130_172145_459723,0,user,Da eine KI nach Fakten und Erfahrungswerten abwägen aber nicht mit ethischem / moralischen Gewissen Fälle deuten kann.,['Z.K6'],"[(0, 119)]"
199,20230130_172145_459723,1,bot,"Dir scheint also unklar zu sein, welche Art von Fällen diese KI verhandelt. Unsere jurKI ist auf zivilrechtliche Verfahren spezialisiert, wobei wir das Familienrecht als Teilgebiet explizit nicht hinzuzählen. Strafrechtliche Verfahren schließen wir in unserem Szenario ebenfalls aus. Um hier einen neuen Punkt in die Diskussion einzubringen: Durch den Einsatz der jurKI kann der Faktor Subjektivität bei Gerichtsurteilen ausgeräumt werden. Eine jurKI lässt sich nicht etwa durch Mitgefühl von den objektiven Fakten ablenken. Dies führt zu mehr Gerechtigkeit.","['intro_38', 'FAQ.1', 'FAQ.1-1', 'faq_trans_1', 'Z.P1']","[(0, 33), (33, 76), (76, 284), (284, 342), (342, 559)]"
200,20230130_172145_459723,2,user,Ich bin nicht davon Überzeugt dass das Rechtssystem gerecht ist. D. H. wenn die KI objektiv gesehen Rechte ohne Mitgefühl durchsetzt handelt sie nach dem Recht richtig. Nach meinem ideologischen Rechtsempfinden jedoch nicht.,['Z.K6'],"[(0, 225)]"
201,20230130_172145_459723,3,bot,"Du argumentierst, dass KI keine Werte befolgt. Das ist im Szenario bereits berücksichtigt: Die jurKI ist ein zertifizierter Service des Staates, der die moralischen Leitlinien und Regeln vorgibt. Hierfür werden insb. auch die Erkenntnisse der Philosophie und Computerwissenschaft hinzugezogen und z.B. in ein passendes Diskriminierungsgesetz übersetzt.","['intro_26', 'Z.K6', 'intro_56', 'Z.K6-1']","[(0, 23), (23, 47), (47, 91), (91, 353)]"
202,20230130_172145_459723,4,user,Meiner Meinung nach sollten sich die moralischen Leitlinien und Regeln des Staates immer weiter entwickeln. Das passiert nur sehr langsam. Würde die KI diese Weiter entwickeln auch wenn die staatlichen Bedingungen sich noch nicht entwickelt haben?,['OTHER'],"[(0, 247)]"
203,20230130_172145_459723,5,bot,"Dein Argument ist, dass KI keine Werte befolgt. Darauf geht unser Szenario wie folgt ein: Dieser Einwand beruht auf einem technisch überholten Bild und setzt ein idealisiertes Bild von Richter:innen voraus. Das Lernverfahren erfolgt mittlerweile Bottom-Up, also bspw. zunächst anhand kleinerer und einfacher Fälle bis hin zu komplexen und schwierigen Sachverhalten, und der jurKI können Werte beigebracht werden, etwa durch das sog. supervised learning.","['intro_25', 'Z.K6', 'intro_55', 'Z.K6-2']","[(0, 24), (24, 48), (48, 90), (90, 455)]"
204,20230130_172145_459723,6,user,Was bedeutet das supervised learning für das Rechtssystem?,['OTHER'],"[(0, 59)]"
205,20230130_172145_459723,7,bot,"Kurz zusammengefasst, unterschiedliche Richter:innen führen zu unterschiedlichen Urteilen, aufgrund verschiedener richtiger Abwägungen. Das ist ein gutes Argument. Aber zu beachten ist: Richter:innen stehen intern und extern unter enormem Druck. Die jurKI verspürt keinen Druck und erzielt gleichbleibend gute Ergebnisse. Stabile, nichtdiskriminierende Schlussfolgerungen fördern ein einheitliches Entscheidungsergebnis sowie Stabilität und Autorität des Rechts.","['intro_24', 'Z.P1-2', 'intro_52', 'z_trans_12', 'Z.P3']","[(0, 22), (22, 136), (136, 164), (164, 186), (186, 463)]"
206,20230130_172145_459723,8,user,Das sehe ich auch so. Richter*innen und Ausübende der Staatsgewalt handeln oft nach öffentlichem Druck. Doch würde die KI nicht auch vor allem aufgrund von Informationen handeln die eben diese beeinflussten Menschen ihr geben?,"['CONSENT', 'Z.K10']","[(0, 104), (104, 227)]"
207,20230130_172145_459723,9,bot,"Mit anderen Worten, KI befolgt keine Werte. Das ist im Szenario bereits berücksichtigt: Vorschläge aus der Praxis für ethische Grundsätze des Einsatzes von jurKI in der Justiz liegen bereits vor, etwa von der Europäischen Kommission für die Effizienz der Justiz des Europarates (CEPEJ). Der Einsatz der jurKI müsste natürlich auch diesen Grundsätzen folgen.","['intro_32', 'Z.K6', 'intro_56', 'Z.K6-3']","[(0, 20), (20, 44), (44, 88), (88, 358)]"
208,20230130_172145_459723,10,user,"D. H. Eine KI könnte komplexere ethische Abwägungen lösen als ein Mensch, da sie nicht subjektiv ist?",['OTHER'],"[(0, 101)]"
209,20230130_172145_459723,11,bot,"Du merkst an, dass die subjektive Wirkung leidet. Das ist möglich. In Deutschland sitzen die Menschen bereits durchschnittlich über 10h am Tag vor einem Bildschirm. Das zeigt, dass die Menschen keine echte Persönlichkeit vor sich brauchen, auch nicht bei Entscheidungen. Der menschliche Aspekt wird immer weiter in den Hintergrund gedrängt.","['intro_28', 'Z.K11', 'intro_2', 'Z.K11-1']","[(0, 19), (19, 50), (50, 67), (67, 341)]"
210,20230130_172145_459723,12,user,"Ist nicht genau das ein Gegenargument? Daraus könnte man doch schließen, dass der menschliche Aspekt bei Gerichtsurteilen durch eine KI noch viel mehr in den Hintergrund rücken würde. So passiert es bereits jetzt. Bestünde dann nicht verstärkt die Gefahr dass man übersieht über Menschen zu urteilen und nur noch darauf fokussiert ist Recht umzusetzen?",['Z.P1-1'],"[(0, 353)]"
211,20230130_172145_459723,13,bot,"Du merkst an, dass KI keine Werte befolgt. Das ist im Szenario bereits berücksichtigt: Ein weiterer Gesichtspunkt gehört hierher. Neben der Umsetzung der Regeln und Leitlinien wird eine jurKI ausschließlich aus selektierten Fällen, die gerade nicht vorurteilsbehaftet und diskriminierend sind, lernen und somit bestehende Vorurteile oder Diskriminierungen nicht berücksichtigen.","['intro_28', 'Z.K6', 'intro_56', 'z_trans_16', 'Z.K6-1-1-1']","[(0, 19), (19, 43), (43, 87), (87, 130), (130, 379)]"
212,20230130_172145_459723,14,user,Werden die präzedenzfälle von der KI ausgesucht?,['OTHER'],"[(0, 48)]"
213,20230130_172145_459723,15,bot,"Dein Argument ist, dass KI keine Werte befolgt. Das ist im Szenario bereits berücksichtigt: Aber hast Du schon einmal daran gedacht: Die jurKI kann eine hohe Komplexität an Datenmengen verarbeiten und darauf trainiert werden, so viele Korrelationen wie möglich zu identifizieren und dadurch die Faktoren aufdecken, die ein/e menschliche/r Richter:in übersehen könnte.","['intro_25', 'Z.K6', 'intro_56', 'z_trans_2', 'Z.P4']","[(0, 24), (24, 48), (48, 92), (92, 133), (133, 368)]"
214,20230130_172145_459723,16,user,"Ich kann mir vorstellen dass die KI hilft zu überwachen, ob Rechtssprechung objektiv ist. Allerdings scheint es mir eine Utopie dass das Rechtssystem rein durch die Einführung von KI plötzlich gerecht ist. Dazu braucht es ncih mehr Veränderung. Die die KI natürlich umsetzen könnte. Aber zuvor müssen dennoch Menschen diese Veränderungen schaffen.",['NZ_ARG'],"[(0, 347)]"
215,20230130_172145_459723,17,bot,"Dein Argument ist, dass KI keine Werte befolgt. Das ist im Szenario bereits berücksichtigt: Um auch noch einmal eine andere Seite zu beleuchten: Transparenz und Interpretierbarkeit könnten Zurechnungshindernisse bei der jurKI überwinden. Die jurKI folgt einem strikten Regelwerk und wäre hierdurch durchaus in der Lage ihre Entscheidung zu begründen.","['intro_25', 'Z.K6', 'intro_56', 'z_trans_13', 'Z.K2-1']","[(0, 24), (24, 48), (48, 92), (92, 145), (145, 351)]"
216,20230130_114750_982210,0,user,Ki machen weniger Fehler und haben einen größeren Zugang zu Entscheidungen und Regeln die für Entscheidung wichtig sind.,['Z.P3'],"[(0, 120)]"
217,20230130_114750_982210,1,bot,"Du argumentierst, dass die KI nicht unter Druck steht. Das kann ich nachvollziehen. Direkt dazu: Da die JurKI bei gleichem Input immer das gleiche Ergebnis liefern würde, würden Fehler an vielen Stellen gleichzeitig passieren und wären so deutliche weitreichender, als die eines Menschen.","['intro_26', 'Z.P3', 'intro_48', 'Z.P3-1']","[(0, 23), (23, 55), (55, 97), (97, 290)]"
218,20230130_114750_982210,2,user,Die KI ist lernfähig und es bleiben immer noch höhere Instanzen,"['Z.P3-1-1', 'Z.K3-2']","[(0, 20), (20, 63)]"
219,20230130_114750_982210,3,bot,"Kurz zusammengefasst, moralische Leitlinien und Regeln sind vorgegeben. Das ist ein gutes Argument. Andererseits: Die Regel und Leitlinien sind schnell erlassen, allerdings dürfte sich die Umsetzung beispielsweise eines Diskriminierungsgesetzes für die jurKI als schwierig erweisen, da eine KI auch aus Fällen lernt, in denen möglicherweise vorurteilsbehaftet und diskriminierend von menschlichen Richter:innen entschieden wurde.","['intro_24', 'Z.K6-1', 'intro_46', 'Z.K6-1-1']","[(0, 22), (22, 72), (72, 114), (114, 430)]"
220,20230130_114750_982210,4,user,"Dieser Bias ist natürlich vorstanden. Aber auch Richtlinien sind einprogrammiert, zudem ist die Härte von strafrechtlichen Entscheidungen bei Männern statistisch größer.","['OTHER', 'Z.K6-1']","[(0, 38), (38, 169)]"
221,20230130_114750_982210,5,bot,"Dein Argument ist, dass die KI nicht unter Druck steht. Das verstehe ich. Darüber hinaus finde ich, dass hier noch folgendes beachtet werden sollte: Um Gesetze zu interpretieren und anzuwenden bedarf es stets einer menschlichen Bewertung, ein sog. Werturteil. Das kann nur duch empathische Richter:innen sichergestellt werden, ohne zu riskieren, dass die menschlichen Rechte und die Würde verletzt bzw. beeinträchtigt werden.","['intro_25', 'Z.P3', 'intro_54', 'z_trans_1', 'Z.P1-1']","[(0, 24), (24, 56), (56, 74), (74, 149), (149, 426)]"
222,20230130_114750_982210,6,user,Empathie macht Menschen auch angreifbar und erpressbar. Dies ist bei KI nicht gegeben.,['Z.P3'],"[(0, 86)]"
223,20230130_114750_982210,7,bot,"Mit anderen Worten, KI lernt nur aus vorurteils- und diskriminierungsfreien Fällen. Das verstehe ich. Darüber hinaus finde ich, dass hier noch folgendes beachtet werden sollte: Die Entwicklung von KI ist bisher nahezu keinen moralischen Leitlinien und Regeln unterworfen und kann nicht werten. Richter:innen hingegen bekennen sich zu Werten durch die Ausübung ihres Berufs und des rechtlichen Rahmens.","['intro_32', 'Z.K6-1-1-1', 'intro_54', 'z_trans_1', 'Z.K6']","[(0, 20), (20, 84), (84, 102), (102, 177), (177, 402)]"
224,20230130_114750_982210,8,user,Viele Richter aber auch zu Werten die nicht die Werte des Staats und des Gesetz sind. Viele Juristen neigen dazu rechts zu sein.,['NZ_ARG'],"[(0, 128)]"
225,20230130_114750_982210,9,bot,"Kurz zusammengefasst, moralische Leitlinien und Regeln sind vorgegeben. Das kann ich nachvollziehen. Darüber hinaus finde ich, dass hier noch folgendes beachtet werden sollte: Eine jurKI kann sich in ihrer Entscheidungsfindung irren und zu einem falschen Ergebnis kommen.","['intro_24', 'Z.K6-1', 'intro_53', 'z_trans_1', 'Z.K10']","[(0, 22), (22, 72), (72, 101), (101, 176), (176, 272)]"
226,20230130_114750_982210,10,user,Wie Menschen auch. Das war mein erster Punkt,['Z.K10-1'],"[(0, 44)]"
227,20230130_114750_982210,11,bot,"Ich bin mir nicht sicher, was du genau meinst. Kannst du das anders formulieren?",['intro_61'],"[(0, 81)]"
228,20230130_114750_982210,12,user,Geh bitte meine Argumente nochmal durch. Du hast noch nicht auf alles Bezug genommen.,['OTHER'],"[(0, 85)]"
229,20230130_114750_982210,13,bot,"Das mag sein. Um auch noch einmal eine andere Seite zu beleuchten: Die jurKI kann dem/der Adressat:in ihrer Macht nicht menschlich begegnen, sondern dies allenfalls simulieren, da die Black Box undurchschaubar ist. Wie kann sie über das Leben der Bürger:innen urteilen, wenn sie hiervon keine Ahnung hat?","['intro_3', 'z_trans_13', 'Z.K2']","[(0, 14), (14, 67), (67, 306)]"
230,20230130_114750_982210,14,user,Das können Menschen auch nur bedingt erreichen. Ein gutes Modell ist kaum unterscheidbar von der Realität.,['Z.K2-1-2-1'],"[(0, 106)]"
231,20230130_114750_982210,15,bot,"Ich bin mir nicht sicher, was du genau meinst. Kannst du das anders ausdrücken?",['intro_62'],"[(0, 80)]"
232,20230130_124412_728645,0,user,"es gibt zu wenig Richter, um alle zukünftigen Fälle zu bearbeiten",['Z.P2'],"[(0, 65)]"
233,20230130_124412_728645,1,bot,"Wenn ich richtig verstanden habe, fragst du  welche Art von Fällen diese KI verhandelt. Unsere jurKI ist auf zivilrechtliche Verfahren spezialisiert, wobei wir das Familienrecht als Teilgebiet explizit nicht hinzuzählen. Strafrechtliche Verfahren schließen wir in unserem Szenario ebenfalls aus. Was denkst du denn darüber: Die Entwicklung von KI ist bisher nahezu keinen moralischen Leitlinien und Regeln unterworfen und kann nicht werten. Richter:innen hingegen bekennen sich zu Werten durch die Ausübung ihres Berufs und des rechtlichen Rahmens.","['intro_37', 'FAQ.1', 'FAQ.1-1', 'faq_trans_2', 'Z.K6']","[(0, 45), (45, 88), (88, 296), (296, 324), (324, 549)]"
234,20230130_124412_728645,2,user,"Ja, das ist richtig. Ein Richter muss auch nach seinem Gewissen entscheiden können und diese Aufgabe kann keine KI übernehmen. Höchstens zur Unterstützung der Prozesse sollte sie eingesetzt werden","['CONSENT', 'Z.P1-1', 'NZ.K10']","[(0, 21), (21, 126), (126, 196)]"
235,20230130_124412_728645,3,bot,"Wenn ich richtig verstanden habe, fragst du  warum es hier nicht um eine die Richter:innen unterstützende KI geht. Eine Richter:innen unterstützende KI, bspw. zum Auslesen von eingereichten Schriftsätzen und zur Einordnung von Daten in elektronische Akten, ist bereits in einigen Gerichten im Einsatz und aus ethischer Sicht relativ unproblematisch. Um hier einen neuen Punkt in die Diskussion einzubringen: Die jurKI kann dem/der Adressat:in ihrer Macht nicht menschlich begegnen, sondern dies allenfalls simulieren, da die Black Box undurchschaubar ist. Wie kann sie über das Leben der Bürger:innen urteilen, wenn sie hiervon keine Ahnung hat?","['intro_37', 'FAQ.2', 'FAQ.2-1', 'faq_trans_1', 'Z.K2']","[(0, 45), (45, 115), (115, 350), (350, 408), (408, 647)]"
236,20230130_124412_728645,4,user,Gar nicht. Oft müssen auch Lebensumstände mitgedacht und nicht nur neutrales mit einbezogen werden,"['OTHER', 'Z.P4-1']","[(0, 11), (11, 99)]"
237,20230130_124412_728645,5,bot,"Ich bin mir nicht sicher, was du genau meinst. Kannst du das anders formulieren?",['intro_61'],"[(0, 81)]"
238,20230130_124412_728645,6,user,"Für den Richter sind nicht nur Fakten, sondern auch die Lebensumstände der Person entscheidend. Das kann eine KI nicht verstehen",['Z.P4-1'],"[(0, 129)]"
239,20230130_124412_728645,7,bot,Das verstehe ich. Ansprechen möchte ich noch: Die von der jurKI präsentierten Ergebnisse sind in ihrer Ausgabe weniger flexibel. Die Befassung menschlicher Richter:innen zur endgültigen Entscheidung erlaubt ihnen die Ausübung der notwendigen Ermessensmacht. Dies ist Ausdruck einer individualisierten Rechtsprechung.,"['intro_1', 'z_trans_11', 'Z.K4']","[(0, 18), (18, 46), (46, 317)]"
240,20230130_124412_728645,8,user,Das ist richtig. Deswegen sollte eine endgültige Entscheidung niemals von einer KI übernommen werden,"['CONSENT', 'NZ.K10']","[(0, 17), (17, 101)]"
241,20230130_124412_728645,9,bot,"Du argumentierst, dass die KI nicht unter Druck steht. Das ist ein gutes Argument. Andererseits: Da die JurKI bei gleichem Input immer das gleiche Ergebnis liefern würde, würden Fehler an vielen Stellen gleichzeitig passieren und wären so deutliche weitreichender, als die eines Menschen.","['intro_26', 'Z.P3', 'intro_46', 'Z.P3-1']","[(0, 23), (23, 55), (55, 97), (97, 290)]"
242,20230130_124412_728645,10,user,Genau. Rechtssprechung muss zu einem gewissen Grad individuell sein,['Z.K4'],"[(0, 67)]"
243,20230130_124412_728645,11,bot,"Ich bin mir nicht sicher, was du genau meinst. Kannst du das anders ausdrücken?",['intro_62'],"[(0, 80)]"
244,20230130_124412_728645,12,user,Jeder Fall muss mit seinen Eigenheiten behandelt werden,['Z.K4'],"[(0, 56)]"
245,20230130_124412_728645,13,bot,"Das verstehe ich. Aber zu beachten ist: Die jurKI als Richter:in könnte auf wenig Akzeptanz in der Gesellschaft stoßen. Immerhin will man als Mensch von der Justiz wahrgenommen werden und nicht von einem Programm einfach und schnell ""verwertet"" werden.","['intro_1', 'z_trans_12', 'Z.K9']","[(0, 18), (18, 40), (40, 253)]"
246,20230130_140913_003081,0,user,KI kann rational entscheiden und ist unabhängig von Emotionen und Erfahrungen,['Z.P1'],"[(0, 78)]"
247,20230130_140913_003081,1,bot,"Du merkst an, dass moralische Leitlinien und Regeln vorgegeben sind. Das verstehe ich. Direkt dazu: Die Regel und Leitlinien sind schnell erlassen, allerdings dürfte sich die Umsetzung beispielsweise eines Diskriminierungsgesetzes für die jurKI als schwierig erweisen, da eine KI auch aus Fällen lernt, in denen möglicherweise vorurteilsbehaftet und diskriminierend von menschlichen Richter:innen entschieden wurde.","['intro_28', 'Z.K6-1', 'intro_51', 'Z.K6-1-1']","[(0, 19), (19, 69), (69, 100), (100, 416)]"
248,20230130_140913_003081,2,user,"Leider wahr, allerdings könnte die KI auch nicht auf Stigmatisierungen und Vorurteile eingehen, wenn sie Herkunft, Geschlecht und Alter nicht weiß",['Z.K6-1-1-1'],"[(0, 147)]"
249,20230130_140913_003081,3,bot,"Kurz zusammengefasst, KI lernt nur aus vorurteils- und diskriminierungsfreien Fällen. Das verstehe ich. Darüber hinaus finde ich, dass hier noch folgendes beachtet werden sollte: Die Entwicklung von KI ist bisher nahezu keinen moralischen Leitlinien und Regeln unterworfen und kann nicht werten. Richter:innen hingegen bekennen sich zu Werten durch die Ausübung ihres Berufs und des rechtlichen Rahmens.","['intro_24', 'Z.K6-1-1-1', 'intro_54', 'z_trans_1', 'Z.K6']","[(0, 22), (22, 86), (86, 104), (104, 179), (179, 404)]"
250,20230130_140913_003081,4,user,"Werten, die jedoch auch unmoralisch sein können, beispielsweise die Richter der jungen Bundesrepublik waren häufig ideologisch noch im Nationalsozialismus verankert",['OTHER'],"[(0, 164)]"
251,20230130_140913_003081,5,bot,"Du merkst an, dass die KI günstiger ist. Das kann ich nachvollziehen. Direkt dazu: Man müsste wie in unserem Szenario auch gegen eine jurKI eine Berufung einer höheren Instanz zulassen, die dann nicht von der gleichen jurKI entschieden werden dürfte (da jene das gleiche Ergebnis erzielen würde), sondern von menschlichen Richter:innen.","['intro_28', 'Z.P8', 'intro_48', 'Z.P8-2']","[(0, 19), (19, 41), (41, 83), (83, 337)]"
252,20230130_140913_003081,6,user,"Die Entscheidung der ki sollte nicht final gültig sein, ja sie sollte eher das Urteil menschlicher Richter unterstützen",['CON_NZARG'],"[(0, 120)]"
253,20230130_140913_003081,7,bot,"Mit anderen Worten, moralische Leitlinien und Regeln sind vorgegeben. Das verstehe ich. Darüber hinaus finde ich, dass hier noch folgendes beachtet werden sollte: Eine jurKI kann sich in ihrer Entscheidungsfindung irren und zu einem falschen Ergebnis kommen.","['intro_32', 'Z.K6-1', 'intro_54', 'z_trans_1', 'Z.K10']","[(0, 20), (20, 70), (70, 88), (88, 163), (163, 259)]"
254,20230130_140913_003081,8,user,"Ja, daher sollte das Urteil immer überprüft",['NZ.K10'],"[(0, 43)]"
255,20230130_140913_003081,9,bot,"Mit anderen Worten, die KI steht nicht unter Druck. Das ist ein gutes Argument. Andererseits: Da die JurKI bei gleichem Input immer das gleiche Ergebnis liefern würde, würden Fehler an vielen Stellen gleichzeitig passieren und wären so deutliche weitreichender, als die eines Menschen.","['intro_32', 'Z.P3', 'intro_46', 'Z.P3-1']","[(0, 20), (20, 52), (52, 94), (94, 287)]"
256,20230130_140913_003081,10,user,"Da die KI sich jedoch an den gesetzlichen Grundlagen orientiert, werden auch die Fehler juristisch begründet sein",['Z.P3-1-2'],"[(0, 113)]"
257,20230130_140913_003081,11,bot,"Mit anderen Worten, ein Fehler der KI hat die gleiche Tragweite wie Fehler von Richter:innen. Dem würde ich zustimmen. Darüber hinaus finde ich, dass hier noch folgendes beachtet werden sollte: Um Gesetze zu interpretieren und anzuwenden bedarf es stets einer menschlichen Bewertung, ein sog. Werturteil. Das kann nur duch empathische Richter:innen sichergestellt werden, ohne zu riskieren, dass die menschlichen Rechte und die Würde verletzt bzw. beeinträchtigt werden.","['intro_32', 'Z.P3-1-2', 'intro_4', 'z_trans_1', 'Z.P1-1']","[(0, 20), (20, 94), (94, 119), (119, 194), (194, 471)]"
258,20230130_123240_973928,0,user,"Die KI kann Entscheidungen nicht nach Ermessen treffen, was ich bezogen auf rechtliche Prozesse für problematisch halte.",['Z.K4'],"[(0, 120)]"
259,20230130_123240_973928,1,bot,"Du merkst an, dass KI sich irren kann. Das stimmt, allerdings ist es nicht sehr wahrscheinlich. Die jurKI wird außerdem Fälle, die sie nicht selbst beurteilen kann, an menschliche Richter:innen delegieren und würde aus diesen für zukünftige, ähnliche Fälle lernen.","['intro_28', 'Z.K10', 'intro_59', 'Z.K10-2']","[(0, 19), (19, 39), (39, 96), (96, 265)]"
260,20230130_123240_973928,2,user,"Wenn die Fälle schließlich an menschliche Richter:innen vergeben werden, können sie auch direkt von diesen übernommen werden.",['OTHER'],"[(0, 125)]"
261,20230130_123240_973928,3,bot,"Dir scheint also unklar zu sein, welche Art von Fällen diese KI verhandelt. Unsere jurKI ist auf zivilrechtliche Verfahren spezialisiert, wobei wir das Familienrecht als Teilgebiet explizit nicht hinzuzählen. Strafrechtliche Verfahren schließen wir in unserem Szenario ebenfalls aus. Was sagst du denn noch zu Folgendem: Durch den Einsatz der jurKI kann der Faktor Subjektivität bei Gerichtsurteilen ausgeräumt werden. Eine jurKI lässt sich nicht etwa durch Mitgefühl von den objektiven Fakten ablenken. Dies führt zu mehr Gerechtigkeit.","['intro_38', 'FAQ.1', 'FAQ.1-1', 'faq_trans_3', 'Z.P1']","[(0, 33), (33, 76), (76, 284), (284, 321), (321, 538)]"
262,20230130_123240_973928,4,user,"Braucht man nicht aber Mitgefühl, um für Gerechtigkeit zu sorgen?",['Z.P1-1'],"[(0, 66)]"
