Unnamed: 0,dialogue,utterance_id,utterance_type,utterance_text,labels,bounds
0,20230130_114643_242390,0,user,Für eine KI ist es nicht möglich Empathie o.Ä. zu empfinden und diese beim Urteil zu berücksichtigen und mit einfließen lassen,['Z.K2'],"[(0, 127)]"
1,20230130_114643_242390,1,bot,"Du argumentierst, dass KI keine Werte befolgt. Das ist im Szenario bereits berücksichtigt: Die jurKI ist ein zertifizierter Service des Staates, der die moralischen Leitlinien und Regeln vorgibt. Hierfür werden insb. auch die Erkenntnisse der Philosophie und Computerwissenschaft hinzugezogen und z.B. in ein passendes Diskriminierungsgesetz übersetzt.","['intro_26', 'Z.K6', 'intro_56', 'Z.K6-1']","[(0, 23), (23, 47), (47, 91), (91, 353)]"
2,20230130_114643_242390,2,user,Meiner Meinung nach ist dies aber nicht dasselbe. Da vorgegebene Leitlinien und Regeln nicht auf die verschiedenen Individualfälle angepasst sind und so nicht für jede Möglichkeit optimal vorbereitet sind,"['DISSENT', 'Z.P1-1']","[(0, 50), (50, 205)]"
3,20230130_114643_242390,3,bot,"Du sagst, dass KI keine Werte befolgt. Darauf geht unser Szenario wie folgt ein: Dieser Einwand beruht auf einem technisch überholten Bild und setzt ein idealisiertes Bild von Richter:innen voraus. Das Lernverfahren erfolgt mittlerweile Bottom-Up, also bspw. zunächst anhand kleinerer und einfacher Fälle bis hin zu komplexen und schwierigen Sachverhalten, und der jurKI können Werte beigebracht werden, etwa durch das sog. supervised learning.","['intro_27', 'Z.K6', 'intro_55', 'Z.K6-2']","[(0, 15), (15, 39), (39, 81), (81, 446)]"
4,20230130_114643_242390,4,user,"Die KI kann im Strafmaß nicht so frei handeln wie ein Mensch. Z.B. alternative Strafen die im Rehabilitationsprozess, die diesen zusätzlich fördern würden",['Z.K4'],"[(0, 155)]"
5,20230130_114643_242390,5,bot,"Du merkst an, dass KI keine Werte befolgt. Darauf geht unser Szenario wie folgt ein: Vorschläge aus der Praxis für ethische Grundsätze des Einsatzes von jurKI in der Justiz liegen bereits vor, etwa von der Europäischen Kommission für die Effizienz der Justiz des Europarates (CEPEJ). Der Einsatz der jurKI müsste natürlich auch diesen Grundsätzen folgen.","['intro_28', 'Z.K6', 'intro_55', 'Z.K6-3']","[(0, 19), (19, 43), (43, 85), (85, 355)]"
6,20230130_114643_242390,6,user,Die KI könnte auch falsche Werte lernen und so zu immer extremeren Strafen lehnen,['Z.K6-1-1'],"[(0, 81)]"
7,20230130_114643_242390,7,bot,"Kurz zusammengefasst, KI könnte von fehlerhaften Urteilen falsch lernen und Leitlinien sowie sonstige Regeln verletzen. Das ist im Szenario bereits berücksichtigt: Neben der Umsetzung der Regeln und Leitlinien wird eine jurKI ausschließlich aus selektierten Fällen, die gerade nicht vorurteilsbehaftet und diskriminierend sind, lernen und somit bestehende Vorurteile oder Diskriminierungen nicht berücksichtigen.","['intro_24', 'Z.K6-1-1', 'intro_56', 'Z.K6-1-1-1']","[(0, 22), (22, 120), (120, 164), (164, 413)]"
8,20230130_114643_242390,8,user,Wenn die KI aus rein diskriminierungsfreien Fällen lernt fehlt ihr die Erfahrung,['Z.P4-1'],"[(0, 80)]"
9,20230130_114643_242390,9,bot,"Wenn ich richtig verstanden habe, fragst du  welche Art von Fällen diese KI verhandelt. Unsere jurKI ist auf zivilrechtliche Verfahren spezialisiert, wobei wir das Familienrecht als Teilgebiet explizit nicht hinzuzählen. Strafrechtliche Verfahren schließen wir in unserem Szenario ebenfalls aus. Um hier einen neuen Punkt in die Diskussion einzubringen: Durch den Einsatz der jurKI kann der Faktor Subjektivität bei Gerichtsurteilen ausgeräumt werden. Eine jurKI lässt sich nicht etwa durch Mitgefühl von den objektiven Fakten ablenken. Dies führt zu mehr Gerechtigkeit.","['intro_37', 'FAQ.1', 'FAQ.1-1', 'faq_trans_1', 'Z.P1']","[(0, 45), (45, 88), (88, 296), (296, 354), (354, 571)]"
10,20230130_114643_242390,10,user,Die KI lernt nur aus optimalen Fällen und ist somit nicht auf Extremfälle vorbereitet,['Z.P4-1'],"[(0, 86)]"
11,20230130_114643_242390,11,bot,"Dir scheint also unklar zu sein, welche Art von Fällen diese KI verhandelt. Um hier einen neuen Punkt in die Diskussion einzubringen: Die jurKI kann eine hohe Komplexität an Datenmengen verarbeiten und darauf trainiert werden, so viele Korrelationen wie möglich zu identifizieren und dadurch die Faktoren aufdecken, die ein/e menschliche/r Richter:in übersehen könnte.","['intro_38', 'FAQ.1', 'faq_trans_1', 'Z.P4']","[(0, 33), (33, 76), (76, 134), (134, 369)]"
12,20230130_114643_242390,12,user,Die KI ist nicht auf die immer progressierende Gesselschaft vorbereitet und bleibt veraltet,['Z.K5'],"[(0, 92)]"
13,20230130_114643_242390,13,bot,"Mit anderen Worten, KI befolgt keine Werte. Das ist im Szenario bereits berücksichtigt: Aber hast Du schon einmal daran gedacht: Transparenz und Interpretierbarkeit könnten Zurechnungshindernisse bei der jurKI überwinden. Die jurKI folgt einem strikten Regelwerk und wäre hierdurch durchaus in der Lage ihre Entscheidung zu begründen.","['intro_32', 'Z.K6', 'intro_56', 'z_trans_2', 'Z.K2-1']","[(0, 20), (20, 44), (44, 88), (88, 129), (129, 335)]"
14,20230130_114643_242390,14,user,Die KI wird nur von Menschen programmiert und macht somit die selben Fehler,['Z.P3-1'],"[(0, 76)]"
15,20230130_114643_242390,15,bot,"Du argumentierst, dass Bei der KI strukturelle Fehler möglich sind. Das kann ich nachvollziehen. Andererseits: Ein fehlerhaftes Urteil durch die jurKI hat die gleiche Tragweite und Auswirkung wie ein fehlerhaftes Urteil durch eine:n menschliche:n Richter:in. Daher besteht kein Grund hier von weitreichenderen Schäden bei der jurKI als Richter:in auszugehen.","['intro_26', 'Z.P3-1', 'intro_49', 'Z.P3-1-2']","[(0, 23), (23, 68), (68, 111), (111, 359)]"
16,20230130_114643_242390,16,user,Die KI kann keine Sonderfälle oder Ausnahmefälle erkennen,['Z.P4-1'],"[(0, 58)]"
17,20230130_114643_242390,17,bot,"Kurz zusammengefasst, KI befolgt keine Werte. Das ist im Szenario bereits berücksichtigt: Um auch noch einmal eine andere Seite zu beleuchten: Richter:innen stehen intern und extern unter enormem Druck. Die jurKI verspürt keinen Druck und erzielt gleichbleibend gute Ergebnisse. Stabile, nichtdiskriminierende Schlussfolgerungen fördern ein einheitliches Entscheidungsergebnis sowie Stabilität und Autorität des Rechts.","['intro_24', 'Z.K6', 'intro_56', 'z_trans_13', 'Z.P3']","[(0, 22), (22, 46), (46, 90), (90, 143), (143, 420)]"
18,20230130_114643_242390,18,user,Lernt aus den falschen Fällen,['Z.K6-1-1'],"[(0, 30)]"
19,20230130_114643_242390,19,bot,"Wenn ich richtig verstanden habe, fragst du  welche Art von Fällen diese KI verhandelt. Was denkst du denn darüber: Entscheidungen sind deshalb gut, weil das Ergebnis und die Begründung hierfür gut sind. Oftmals denken Menschen jedoch, dass sie viel besser entscheiden können, als sie es letztendlich tatsächlich tun (sog. kognitive Verzerrung). Bei einer jurKI kommt es zu keinen Verzerrungen.","['intro_37', 'FAQ.1', 'faq_trans_2', 'Z.P6']","[(0, 45), (45, 88), (88, 116), (116, 396)]"
20,20230130_114643_242390,20,user,Wiederhol deine Frage bitte,['OTHER'],"[(0, 27)]"
21,20230130_114643_242390,21,bot,"Ich bin mir nicht sicher, was du genau meinst. Kannst du das anders formulieren?",['intro_61'],"[(0, 81)]"
22,20230130_114643_242390,22,user,"Ich bin mir nicht sicher, was du genau meinst. Kannst du das anders formulieren?",['OTHER'],"[(0, 80)]"
23,20230130_114643_242390,23,bot,"Das ist möglich. Aber zu beachten ist: Massenverfahren nehmen zu und das Justiz-System ist überlastet. Richter:innen haben meist nicht genügend Zeit, die Fälle innerhalb ihrer regulären Arbeitszeit zu erledigen. Eine jurKI arbeitet losgelöst von einer Arbeitszeit 24/7. Das ist im Interesse aller Beteiligten.","['intro_2', 'z_trans_12', 'Z.P2']","[(0, 17), (17, 39), (39, 310)]"
24,20230130_114707_448735,0,user,Durch Einführung einer KI in Zevilrechtsprozessen würde ein faireres und einheitlicheres Rechtssystem entstehen.,['Z.P1'],"[(0, 112)]"
25,20230130_114707_448735,1,bot,"Du sagst, dass moralische Leitlinien und Regeln vorgegeben sind. Das kann ich nachvollziehen. Direkt dazu: Die Regel und Leitlinien sind schnell erlassen, allerdings dürfte sich die Umsetzung beispielsweise eines Diskriminierungsgesetzes für die jurKI als schwierig erweisen, da eine KI auch aus Fällen lernt, in denen möglicherweise vorurteilsbehaftet und diskriminierend von menschlichen Richter:innen entschieden wurde.","['intro_27', 'Z.K6-1', 'intro_48', 'Z.K6-1-1']","[(0, 15), (15, 65), (65, 107), (107, 423)]"
26,20230130_114707_448735,2,user,Dirch die Einführung von KI könnten menschliche Fehler ausgeschlossen werden.,['Z.P4'],"[(0, 77)]"
27,20230130_114707_448735,3,bot,"Kurz zusammengefasst, KI lernt nur aus vorurteils- und diskriminierungsfreien Fällen. Das verstehe ich. Ein weiterer Gesichtspunkt gehört hierher. Die Entwicklung von KI ist bisher nahezu keinen moralischen Leitlinien und Regeln unterworfen und kann nicht werten. Richter:innen hingegen bekennen sich zu Werten durch die Ausübung ihres Berufs und des rechtlichen Rahmens.","['intro_24', 'Z.K6-1-1-1', 'intro_54', 'z_trans_16', 'Z.K6']","[(0, 22), (22, 86), (86, 104), (104, 147), (147, 372)]"
28,20230130_114707_448735,4,user,Eine KI würde nach kurzer Zeit schon mehr Erfahrung als ein Richter haben,['Z.P3-1-1'],"[(0, 73)]"
29,20230130_114707_448735,5,bot,"Dein Argument ist, dass der KI juristische Werte beigebracht werden können. Dem würde ich zustimmen. Darüber hinaus finde ich, dass hier noch folgendes beachtet werden sollte: Eine jurKI kann sich in ihrer Entscheidungsfindung irren und zu einem falschen Ergebnis kommen.","['intro_25', 'Z.K6-2', 'intro_4', 'z_trans_1', 'Z.K10']","[(0, 24), (24, 76), (76, 101), (101, 176), (176, 272)]"
30,20230130_114707_448735,6,user,"Eine KI könnte in schwierigen Fällen besser entscheiden, da sie einen größeren Pool an ähnlichen Fällen abrufen kann",['Z.P4'],"[(0, 116)]"
31,20230130_114707_448735,7,bot,"Wenn ich richtig verstanden habe, fragst du  welche Art von Fällen diese KI verhandelt. Unsere jurKI ist auf zivilrechtliche Verfahren spezialisiert, wobei wir das Familienrecht als Teilgebiet explizit nicht hinzuzählen. Strafrechtliche Verfahren schließen wir in unserem Szenario ebenfalls aus. Was denkst du denn darüber: Die jurKI kann dem/der Adressat:in ihrer Macht nicht menschlich begegnen, sondern dies allenfalls simulieren, da die Black Box undurchschaubar ist. Wie kann sie über das Leben der Bürger:innen urteilen, wenn sie hiervon keine Ahnung hat?","['intro_37', 'FAQ.1', 'FAQ.1-1', 'faq_trans_2', 'Z.K2']","[(0, 45), (45, 88), (88, 296), (296, 324), (324, 563)]"
32,20230130_114707_448735,8,user,Eine KI lernt schneller als ein Mensch und kann so schneller in Fälle eingeführt werden,['Z.P3-1-1'],"[(0, 87)]"
33,20230130_114707_448735,9,bot,"Wenn ich richtig verstanden habe, fragst du  welche Art von Fällen diese KI verhandelt. Was sagst du denn noch zu Folgendem: Die von der jurKI präsentierten Ergebnisse sind in ihrer Ausgabe weniger flexibel. Die Befassung menschlicher Richter:innen zur endgültigen Entscheidung erlaubt ihnen die Ausübung der notwendigen Ermessensmacht. Dies ist Ausdruck einer individualisierten Rechtsprechung.","['intro_37', 'FAQ.1', 'faq_trans_3', 'Z.K4']","[(0, 45), (45, 88), (88, 125), (125, 396)]"
34,20230130_114707_448735,10,user,Eine KI hat im Gegensatz zu Richtern keine Bauchgefühlsentscheidungen und handelt immer gesetztlich korrekt,['Z.P1'],"[(0, 108)]"
35,20230130_114707_448735,11,bot,"Du merkst an, dass moralische Leitlinien und Regeln vorgegeben sind. Das verstehe ich. Ansprechen möchte ich noch: Die jurKI als Richter:in könnte auf wenig Akzeptanz in der Gesellschaft stoßen. Immerhin will man als Mensch von der Justiz wahrgenommen werden und nicht von einem Programm einfach und schnell ""verwertet"" werden.","['intro_28', 'Z.K6-1', 'intro_54', 'z_trans_11', 'Z.K9']","[(0, 19), (19, 69), (69, 87), (87, 115), (115, 328)]"
36,20230130_114707_448735,12,user,"Dadurch, dass die KI von Menschen erschaffen wurde, handelt sie ähnlich wie Menschen, kann aber dennoch die menschlichen Fehler beheben",['Z.K6-1'],"[(0, 135)]"
37,20230130_114707_448735,13,bot,"Kurz zusammengefasst, die Akzeptanz neuer Technologien nimmt zu. Da gebe ich dir recht. Darüber hinaus finde ich, dass hier noch folgendes beachtet werden sollte: Bei der jurKI könnte die subjektive Wirkung auf dem Weg liegen bleiben. Man denke z.B. an die Wirkung, die Richter:innen mit dem Spruch ""im Namen des Volkes"" bei den Verfahrensteilnehmenden hervorruft. Diese wäre nur sehr schwer durch eine Maschine zu reproduzieren.","['intro_24', 'Z.K9-1', 'intro_6', 'z_trans_1', 'Z.K11']","[(0, 22), (22, 65), (65, 88), (88, 163), (163, 430)]"
38,20230130_114707_448735,14,user,Bitte wiederhole deine Frage,['OTHER'],"[(0, 28)]"
39,20230130_114707_448735,15,bot,"Ich bin mir nicht sicher, was du genau meinst. Kannst du das anders formulieren?",['intro_61'],"[(0, 81)]"
40,20230130_131227_281984,0,user,Die KI hat nicht die Fähigkeit moralische Entscheidungen zu treffen und ethische Richtlinien zu berücksichtigen,['Z.K6'],"[(0, 111)]"
41,20230130_131227_281984,1,bot,"Du sagst, dass KI sich irren kann. Das ist möglich, aber nicht sehr wahrscheinlich. Die jurKI wird außerdem Fälle, die sie nicht selbst beurteilen kann, an menschliche Richter:innen delegieren und würde aus diesen für zukünftige, ähnliche Fälle lernen.","['intro_27', 'Z.K10', 'intro_58', 'Z.K10-2']","[(0, 15), (15, 35), (35, 84), (84, 253)]"
42,20230130_131227_281984,2,user,"Was den Menschen von der KI unterscheidet, ist, dass er einen Verstand besitzt. Er hat die Fähigkeit Philosophie zu betreiben.",['Z.K6'],"[(0, 126)]"
43,20230130_131227_281984,3,bot,"Du sagst, dass KI keine Werte befolgt. Darauf geht unser Szenario wie folgt ein: Die jurKI ist ein zertifizierter Service des Staates, der die moralischen Leitlinien und Regeln vorgibt. Hierfür werden insb. auch die Erkenntnisse der Philosophie und Computerwissenschaft hinzugezogen und z.B. in ein passendes Diskriminierungsgesetz übersetzt.","['intro_27', 'Z.K6', 'intro_55', 'Z.K6-1']","[(0, 15), (15, 39), (39, 81), (81, 343)]"
44,20230130_131227_281984,4,user,"Wie würde die KI dann in der Frage entscheiden, wer im folgenden Fall schuldig ist: voll besetztes Flugzeug fliegt auf mit Menschen gefüllte Arena zu. Darf es abgeschossen werden?",['FAQ.1'],"[(0, 179)]"
45,20230130_131227_281984,5,bot,"Dir scheint also unklar zu sein, welche Art von Fällen diese KI verhandelt. Unsere jurKI ist auf zivilrechtliche Verfahren spezialisiert, wobei wir das Familienrecht als Teilgebiet explizit nicht hinzuzählen. Strafrechtliche Verfahren schließen wir in unserem Szenario ebenfalls aus. Um hier einen neuen Punkt in die Diskussion einzubringen: Durch den Einsatz der jurKI kann der Faktor Subjektivität bei Gerichtsurteilen ausgeräumt werden. Eine jurKI lässt sich nicht etwa durch Mitgefühl von den objektiven Fakten ablenken. Dies führt zu mehr Gerechtigkeit.","['intro_38', 'FAQ.1', 'FAQ.1-1', 'faq_trans_1', 'Z.P1']","[(0, 33), (33, 76), (76, 284), (284, 342), (342, 559)]"
46,20230130_120140_782797,0,user,Emotionen,['OTHER'],"[(0, 9)]"
47,20230130_120140_782797,1,bot,"Du sagst, dass KI keine Werte befolgt. Darauf geht unser Szenario wie folgt ein: Die jurKI ist ein zertifizierter Service des Staates, der die moralischen Leitlinien und Regeln vorgibt. Hierfür werden insb. auch die Erkenntnisse der Philosophie und Computerwissenschaft hinzugezogen und z.B. in ein passendes Diskriminierungsgesetz übersetzt.","['intro_27', 'Z.K6', 'intro_55', 'Z.K6-1']","[(0, 15), (15, 39), (39, 81), (81, 343)]"
48,20230130_120140_782797,2,user,"Der Chatbot ermittelt Werte, aufgrund vorgefertigter und gefütterter Informationen und ""rechnet"" dann aus, was ""richtig und ""falsch"" ist. Die Emotionale Seite ist also nicht rral",['Z.K2'],"[(0, 178)]"
49,20230130_120140_782797,3,bot,"Du merkst an, dass KI von fehlerhaften Urteilen falsch lernen und Leitlinien sowie sonstige Regeln verletzen könnte. Darauf geht unser Szenario wie folgt ein: Neben der Umsetzung der Regeln und Leitlinien wird eine jurKI ausschließlich aus selektierten Fällen, die gerade nicht vorurteilsbehaftet und diskriminierend sind, lernen und somit bestehende Vorurteile oder Diskriminierungen nicht berücksichtigen.","['intro_28', 'Z.K6-1-1', 'intro_55', 'Z.K6-1-1-1']","[(0, 19), (19, 117), (117, 159), (159, 408)]"
50,20230130_120140_782797,4,user,"Dafür könnte die KI benutzt werden, allerdings sollte sie nie ein Richter ersetzten, sonderm maximals als Hilfstool verwendet werden dürfen, um Vorurteile und Diskriminierung nicht zu berücksichtigen",['NZ.K10'],"[(0, 199)]"
51,20230130_120140_782797,5,bot,"Kurz zusammengefasst, KI könnte von fehlerhaften Urteilen falsch lernen und Leitlinien sowie sonstige Regeln verletzen. Darauf geht unser Szenario wie folgt ein: Aber hast Du schon einmal daran gedacht: Durch den Einsatz der jurKI kann der Faktor Subjektivität bei Gerichtsurteilen ausgeräumt werden. Eine jurKI lässt sich nicht etwa durch Mitgefühl von den objektiven Fakten ablenken. Dies führt zu mehr Gerechtigkeit.","['intro_24', 'Z.K6-1-1', 'intro_55', 'z_trans_2', 'Z.P1']","[(0, 22), (22, 120), (120, 162), (162, 203), (203, 420)]"
52,20230130_120140_782797,6,user,"Allerdings sind die Informationen, die der Bot zum urteil führen, auch von einem Menschen, die Vorurteile haben",['Z.K6-1-1'],"[(0, 111)]"
53,20230130_120140_782797,7,bot,"Dein Argument ist, dass KI keine Werte befolgt. Darauf geht unser Szenario wie folgt ein: Dieser Einwand beruht auf einem technisch überholten Bild und setzt ein idealisiertes Bild von Richter:innen voraus. Das Lernverfahren erfolgt mittlerweile Bottom-Up, also bspw. zunächst anhand kleinerer und einfacher Fälle bis hin zu komplexen und schwierigen Sachverhalten, und der jurKI können Werte beigebracht werden, etwa durch das sog. supervised learning.","['intro_25', 'Z.K6', 'intro_55', 'Z.K6-2']","[(0, 24), (24, 48), (48, 90), (90, 455)]"
54,20230130_123604_576952,0,user,Hi,['OTHER'],"[(0, 2)]"
55,20230130_123604_576952,1,bot,"Ich bin mir nicht sicher, was du genau meinst. Kannst du das anders formulieren?",['intro_61'],"[(0, 81)]"
56,20230130_123604_576952,2,user,"Ich meine, dass sie eine objektive und nicht beeinflussbare Meinung bilden können.",['Z.P1'],"[(0, 82)]"
57,20230130_123604_576952,3,bot,Das verstehe ich. Um auch noch einmal eine andere Seite zu beleuchten: Die Entwicklung von KI ist bisher nahezu keinen moralischen Leitlinien und Regeln unterworfen und kann nicht werten. Richter:innen hingegen bekennen sich zu Werten durch die Ausübung ihres Berufs und des rechtlichen Rahmens.,"['intro_1', 'z_trans_13', 'Z.K6']","[(0, 18), (18, 71), (71, 296)]"
58,20230130_123604_576952,4,user,Das sehe ich auch so.,['CONSENT'],"[(0, 21)]"
59,20230130_123604_576952,5,bot,"Ich bin mir nicht sicher, was du genau meinst. Kannst du das anders ausdrücken?",['intro_62'],"[(0, 80)]"
60,20230130_123604_576952,6,user,Und außerdem unterliegen kis keinem Messefehler oder sind beeinflussbar durch z.B. Bestechung.,['Z.P3'],"[(0, 94)]"
61,20230130_123604_576952,7,bot,"Das mag sein. Ansprechen möchte ich noch: Die jurKI kann dem/der Adressat:in ihrer Macht nicht menschlich begegnen, sondern dies allenfalls simulieren, da die Black Box undurchschaubar ist. Wie kann sie über das Leben der Bürger:innen urteilen, wenn sie hiervon keine Ahnung hat?","['intro_3', 'z_trans_11', 'Z.K2']","[(0, 14), (14, 42), (42, 281)]"
62,20230130_123604_576952,8,user,"Sehe ich nicht so. Sie kann genau deswegen urteilen, weil sie aus einer losgelösten Position aus urteilt- so wie Gott.","['DISSENT', 'Z.P1']","[(0, 19), (19, 118)]"
63,20230130_123604_576952,9,bot,"Ich bin mir nicht sicher, was du genau meinst. Kannst du das anders ausdrücken?",['intro_62'],"[(0, 80)]"
64,20230130_123604_576952,10,user,"Ich meine, dass sie genau deswegen urteilen kann, weil sie nicht an die Lebenswelt von Menschen gebunden sind.",['Z.P1'],"[(0, 110)]"
65,20230130_123604_576952,11,bot,Das ist möglich. Um auch noch einmal eine andere Seite zu beleuchten: Die von der jurKI präsentierten Ergebnisse sind in ihrer Ausgabe weniger flexibel. Die Befassung menschlicher Richter:innen zur endgültigen Entscheidung erlaubt ihnen die Ausübung der notwendigen Ermessensmacht. Dies ist Ausdruck einer individualisierten Rechtsprechung.,"['intro_2', 'z_trans_13', 'Z.K4']","[(0, 17), (17, 70), (70, 341)]"
66,20230130_123604_576952,12,user,Außerdem sind sie viele billiger als Richter*innen.,['Z.P8'],"[(0, 51)]"
67,20230130_123604_576952,13,bot,"Du argumentierst, dass die KI günstiger ist. Das ist ein gutes Argument. Andererseits: Man müsste wie in unserem Szenario auch gegen eine jurKI eine Berufung einer höheren Instanz zulassen, die dann nicht von der gleichen jurKI entschieden werden dürfte (da jene das gleiche Ergebnis erzielen würde), sondern von menschlichen Richter:innen.","['intro_26', 'Z.P8', 'intro_46', 'Z.P8-2']","[(0, 23), (23, 45), (45, 87), (87, 341)]"
68,20230130_123604_576952,14,user,Ja das stimmt. Und man darf nicht den hohen Strombedarf vergessen.,"['CONSENT', 'NZ.K2']","[(0, 15), (15, 66)]"
69,20230130_123604_576952,15,bot,"Ich bin mir nicht sicher, was du genau meinst. Kannst du das anders ausdrücken?",['intro_62'],"[(0, 80)]"
70,20230130_123604_576952,16,user,Außerdem könnten sie eventuell auch konsultativ tätig sein. Also dass der Richter selbst ein Urteil bildet mit der Hilfe der ki.,['NZ.K10'],"[(0, 128)]"
71,20230130_123604_576952,17,bot,"Das mag sein. Aber zu beachten ist: Die jurKI als Richter:in könnte auf wenig Akzeptanz in der Gesellschaft stoßen. Immerhin will man als Mensch von der Justiz wahrgenommen werden und nicht von einem Programm einfach und schnell ""verwertet"" werden.","['intro_3', 'z_trans_12', 'Z.K9']","[(0, 14), (14, 36), (36, 249)]"
72,20230130_123604_576952,18,user,"Finde das nicht, da sie sehr hilfreich sein kann und deswegen auch eventuell besser angenommen werden kann.",['Z.K9-1'],"[(0, 107)]"
73,20230130_123604_576952,19,bot,"Ich bin mir nicht sicher, was du genau meinst. Kannst du das anders ausdrücken?",['intro_62'],"[(0, 80)]"
74,20230130_123604_576952,20,user,Schwierige Sache,['OTHER'],"[(0, 16)]"
75,20230130_123604_576952,21,bot,"Das ist möglich. Aber hast Du schon einmal daran gedacht: Richter:in ist für viele ein Berufswunsch und mithin Motiv für das Studium. Ohne dieses Berufsbild, würden sich möglicherweise weniger Menschen für das Studium entscheiden. Dies würde dazu führen, dass es weniger Jurist:innen gibt, was jedoch wichtig für die Demokratie ist.","['intro_2', 'z_trans_2', 'Z.K7']","[(0, 17), (17, 58), (58, 333)]"
76,20230130_123604_576952,22,user,Die ki könnte auch gehackt werden.,['Z.K14'],"[(0, 34)]"
77,20230130_123604_576952,23,bot,"Dein Argument ist, dass moralische Leitlinien und Regeln vorgegeben sind. Das verstehe ich. Direkt dazu: Die Regel und Leitlinien sind schnell erlassen, allerdings dürfte sich die Umsetzung beispielsweise eines Diskriminierungsgesetzes für die jurKI als schwierig erweisen, da eine KI auch aus Fällen lernt, in denen möglicherweise vorurteilsbehaftet und diskriminierend von menschlichen Richter:innen entschieden wurde.","['intro_25', 'Z.K6-1', 'intro_51', 'Z.K6-1-1']","[(0, 24), (24, 74), (74, 105), (105, 421)]"
78,20230130_123604_576952,24,user,Das ist ein weites Feld,['OTHER'],"[(0, 23)]"
79,20230130_123604_576952,25,bot,"Ich bin mir nicht sicher, was du genau meinst. Kannst du das anders ausdrücken?",['intro_62'],"[(0, 80)]"
80,20230130_123604_576952,26,user,Wie ist das Wetter,['OTHER'],"[(0, 18)]"
81,20230130_123604_576952,27,bot,"Das verstehe ich. Aber zu beachten ist: Um Gesetze zu interpretieren und anzuwenden bedarf es stets einer menschlichen Bewertung, ein sog. Werturteil. Das kann nur duch empathische Richter:innen sichergestellt werden, ohne zu riskieren, dass die menschlichen Rechte und die Würde verletzt bzw. beeinträchtigt werden.","['intro_1', 'z_trans_12', 'Z.P1-1']","[(0, 18), (18, 40), (40, 317)]"
82,20230130_121552_163780,0,user,- Objektivität,['Z.P1'],"[(0, 14)]"
83,20230130_121552_163780,1,bot,"Du meinst also, dass die jurKI objektiv ist. Das verstehe ich. Direkt dazu: Die Richter:innen sind immer unterschiedliche Personen und entscheiden dementsprechend unterschiedlich. Dies ist für ein funktionierendes Rechtssystem von großer Bedeutung, da unterschiedliche Urteile auch das Ergebnis verschiedener an sich richtiger Abwägungen sein können.","['intro_23', 'Z.P1', 'intro_51', 'Z.P1-2']","[(0, 21), (21, 45), (45, 76), (76, 351)]"
84,20230130_121552_163780,2,user,- ökonomischer Vorteil,['Z.P8'],"[(0, 23)]"
85,20230130_121552_163780,3,bot,"Ich bin mir nicht sicher, was du genau meinst. Kannst du das anders formulieren?",['intro_61'],"[(0, 81)]"
86,20230130_121552_163780,4,user,"Juristen zu bezahlen ist teuer, das geld kann an anderer stelle genutzt werden",['Z.P8'],"[(0, 78)]"
87,20230130_121552_163780,5,bot,Das ist möglich. Aber hast Du schon einmal daran gedacht: Die Entwicklung von KI ist bisher nahezu keinen moralischen Leitlinien und Regeln unterworfen und kann nicht werten. Richter:innen hingegen bekennen sich zu Werten durch die Ausübung ihres Berufs und des rechtlichen Rahmens.,"['intro_2', 'z_trans_2', 'Z.K6']","[(0, 17), (17, 58), (58, 283)]"
88,20230130_121552_163780,6,user,allerdings kann es solche Leitlinien lernen,['Z.K6-2'],"[(0, 43)]"
