Unnamed: 0,dialogue,utterance_id,utterance_type,utterance_text,labels,bounds
89,20230130_121552_163780,7,bot,"Du sagst, dass der KI juristische Werte beigebracht werden können. Ich denke damit liegst du richtig. Aber zu beachten ist: Die Regel und Leitlinien sind schnell erlassen, allerdings dürfte sich die Umsetzung beispielsweise eines Diskriminierungsgesetzes für die jurKI als schwierig erweisen, da eine KI auch aus Fällen lernt, in denen möglicherweise vorurteilsbehaftet und diskriminierend von menschlichen Richter:innen entschieden wurde.","['intro_27', 'Z.K6-2', 'intro_5', 'z_trans_12', 'Z.K6-1-1']","[(0, 15), (15, 67), (67, 102), (102, 124), (124, 440)]"
90,20230130_121552_163780,8,user,genau das is der punkt menschliche richter können ihre eigene meinung nicht ausschalten und daher wird sie immer die Entscheidung beeinflussen,['Z.P1'],"[(0, 143)]"
91,20230130_121552_163780,9,bot,"Du sagst, dass die KI nicht unter Druck steht. Das verstehe ich. Direkt dazu: Da die JurKI bei gleichem Input immer das gleiche Ergebnis liefern würde, würden Fehler an vielen Stellen gleichzeitig passieren und wären so deutliche weitreichender, als die eines Menschen.","['intro_27', 'Z.P3', 'intro_51', 'Z.P3-1']","[(0, 15), (15, 47), (47, 78), (78, 271)]"
92,20230130_121552_163780,10,user,aber die JurKI müsste soweit entwickelt werden bevor sie freigegeben wird & dann sollten keine systemischen fehler vorkommen,['Z.P3-1-1'],"[(0, 124)]"
93,20230130_121552_163780,11,bot,"Mit anderen Worten, die KI ist ein lernendes System. Da gebe ich dir recht. Ein weiterer Gesichtspunkt gehört hierher. Um Gesetze zu interpretieren und anzuwenden bedarf es stets einer menschlichen Bewertung, ein sog. Werturteil. Das kann nur duch empathische Richter:innen sichergestellt werden, ohne zu riskieren, dass die menschlichen Rechte und die Würde verletzt bzw. beeinträchtigt werden.","['intro_32', 'Z.P3-1-1', 'intro_6', 'z_trans_16', 'Z.P1-1']","[(0, 20), (20, 53), (53, 76), (76, 119), (119, 396)]"
94,20230130_121229_258366,0,user,Hallo,['OTHER'],"[(0, 5)]"
95,20230130_121229_258366,1,bot,"Ich bin mir nicht sicher, was du genau meinst. Kannst du das anders formulieren?",['intro_61'],"[(0, 81)]"
96,20230130_121229_258366,2,user,was denkst du von dem Thema,['FAQ.6'],"[(0, 27)]"
97,20230130_121229_258366,3,bot,Das verstehe ich. Um auch noch einmal eine andere Seite zu beleuchten: Durch den Einsatz der jurKI kann der Faktor Subjektivität bei Gerichtsurteilen ausgeräumt werden. Eine jurKI lässt sich nicht etwa durch Mitgefühl von den objektiven Fakten ablenken. Dies führt zu mehr Gerechtigkeit.,"['intro_1', 'z_trans_13', 'Z.P1']","[(0, 18), (18, 71), (71, 288)]"
98,20230130_121229_258366,4,user,Subjektivität und Mitgefühl sind doch auch wichtige Aspekte der Rechtssprechung,['Z.K11'],"[(0, 80)]"
99,20230130_121229_258366,5,bot,"Du argumentierst, dass die subjektive Wirkung leidet. Das mag sein. In Deutschland sitzen die Menschen bereits durchschnittlich über 10h am Tag vor einem Bildschirm. Das zeigt, dass die Menschen keine echte Persönlichkeit vor sich brauchen, auch nicht bei Entscheidungen. Der menschliche Aspekt wird immer weiter in den Hintergrund gedrängt.","['intro_26', 'Z.K11', 'intro_3', 'Z.K11-1']","[(0, 23), (23, 54), (54, 68), (68, 342)]"
100,20230130_121229_258366,6,user,der menschliche Aspekt ist jedoch das was Menschlichkeit ausmacht . Außerdem sind es ja erst die Menschen gewesen die gesagt haben was Gerechtigkeit ist und nicht eine KI. Deswegen ist es auch besser wenn Menschen in diesem Fall auch Entscheidungen treffen.,['Z.P1-1'],"[(0, 257)]"
101,20230130_121229_258366,7,bot,"Du sagst, dass KI keine Werte befolgt. Darauf geht unser Szenario wie folgt ein: Die jurKI ist ein zertifizierter Service des Staates, der die moralischen Leitlinien und Regeln vorgibt. Hierfür werden insb. auch die Erkenntnisse der Philosophie und Computerwissenschaft hinzugezogen und z.B. in ein passendes Diskriminierungsgesetz übersetzt.","['intro_27', 'Z.K6', 'intro_55', 'Z.K6-1']","[(0, 15), (15, 39), (39, 81), (81, 343)]"
102,20230130_121229_258366,8,user,"Werte und Gerechtigkeit nach eigenem Ermessen nachvollziehen zu können und somit eine Tiefe des Strafmaßes zu entscheiden kann nicht von einer KI nachvollzogen werden. 
Außerdem ist eine KI immer nur so ethisch korrekt wie derjenige der sie entwickelt und so korrekt wie die Daten mit der sie gefüttert wird.","['Z.K6', 'Z.K6-1-1']","[(0, 167), (169, 308)]"
103,20230130_121229_258366,9,bot,"Mit anderen Worten, KI könnte von fehlerhaften Urteilen falsch lernen und Leitlinien sowie sonstige Regeln verletzen. Das ist im Szenario bereits berücksichtigt: Neben der Umsetzung der Regeln und Leitlinien wird eine jurKI ausschließlich aus selektierten Fällen, die gerade nicht vorurteilsbehaftet und diskriminierend sind, lernen und somit bestehende Vorurteile oder Diskriminierungen nicht berücksichtigen.","['intro_32', 'Z.K6-1-1', 'intro_56', 'Z.K6-1-1-1']","[(0, 20), (20, 118), (118, 162), (162, 411)]"
104,20230130_121229_258366,10,user,Eine KI kann trotzdem nie die Situationen in vollem Umfang und auf jeder Ebene nachvollziehen. Man bräuchte unendlich viele Daten um die Intuition und den Verstand des Menschen zu ersetzen,['Z.P4-1'],"[(0, 189)]"
105,20230130_121229_258366,11,bot,"Dein Argument ist, dass KI keine Werte befolgt. Darauf geht unser Szenario wie folgt ein: Dieser Einwand beruht auf einem technisch überholten Bild und setzt ein idealisiertes Bild von Richter:innen voraus. Das Lernverfahren erfolgt mittlerweile Bottom-Up, also bspw. zunächst anhand kleinerer und einfacher Fälle bis hin zu komplexen und schwierigen Sachverhalten, und der jurKI können Werte beigebracht werden, etwa durch das sog. supervised learning.","['intro_25', 'Z.K6', 'intro_55', 'Z.K6-2']","[(0, 24), (24, 48), (48, 90), (90, 455)]"
106,20230130_121229_258366,12,user,Jedoch ist es doch aber so dass sich jeder Fall unterscheidet,['OTHER'],"[(0, 61)]"
107,20230130_121229_258366,13,bot,"Wenn ich richtig verstanden habe, fragst du  welche Art von Fällen diese KI verhandelt. Unsere jurKI ist auf zivilrechtliche Verfahren spezialisiert, wobei wir das Familienrecht als Teilgebiet explizit nicht hinzuzählen. Strafrechtliche Verfahren schließen wir in unserem Szenario ebenfalls aus. Was sagst du denn noch zu Folgendem: Die jurKI kann eine hohe Komplexität an Datenmengen verarbeiten und darauf trainiert werden, so viele Korrelationen wie möglich zu identifizieren und dadurch die Faktoren aufdecken, die ein/e menschliche/r Richter:in übersehen könnte.","['intro_37', 'FAQ.1', 'FAQ.1-1', 'faq_trans_3', 'Z.P4']","[(0, 45), (45, 88), (88, 296), (296, 333), (333, 568)]"
108,20230130_121229_258366,14,user,Eine KI würde ich nur als Unterstützungsmaßnahme der Entscheidungsfindung vom Richter akzeptieren,['NZ.K10'],"[(0, 97)]"
109,20230130_121229_258366,15,bot,"Du sagst, dass KI keine Werte befolgt. Das ist im Szenario bereits berücksichtigt: Vorschläge aus der Praxis für ethische Grundsätze des Einsatzes von jurKI in der Justiz liegen bereits vor, etwa von der Europäischen Kommission für die Effizienz der Justiz des Europarates (CEPEJ). Der Einsatz der jurKI müsste natürlich auch diesen Grundsätzen folgen.","['intro_27', 'Z.K6', 'intro_56', 'Z.K6-3']","[(0, 15), (15, 39), (39, 83), (83, 353)]"
110,20230130_121229_258366,16,user,Wer hat schuld wenn sich eine KI in einem Urteil irrt ? Wer wird zur Rechenschaft gezogen ?   Die Gesellschaft darf sich nicht zu abhängig von der Technologie machen,['Z.K3'],"[(0, 166)]"
111,20230130_121229_258366,17,bot,"Kurz zusammengefasst, KI befolgt keine Werte. Darauf geht unser Szenario wie folgt ein: Aber hast Du schon einmal daran gedacht: Transparenz und Interpretierbarkeit könnten Zurechnungshindernisse bei der jurKI überwinden. Die jurKI folgt einem strikten Regelwerk und wäre hierdurch durchaus in der Lage ihre Entscheidung zu begründen.","['intro_24', 'Z.K6', 'intro_55', 'z_trans_2', 'Z.K2-1']","[(0, 22), (22, 46), (46, 88), (88, 129), (129, 335)]"
112,20230130_121229_258366,18,user,Fehler in der Entscheidung einer KI können verheerende Auswirkungen haben,['Z.P3-1'],"[(0, 73)]"
113,20230130_121229_258366,19,bot,"Dein Argument ist, dass Bei der KI strukturelle Fehler möglich sind. Das kann ich nachvollziehen. Direkt dazu: Ein fehlerhaftes Urteil durch die jurKI hat die gleiche Tragweite und Auswirkung wie ein fehlerhaftes Urteil durch eine:n menschliche:n Richter:in. Daher besteht kein Grund hier von weitreichenderen Schäden bei der jurKI als Richter:in auszugehen.","['intro_25', 'Z.P3-1', 'intro_48', 'Z.P3-1-2']","[(0, 24), (24, 69), (69, 111), (111, 359)]"
114,20230130_121229_258366,20,user,"Der Fehler eines Menschen hat eine geringere Tragweite , da er nicht so viele Fälle behandelt wie die KI.",['Z.P3-1'],"[(0, 106)]"
115,20230130_121229_258366,21,bot,"Dir scheint also unklar zu sein, welche Art von Fällen diese KI verhandelt. Um hier einen neuen Punkt in die Diskussion einzubringen: Richter:innen stehen intern und extern unter enormem Druck. Die jurKI verspürt keinen Druck und erzielt gleichbleibend gute Ergebnisse. Stabile, nichtdiskriminierende Schlussfolgerungen fördern ein einheitliches Entscheidungsergebnis sowie Stabilität und Autorität des Rechts.","['intro_38', 'FAQ.1', 'faq_trans_1', 'Z.P3']","[(0, 33), (33, 76), (76, 134), (134, 411)]"
116,20230130_121256_908288,0,user,Ai ist objektiv,['Z.P1'],"[(0, 16)]"
117,20230130_121256_908288,1,bot,"Kurz zusammengefasst, KI lernt nur aus vorurteils- und diskriminierungsfreien Fällen. Das verstehe ich. Darüber hinaus finde ich, dass hier noch folgendes beachtet werden sollte: Die Entwicklung von KI ist bisher nahezu keinen moralischen Leitlinien und Regeln unterworfen und kann nicht werten. Richter:innen hingegen bekennen sich zu Werten durch die Ausübung ihres Berufs und des rechtlichen Rahmens.","['intro_24', 'Z.K6-1-1-1', 'intro_54', 'z_trans_1', 'Z.K6']","[(0, 22), (22, 86), (86, 104), (104, 179), (179, 404)]"
118,20230130_121256_908288,2,user,KI lässt sich nicht bestechen,['Z.P3'],"[(0, 29)]"
119,20230130_121256_908288,3,bot,"Du argumentierst, dass der KI juristische Werte beigebracht werden können. Da gebe ich dir recht. Ein weiterer Gesichtspunkt gehört hierher. Die Regel und Leitlinien sind schnell erlassen, allerdings dürfte sich die Umsetzung beispielsweise eines Diskriminierungsgesetzes für die jurKI als schwierig erweisen, da eine KI auch aus Fällen lernt, in denen möglicherweise vorurteilsbehaftet und diskriminierend von menschlichen Richter:innen entschieden wurde.","['intro_26', 'Z.K6-2', 'intro_6', 'z_trans_16', 'Z.K6-1-1']","[(0, 23), (23, 75), (75, 98), (98, 141), (141, 457)]"
120,20230130_121256_908288,4,user,Obstbauprozesse können dank KI verbessert werden,['OTHER'],"[(0, 48)]"
121,20230130_121256_908288,5,bot,"Du argumentierst, dass moralische Leitlinien und Regeln vorgegeben sind. Das kann ich nachvollziehen. Darüber hinaus finde ich, dass hier noch folgendes beachtet werden sollte: Eine jurKI kann sich in ihrer Entscheidungsfindung irren und zu einem falschen Ergebnis kommen.","['intro_26', 'Z.K6-1', 'intro_53', 'z_trans_1', 'Z.K10']","[(0, 23), (23, 73), (73, 102), (102, 177), (177, 273)]"
122,20230130_121256_908288,6,user,AI  ist billiger zu warten als eine echte Person,['Z.P8'],"[(0, 48)]"
123,20230130_121256_908288,7,bot,"Du argumentierst, dass die KI günstiger ist. Das ist ein gutes Argument. Andererseits: Man müsste wie in unserem Szenario auch gegen eine jurKI eine Berufung einer höheren Instanz zulassen, die dann nicht von der gleichen jurKI entschieden werden dürfte (da jene das gleiche Ergebnis erzielen würde), sondern von menschlichen Richter:innen.","['intro_26', 'Z.P8', 'intro_46', 'Z.P8-2']","[(0, 23), (23, 45), (45, 87), (87, 341)]"
124,20230130_121256_908288,8,user,Dies ist eine modernere Lösung und Sie sollten mit dem Fortschritt gehen.,['PRO_NZARG'],"[(0, 73)]"
125,20230130_121256_908288,9,bot,"Ich bin mir nicht sicher, was du genau meinst. Kannst du das anders formulieren?",['intro_61'],"[(0, 81)]"
126,20230130_121256_908288,10,user,KI macht das Leben einfacher,['PRO_NZARG'],"[(0, 28)]"
127,20230130_121256_908288,11,bot,"Das verstehe ich. Aber zu beachten ist: Die jurKI kann dem/der Adressat:in ihrer Macht nicht menschlich begegnen, sondern dies allenfalls simulieren, da die Black Box undurchschaubar ist. Wie kann sie über das Leben der Bürger:innen urteilen, wenn sie hiervon keine Ahnung hat?","['intro_1', 'z_trans_12', 'Z.K2']","[(0, 18), (18, 40), (40, 279)]"
128,20230130_133350_613308,0,user,Die KI würde weniger Fehler machen. Weniger Fälle würden in Berufung gehen.,['Z.P3-1-1'],"[(0, 75)]"
129,20230130_133350_613308,1,bot,"Du merkst an, dass Richter:innen weiterhin gebraucht werden. Ich denke damit liegst du richtig. Darüber hinaus finde ich, dass hier noch folgendes beachtet werden sollte: Richter:in ist für viele ein Berufswunsch und mithin Motiv für das Studium. Ohne dieses Berufsbild, würden sich möglicherweise weniger Menschen für das Studium entscheiden. Dies würde dazu führen, dass es weniger Jurist:innen gibt, was jedoch wichtig für die Demokratie ist.","['intro_28', 'Z.K7-1', 'intro_5', 'z_trans_1', 'Z.K7']","[(0, 19), (19, 61), (61, 96), (96, 171), (171, 446)]"
130,20230130_133350_613308,2,user,"Das ist Whataboutism. Die Tatsachen, dass Richter:in für viele ein Berufswunsch ist und dass die Demokratie Jurist:innen braucht, ist zwar richtig, hat zunächst jedoch nichts mit dem Thema künstliche Intelligenz bei Gerichtsprozessen zu tun.",['OTHER'],"[(0, 241)]"
131,20230130_133350_613308,3,bot,"Dein Argument ist, dass die KI günstiger ist. Das ist ein gutes Argument. Direkt dazu: Man müsste wie in unserem Szenario auch gegen eine jurKI eine Berufung einer höheren Instanz zulassen, die dann nicht von der gleichen jurKI entschieden werden dürfte (da jene das gleiche Ergebnis erzielen würde), sondern von menschlichen Richter:innen.","['intro_25', 'Z.P8', 'intro_47', 'Z.P8-2']","[(0, 24), (24, 46), (46, 87), (87, 341)]"
132,20230130_133350_613308,4,user,"Ja, das stimmt. Man bräuchte eine kontrollierende Instanz, die keine KI ist, sondern durch ein:e menschliche Richter:in ausgeübt wird.","['CONSENT', 'Z.K3-2']","[(0, 16), (16, 134)]"
133,20230130_133350_613308,5,bot,"Du sagst, dass moralische Leitlinien und Regeln vorgegeben sind. Das verstehe ich. Direkt dazu: Die Regel und Leitlinien sind schnell erlassen, allerdings dürfte sich die Umsetzung beispielsweise eines Diskriminierungsgesetzes für die jurKI als schwierig erweisen, da eine KI auch aus Fällen lernt, in denen möglicherweise vorurteilsbehaftet und diskriminierend von menschlichen Richter:innen entschieden wurde.","['intro_27', 'Z.K6-1', 'intro_51', 'Z.K6-1-1']","[(0, 15), (15, 65), (65, 96), (96, 412)]"
134,20230130_133350_613308,6,user,"Das habe ich zwar nicht gesagt, aber gutes Argument. Dem stimme ichzu!",['CONSENT'],"[(0, 70)]"
135,20230130_133350_613308,7,bot,"Ich bin mir nicht sicher, was du genau meinst. Kannst du das anders formulieren?",['intro_61'],"[(0, 81)]"
136,20230130_133350_613308,8,user,"Die Urteile der KI wären objektiv, da sie lediglich auf Basis von Fakten entscheiden würden und keinerlei Subjektivität durch Emotionen, Sympathie etc. im Spiel wäre.",['Z.P1'],"[(0, 166)]"
137,20230130_133350_613308,9,bot,Das mag sein. Aber zu beachten ist: Die Entwicklung von KI ist bisher nahezu keinen moralischen Leitlinien und Regeln unterworfen und kann nicht werten. Richter:innen hingegen bekennen sich zu Werten durch die Ausübung ihres Berufs und des rechtlichen Rahmens.,"['intro_3', 'z_trans_12', 'Z.K6']","[(0, 14), (14, 36), (36, 261)]"
138,20230130_133350_613308,10,user,"Aber das wäre doch gut, wenn sie nicht werten.",['OTHER'],"[(0, 46)]"
139,20230130_133350_613308,11,bot,"Ich bin mir nicht sicher, was du genau meinst. Kannst du das anders ausdrücken?",['intro_62'],"[(0, 80)]"
140,20230130_133350_613308,12,user,"KI müsste nicht erst für die Fälle recherchieren etc., sondern die Hintergrundfakten wären alle abgespeichert, wodurch die KI direkt darauf zurückgreifen könnte.",['Z.P2'],"[(0, 161)]"
141,20230130_133350_613308,13,bot,"Das verstehe ich. Um auch noch einmal eine andere Seite zu beleuchten: Die jurKI kann dem/der Adressat:in ihrer Macht nicht menschlich begegnen, sondern dies allenfalls simulieren, da die Black Box undurchschaubar ist. Wie kann sie über das Leben der Bürger:innen urteilen, wenn sie hiervon keine Ahnung hat?","['intro_1', 'z_trans_13', 'Z.K2']","[(0, 18), (18, 71), (71, 310)]"
142,20230130_133350_613308,14,user,Keine Ahnung,['OTHER'],"[(0, 12)]"
143,20230130_133350_613308,15,bot,"Ich bin mir nicht sicher, was du genau meinst. Kannst du das anders ausdrücken?",['intro_62'],"[(0, 80)]"
144,20230130_133350_613308,16,user,"Wenn man KI bei gerichtlichen Prozessen einsetzen würde, würden die langen Wartezeiten, bis die Prozesse beginnen, verkürzt werden, die momentan vorherrschen.",['Z.P2'],"[(0, 158)]"
145,20230130_133350_613308,17,bot,Das verstehe ich. Aber zu beachten ist: Die von der jurKI präsentierten Ergebnisse sind in ihrer Ausgabe weniger flexibel. Die Befassung menschlicher Richter:innen zur endgültigen Entscheidung erlaubt ihnen die Ausübung der notwendigen Ermessensmacht. Dies ist Ausdruck einer individualisierten Rechtsprechung.,"['intro_1', 'z_trans_12', 'Z.K4']","[(0, 18), (18, 40), (40, 311)]"
146,20230130_133350_613308,18,user,Kompromiss: KI gemeinsam mit Richter:innen einsetzen und nicht entweder oder.,['NZ.K10'],"[(0, 77)]"
147,20230130_133350_613308,19,bot,"Du meinst also, dass moralische Leitlinien und Regeln vorgegeben sind. Das verstehe ich. Darüber hinaus finde ich, dass hier noch folgendes beachtet werden sollte: Eine jurKI kann sich in ihrer Entscheidungsfindung irren und zu einem falschen Ergebnis kommen.","['intro_23', 'Z.K6-1', 'intro_54', 'z_trans_1', 'Z.K10']","[(0, 21), (21, 71), (71, 89), (89, 164), (164, 260)]"
148,20230130_133350_613308,20,user,"Deswegen gäbe es ja eine höhere menschliche Instanz,  die notfalls eingreifen würde.",['Z.K3-2'],"[(0, 84)]"
149,20230130_133350_613308,21,bot,"Dein Argument ist, dass Irren menschlich ist. Da gebe ich dir recht. Ansprechen möchte ich noch: Die jurKI als Richter:in könnte auf wenig Akzeptanz in der Gesellschaft stoßen. Immerhin will man als Mensch von der Justiz wahrgenommen werden und nicht von einem Programm einfach und schnell ""verwertet"" werden.","['intro_25', 'Z.K10-1', 'intro_6', 'z_trans_11', 'Z.K9']","[(0, 24), (24, 46), (46, 69), (69, 97), (97, 310)]"
150,20230130_121046_537965,0,user,KI würde unnötig lange bürokratische Prozesse vermeiden,['Z.P2'],"[(0, 55)]"
151,20230130_121046_537965,1,bot,"Mit anderen Worten, KI lernt nur aus vorurteils- und diskriminierungsfreien Fällen. Das ist ein gutes Argument. Ein weiterer Gesichtspunkt gehört hierher. Die Entwicklung von KI ist bisher nahezu keinen moralischen Leitlinien und Regeln unterworfen und kann nicht werten. Richter:innen hingegen bekennen sich zu Werten durch die Ausübung ihres Berufs und des rechtlichen Rahmens.","['intro_32', 'Z.K6-1-1-1', 'intro_52', 'z_trans_16', 'Z.K6']","[(0, 20), (20, 84), (84, 112), (112, 155), (155, 380)]"
152,20230130_121046_537965,2,user,Menschen werden nicht durch in die Länge gezogene Prozesse diskriminiert und eingeschüchtert,['Z.P3'],"[(0, 92)]"
153,20230130_121046_537965,3,bot,"Ich bin mir nicht sicher, was du genau meinst. Kannst du das anders formulieren?",['intro_61'],"[(0, 81)]"
154,20230130_121046_537965,4,user,oft dauert es sehr lange bis es zum Gerichtsprozess kommt. Menschen warten dann Wochen/Monate auf die Anklage und wissen nicht was passiert. Ich denke mit KI würde das schneller gehen,['Z.P2'],"[(0, 183)]"
155,20230130_121046_537965,5,bot,"Das ist möglich. Um auch noch einmal eine andere Seite zu beleuchten: Die jurKI kann dem/der Adressat:in ihrer Macht nicht menschlich begegnen, sondern dies allenfalls simulieren, da die Black Box undurchschaubar ist. Wie kann sie über das Leben der Bürger:innen urteilen, wenn sie hiervon keine Ahnung hat?","['intro_2', 'z_trans_13', 'Z.K2']","[(0, 17), (17, 70), (70, 309)]"
156,20230130_125910_469111,0,user,"KI ist neutral und hat alle Infornationen, die man braucht",['Z.P1'],"[(0, 58)]"
157,20230130_125910_469111,1,bot,"Du meinst also, dass KI nur aus vorurteils- und diskriminierungsfreien Fällen lernt. Das ist ein gutes Argument. Aber zu beachten ist: Die Entwicklung von KI ist bisher nahezu keinen moralischen Leitlinien und Regeln unterworfen und kann nicht werten. Richter:innen hingegen bekennen sich zu Werten durch die Ausübung ihres Berufs und des rechtlichen Rahmens.","['intro_23', 'Z.K6-1-1-1', 'intro_52', 'z_trans_12', 'Z.K6']","[(0, 21), (21, 85), (85, 113), (113, 135), (135, 360)]"
158,20230130_125910_469111,2,user,"Aber KI wäre auch schlau genug, Werten zu lernen.",['Z.K6-2'],"[(0, 50)]"
159,20230130_125910_469111,3,bot,"Kurz zusammengefasst, der KI können juristische Werte beigebracht werden. Da gebe ich dir recht. Darüber hinaus finde ich, dass hier noch folgendes beachtet werden sollte: Die Regel und Leitlinien sind schnell erlassen, allerdings dürfte sich die Umsetzung beispielsweise eines Diskriminierungsgesetzes für die jurKI als schwierig erweisen, da eine KI auch aus Fällen lernt, in denen möglicherweise vorurteilsbehaftet und diskriminierend von menschlichen Richter:innen entschieden wurde.","['intro_24', 'Z.K6-2', 'intro_6', 'z_trans_1', 'Z.K6-1-1']","[(0, 22), (22, 74), (74, 97), (97, 172), (172, 488)]"
160,20230130_125910_469111,4,user,Aber man könnte darauf hinweisen und das verbessern,['OTHER'],"[(0, 51)]"
161,20230130_125910_469111,5,bot,"Ich bin mir nicht sicher, was du genau meinst. Kannst du das anders formulieren?",['intro_61'],"[(0, 81)]"
162,20230130_125910_469111,6,user,Man kann auf die diskriminierende Fälle hinweisen und sie aus dem Datenbank des KIs entfernen,['Z.K6-1-1-1'],"[(0, 93)]"
163,20230130_125910_469111,7,bot,"Das verstehe ich. Aber hast Du schon einmal daran gedacht: Die jurKI kann dem/der Adressat:in ihrer Macht nicht menschlich begegnen, sondern dies allenfalls simulieren, da die Black Box undurchschaubar ist. Wie kann sie über das Leben der Bürger:innen urteilen, wenn sie hiervon keine Ahnung hat?","['intro_1', 'z_trans_2', 'Z.K2']","[(0, 18), (18, 59), (59, 298)]"
164,20230130_125910_469111,8,user,"Sie wird nur über gute Bespiele lernen, die wir vorher aussuchen würden",['Z.K6-1-1-1'],"[(0, 71)]"
165,20230130_125910_469111,9,bot,"Ich bin mir nicht sicher, was du genau meinst. Kannst du das anders ausdrücken?",['intro_62'],"[(0, 80)]"
166,20230130_125910_469111,10,user,Mein deutsch ist schlecht tut mir leid,['OTHER'],"[(0, 38)]"
167,20230130_125910_469111,11,bot,Das mag sein. Um auch noch einmal eine andere Seite zu beleuchten: Die von der jurKI präsentierten Ergebnisse sind in ihrer Ausgabe weniger flexibel. Die Befassung menschlicher Richter:innen zur endgültigen Entscheidung erlaubt ihnen die Ausübung der notwendigen Ermessensmacht. Dies ist Ausdruck einer individualisierten Rechtsprechung.,"['intro_3', 'z_trans_13', 'Z.K4']","[(0, 14), (14, 67), (67, 338)]"
168,20230130_125910_469111,12,user,Ok du hast recjt,['CONSENT'],"[(0, 16)]"
169,20230130_125910_469111,13,bot,"Ich bin mir nicht sicher, was du genau meinst. Kannst du das anders formulieren?",['intro_61'],"[(0, 81)]"
170,20230130_125910_469111,14,user,Das war ne schlechte Entscheidung dieses Thema auszuwählen,['OTHER'],"[(0, 58)]"
171,20230130_125910_469111,15,bot,"Das verstehe ich. Ansprechen möchte ich noch: Die jurKI als Richter:in könnte auf wenig Akzeptanz in der Gesellschaft stoßen. Immerhin will man als Mensch von der Justiz wahrgenommen werden und nicht von einem Programm einfach und schnell ""verwertet"" werden.","['intro_1', 'z_trans_11', 'Z.K9']","[(0, 18), (18, 46), (46, 259)]"
172,20230130_125910_469111,16,user,Macht Sinn,['CONSENT'],"[(0, 10)]"
173,20230130_125910_469111,17,bot,"Du sagst, dass die KI einem strikten Regelwerk und kann ihre Entscheidung begründen folgt. Das ist möglich. Selbst wenn die KI ihr Ergebnis begründen kann, wie können wir uns sicher sein, dass es sich hierbei auch tatsächlich um ihre Gründe handelt, die zum Ergebnis geführt haben?","['intro_27', 'Z.K2-1', 'intro_2', 'Z.K2-1-2']","[(0, 15), (15, 91), (91, 108), (108, 283)]"
174,20230130_125910_469111,18,user,"Denkst du, dass in der Zukunft KI schlauer wird?",['OTHER'],"[(0, 48)]"
175,20230130_125910_469111,19,bot,"Kurz zusammengefasst, KI lernt nur aus vorurteils- und diskriminierungsfreien Fällen. Das verstehe ich. Ein weiterer Gesichtspunkt gehört hierher. Eine jurKI kann sich in ihrer Entscheidungsfindung irren und zu einem falschen Ergebnis kommen.","['intro_24', 'Z.K6-1-1-1', 'intro_54', 'z_trans_16', 'Z.K10']","[(0, 22), (22, 86), (86, 104), (104, 147), (147, 243)]"
176,20230130_122507_078392,0,user,Es fehlt die Menschlichkeit.,['Z.P1-1'],"[(0, 28)]"
177,20230130_122507_078392,1,bot,"Dein Argument ist, dass die menschliche Subjektivtät für eine Entscheidung notwendig ist. Das verstehe ich. Der Einwand, die jurKI hätte keine eigenen Emotionen und Empfindungen ist insoweit hinfällig, als dass auch Richter:innen nicht nach ihren eigenen Gefühlen, sondern auf der Grundlage des Gesetzes entscheiden.","['intro_25', 'Z.P1-1', 'intro_1', 'Z.P1-1-1']","[(0, 24), (24, 90), (90, 108), (108, 317)]"
178,20230130_122507_078392,2,user,"Klar ist die Rechtslage ausschlaggebend, aber was ist mit Milderung z.B.?",['Z.P1-1-1'],"[(0, 73)]"
179,20230130_122507_078392,3,bot,"Ich bin mir nicht sicher, was du genau meinst. Kannst du das anders formulieren?",['intro_61'],"[(0, 81)]"
180,20230130_122507_078392,4,user,Was ist mit mildernden Umständen?,['OTHER'],"[(0, 33)]"
