dialogue_id,utterance_id,utterance_type,utterance,labels,bounds
20230720_133542_244414,15,bot,"Ich bin mir nicht sicher, was du meinst. Bitte wähle aus der folgenden Liste ein Argument aus, das deinen Standpunkt am besten repräsentiert. | Ich stimme deiner Argumentation zu. |   Schön, dass du mein Argument gut findest.   Ansprechen möchte ich noch: Die jurKI als Richter:in könnte auf wenig Akzeptanz in der Gesellschaft stoßen.",['OTHER'],"[(0, 335)]"
20230720_133542_244414,16,user,braucht nur ein paar jahre zur eingewöhnung,['Z.K9-1'],"[(0, 43)]"
20230720_133542_244414,17,bot,"Ich bin mir nicht sicher, was du meinst. Bitte wähle aus der folgenden Liste ein Argument aus, das deinen Standpunkt am besten repräsentiert. | Akzeptanz in Gesellschaft nimmt zu |   Ich denke damit liegst du richtig.  Aber zu beachten ist: Bei der jurKI könnte die subjektive Wirkung auf dem Weg liegen bleiben. Man denke z.B. an die Wirkung, die Richter:innen mit dem Spruch ""im Namen des Volkes"" bei den Verfahrensteilnehmenden hervorruft. Diese wäre nur sehr schwer durch eine Maschine zu reproduzieren.",['Z.K9-1'],"[(0, 507)]"
20230720_133542_244414,18,user,schnellere entscheidungen in überlasteten system,['Z.P2'],"[(0, 48)]"
20230720_133542_244414,19,bot,"Mit anderen Worten, die Justiz ist überlastet. Das verstehe ich. Andererseits: Die Beschleunigung des Verfahrens durch den Einsatz der jurKI könnte allerdings zur Folge haben, dass aufgrund der wegfallenden Wartezeit weniger neue Betrachtungsweisen oder Beweise ans Licht kommen.","['intro_32', 'Z.P2', 'intro_50', 'Z.P2-2']","[(0, 20), (20, 47), (47, 79), (79, 280)]"
20230720_122829_734301,0,user,Die Urteile wären zu streng an Gesetzen orientiert. Richter sind in ihrer Rechtssprechung im Zweifelsfall unabhängig vom Gesetz und können individuelle Urteile sprechen.,['Z.P1-2'],"[(0, 170)]"
20230720_122829_734301,1,bot,"Ich bin mir nicht sicher, was du meinst. Bitte wähle aus der folgenden Liste ein Argument aus, das deinen Standpunkt am besten repräsentiert. | unterschiedliche Richter:innen; unterschiedliche Urteile |   Das verstehe ich.  Ein weiterer Gesichtspunkt gehört hierher. Durch den Einsatz der jurKI kann der Faktor Subjektivität bei Gerichtsurteilen ausgeräumt werden. Eine jurKI lässt sich nicht etwa durch Mitgefühl von den objektiven Fakten ablenken. Dies führt zu mehr Gerechtigkeit.",['Z.P1-2'],"[(0, 483)]"
20230720_122829_734301,2,user,Objektivität führt nicht zwangsläufig zu mehr Gerechtigkeit,['Z.P1-1'],"[(0, 59)]"
20230720_122829_734301,3,bot,"Mit anderen Worten, unterschiedliche Richter:innen führen zu unterschiedlichen Urteilen, aufgrund verschiedener richtiger Abwägungen. Das kann ich nachvollziehen. Aber zu beachten ist: Die jurKI kann eine hohe Komplexität an Datenmengen verarbeiten und darauf trainiert werden, so viele Korrelationen wie möglich zu identifizieren und dadurch die Faktoren aufdecken, die ein/e menschliche/r Richter:in übersehen könnte.","['intro_32', 'Z.P1-2', 'intro_53', 'z_trans_12', 'Z.P4']","[(0, 20), (20, 134), (134, 163), (163, 185), (185, 420)]"
20230720_122829_734301,4,user,"Das stimmt, aber Urteile könnten so viel stärker durch Cyberkriminalität beeinflusst werden",['Z.K14'],"[(0, 91)]"
20230720_122829_734301,5,bot,"Du sagst, dass Gerichte interessanter für Cyberkriminalität werden. Dein Argument ist nicht spezifisch bzgl. der jurKI sondern gilt für viele fortgeschrittliche Innovationen. Mit der zunehmenden Digitalisierung, etwa mit Einführung der digitalen Patient:innenakte, müssen sich Kliniken ohnehin stärker gegen Cyberangriffe schützen. Die fertigen Systeme laufen im geschützten Bereich der Klinik und unterliegen dem gleichen Schutz wie Patient:innendaten.","['intro_27', 'Z.K14', 'intro_57', 'Z.K14-1']","[(0, 15), (15, 68), (68, 175), (175, 454)]"
20230720_122829_734301,6,user,Aber bei Gerichten könnten so Urteile schwer negativ beeinflusst werden.,['Z.K14'],"[(0, 72)]"
20230720_122829_734301,7,bot,"Du sagst, dass Bei der KI strukturelle Fehler möglich sind. Das verstehe ich. Andererseits: Ein fehlerhaftes Urteil durch die jurKI hat die gleiche Tragweite und Auswirkung wie ein fehlerhaftes Urteil durch eine:n menschliche:n Richter:in. Daher besteht kein Grund hier von weitreichenderen Schäden bei der jurKI als Richter:in auszugehen.","['intro_27', 'Z.P3-1', 'intro_50', 'Z.P3-1-2']","[(0, 15), (15, 60), (60, 92), (92, 340)]"
20230720_122829_734301,8,user,Die Fehler von menschlichen Richtern sind eher nicht so strukturell.,['Z.P3-1'],"[(0, 68)]"
20230720_122829_734301,9,bot,"Ich bin mir nicht sicher, was du meinst. Bitte wähle aus der folgenden Liste ein Argument aus, das deinen Standpunkt am besten repräsentiert. | Umsetzung von Richtlinien und Regeln schwierig |   Darauf geht unser Szenario wie folgt ein: Neben der Umsetzung der Regeln und Leitlinien wird eine jurKI ausschließlich aus selektierten Fällen, die gerade nicht vorurteilsbehaftet und diskriminierend sind, lernen und somit bestehende Vorurteile oder Diskriminierungen nicht berücksichtigen.",['Z.K6-1-1'],"[(0, 487)]"
20230720_122829_734301,10,user,Wie stellt man die Selektion der Fälle sicher?,['CON_ZARG'],"[(0, 47)]"
20230720_122829_734301,11,bot,"Ich bin mir nicht sicher, was du meinst. Bitte wähle aus der folgenden Liste ein Argument aus, das deinen Standpunkt am besten repräsentiert. | Ich stimme deiner Argumentation zu. |   Schön, dass du mein Argument gut findest.   Aber zu beachten ist: Die jurKI ist ein zertifizierter Service des Staates, der die moralischen Leitlinien und Regeln vorgibt. Hierfür werden insb. auch die Erkenntnisse der Philosophie und Computerwissenschaft hinzugezogen und z.B. in ein passendes Diskriminierungsgesetz übersetzt.",['OTHER'],"[(0, 511)]"
20230720_122829_734301,12,user,Wir haben keine einheitlichen moralischen Leitlinien,['Z.P1-2'],"[(0, 52)]"
20230720_122829_734301,13,bot,"Du sagst, dass KI keine Werte befolgt. Darauf geht unser Szenario wie folgt ein: Dieser Einwand beruht auf einem technisch überholten Bild und setzt ein idealisiertes Bild von Richter:innen voraus. Das Lernverfahren erfolgt mittlerweile Bottom-Up, also bspw. zunächst anhand kleinerer und einfacher Fälle bis hin zu komplexen und schwierigen Sachverhalten, und der jurKI können Werte beigebracht werden, etwa durch das sog. supervised learning.","['intro_27', 'Z.K6', 'intro_55', 'Z.K6-2']","[(0, 15), (15, 39), (39, 81), (81, 446)]"
20230720_122829_734301,14,user,Wer entscheidet welche Werte befolgt werden sollen? Was ist mit juristischen Streitfällen?,"['CON_ZARG', 'FAQ.G1']","[(0, 51), (51, 90)]"
20230720_122829_734301,15,bot,"Ich bin mir nicht sicher, was du meinst. Bitte wähle aus der folgenden Liste ein Argument aus, das deinen Standpunkt am besten repräsentiert. | Rechte der Betroffenen werden eingeschränkt |   Dem würde ich zustimmen.  Darüber hinaus finde ich, dass hier noch folgendes beachtet werden sollte: Die jurKI erweitert den Zugang zu Rechtshilfe, da die Gerichte ihr Regelsystem zur Verfügung stellen können. Bestehende Systeme würden es leichter haben, da nur noch Fakten festgestellt werden müssen und schon vorab die zu erwartende Entscheidung gegeben werden kann.",['Z.P5-1'],"[(0, 560)]"
20230720_122829_734301,16,user,Ich bin trotzdem dagegen,['OTHER'],"[(0, 25)]"
20230720_122829_734301,17,bot,"Ich bin mir nicht sicher, was du meinst. Bitte wähle aus der folgenden Liste ein Argument aus, das deinen Standpunkt am besten repräsentiert. | Ich finde deine Argumentation nicht überzeugend. |   Es ist schade, dass du meine Argumente nicht überzeugend findest.  Aber hast Du schon einmal daran gedacht: Transparenz und Interpretierbarkeit könnten Zurechnungshindernisse bei der jurKI überwinden. Die jurKI folgt einem strikten Regelwerk und wäre hierdurch durchaus in der Lage ihre Entscheidung zu begründen.",['OTHER'],"[(0, 510)]"
20230720_125824_345628,0,user,"Jeder Fall im Zivilrecht ist individuell und beinhaltet spezielle Faktoren. Es würde dem Menschen nicht gerecht werden, wenn ein Computer über das Urteil entscheidet.",['Z.P4-1'],"[(0, 167)]"
20230720_125824_345628,1,bot,"Ich bin mir nicht sicher, was du meinst. Bitte wähle aus der folgenden Liste ein Argument aus, das deinen Standpunkt am besten repräsentiert. | Nicht alle Faktoren können aufgedeckt werden |   Ich denke damit liegst du richtig.  Darüber hinaus finde ich, dass hier noch folgendes beachtet werden sollte: Durch den Einsatz der jurKI kann der Faktor Subjektivität bei Gerichtsurteilen ausgeräumt werden. Eine jurKI lässt sich nicht etwa durch Mitgefühl von den objektiven Fakten ablenken. Dies führt zu mehr Gerechtigkeit.",['Z.P4-1'],"[(0, 520)]"
20230720_125824_345628,2,user,Ich finde aber das genau diese Subjektivität auch wichtig sein kann,['Z.P1-1'],"[(0, 68)]"
20230720_125824_345628,3,bot,"Du meinst also, dass die subjektive Wirkung leidet. Das mag sein. In Deutschland sitzen die Menschen bereits durchschnittlich über 10h am Tag vor einem Bildschirm. Das zeigt, dass die Menschen keine echte Persönlichkeit vor sich brauchen, auch nicht bei Entscheidungen. Der menschliche Aspekt wird immer weiter in den Hintergrund gedrängt.","['intro_23', 'Z.K11', 'intro_3', 'Z.K11-1']","[(0, 21), (21, 52), (52, 66), (66, 340)]"
20230720_125824_345628,4,user,"Aber das ist doch schade, das ist für mich kein valides Argument",['DISSENT'],"[(0, 65)]"
20230720_125824_345628,5,bot,"Ich bin mir nicht sicher, was du meinst. Bitte wähle aus der folgenden Liste ein Argument aus, das deinen Standpunkt am besten repräsentiert. | mangelnde Persönlichkeit der KI; algorithmische Tyrannei |   Das mag sein. Transparenz und Interpretierbarkeit könnten Zurechnungshindernisse bei der jurKI überwinden. Die jurKI folgt einem strikten Regelwerk und wäre hierdurch durchaus in der Lage ihre Entscheidung zu begründen.",['Z.K2'],"[(0, 426)]"
20230720_125824_345628,6,user,Nicht alle Fälle können nach einem strikten Regelwerk beurteilt werden. Häufig sind auch andere Faktoren notwendig,['Z.P4-1'],"[(0, 115)]"
20230720_125824_345628,7,bot,"Ich bin mir nicht sicher, was du meinst. Bitte wähle aus der folgenden Liste ein Argument aus, das deinen Standpunkt am besten repräsentiert. | unterschiedliche Richter:innen; unterschiedliche Urteile |   Das kann ich nachvollziehen.  Ein weiterer Gesichtspunkt gehört hierher. Die jurKI kann eine hohe Komplexität an Datenmengen verarbeiten und darauf trainiert werden, so viele Korrelationen wie möglich zu identifizieren und dadurch die Faktoren aufdecken, die ein/e menschliche/r Richter:in übersehen könnte.",['Z.P1-2'],"[(0, 512)]"
20230720_125824_345628,8,user,Da stimme ich zu. Ich finde aber trotzdem dass ein gerichtliches Urteil etwas menschliches ist und von Menschen mit Emotionen und Meinungen beurteilt werden sollte,"['CONSENT', 'Z.P1-1']","[(0, 17), (17, 163)]"
20230720_125824_345628,9,bot,"Du merkst an, dass die menschliche Subjektivtät für eine Entscheidung notwendig ist. Das mag sein. Der Einwand, die jurKI hätte keine eigenen Emotionen und Empfindungen ist insoweit hinfällig, als dass auch Richter:innen nicht nach ihren eigenen Gefühlen, sondern auf der Grundlage des Gesetzes entscheiden.","['intro_28', 'Z.P1-1', 'intro_3', 'Z.P1-1-1']","[(0, 19), (19, 85), (85, 99), (99, 308)]"
20230720_125824_345628,10,user,"Kein Mensch kann nur auf Grundlage des Gesetzes handeln. Menschliche Emotionen können nicht ausgeschalten werden, dementsprechend fließen sie in jedes Urteil ein und sind auch wichtig um die Gewichtigkeit der Fälle zu differenzieren",['Z.P1-1'],"[(0, 233)]"
20230720_125824_345628,11,bot,"Mit anderen Worten, die menschliche Subjektivtät ist für eine Entscheidung notwendig. Ich denke damit liegst du richtig. Aber zu beachten ist: Richter:innen stehen intern und extern unter enormem Druck. Die jurKI verspürt keinen Druck und erzielt gleichbleibend gute Ergebnisse. Stabile, nichtdiskriminierende Schlussfolgerungen fördern ein einheitliches Entscheidungsergebnis sowie Stabilität und Autorität des Rechts.","['intro_32', 'Z.P1-1', 'intro_5', 'z_trans_12', 'Z.P3']","[(0, 20), (20, 86), (86, 121), (121, 143), (143, 420)]"
20230720_125824_345628,12,user,Aber KI können auch manipuliert werden,['Z.P5-1'],"[(0, 39)]"
20230720_125824_345628,13,bot,"Mit anderen Worten, die Rechte der Betroffenen werden durch unvollständige bzw fehlerhafte Daten eingeschränkt. Ich denke damit liegst du richtig. Ein weiterer Gesichtspunkt gehört hierher. Die jurKI erweitert den Zugang zu Rechtshilfe, da die Gerichte ihr Regelsystem zur Verfügung stellen können. Bestehende Systeme würden es leichter haben, da nur noch Fakten festgestellt werden müssen und schon vorab die zu erwartende Entscheidung gegeben werden kann.","['intro_32', 'Z.P5-1', 'intro_5', 'z_trans_16', 'Z.P5']","[(0, 20), (20, 112), (112, 147), (147, 190), (190, 458)]"
20230720_125824_345628,14,user,Deine Argumente sind nicht valide,['DISSENT'],"[(0, 33)]"
20230720_125824_345628,15,bot,"Ich bin mir nicht sicher, was du meinst. Bitte wähle aus der folgenden Liste ein Argument aus, das deinen Standpunkt am besten repräsentiert. | Keine moralischen Leitlinien und Regeln für KI, kein Werten |   Darauf geht unser Szenario wie folgt ein: Die jurKI ist ein zertifizierter Service des Staates, der die moralischen Leitlinien und Regeln vorgibt. Hierfür werden insb. auch die Erkenntnisse der Philosophie und Computerwissenschaft hinzugezogen und z.B. in ein passendes Diskriminierungsgesetz übersetzt.",['Z.K6'],"[(0, 513)]"
20230720_125824_345628,16,user,Solche Prozesse sind zu komplex für eine KI,['FAQ.5'],"[(0, 43)]"
20230720_125824_345628,17,bot,"Ich bin mir nicht sicher, was du meinst. Bitte wähle aus der folgenden Liste ein Argument aus, das deinen Standpunkt am besten repräsentiert. | Menschen würden gläsern werden. |   Das ist ein gutes Argument.  Aber zu beachten ist: Richter:innen werden auch mit der jurKI weiterhin gebraucht und eingesetzt werden. Die jurKI soll diese nur bei der Entscheidungsfindung und -verkündung ersetzen, die Implementierung der Sachlage übernehmen weiterhin Richter:innen.",['Z.K15'],"[(0, 462)]"
20230720_133104_793986,0,user,"KIs können Entscheidungen treffen, ohne persönliche Meinungen einfließen zu lassen.",['Z.P1'],"[(0, 83)]"
20230720_133104_793986,1,bot,"Du sagst, dass die jurKI objektiv ist. Das ist ein gutes Argument. Direkt dazu: Die Richter:innen sind immer unterschiedliche Personen und entscheiden dementsprechend unterschiedlich. Dies ist für ein funktionierendes Rechtssystem von großer Bedeutung, da unterschiedliche Urteile auch das Ergebnis verschiedener an sich richtiger Abwägungen sein können.","['intro_27', 'Z.P1', 'intro_47', 'Z.P1-2']","[(0, 15), (15, 39), (39, 80), (80, 355)]"
20230720_133104_793986,2,user,"Das stimmt, aber dennoch sollen alle Menschen gleich vor dem Gericht sein, daher auch der Richter alle gleich behandeln",['Z.P3'],"[(0, 119)]"
20230720_133104_793986,3,bot,"Ich bin mir nicht sicher, was du meinst. Bitte wähle aus der folgenden Liste ein Argument aus, das deinen Standpunkt am besten repräsentiert. | Kein Druck |   Das kann ich nachvollziehen. Andererseits: Da die JurKI bei gleichem Input immer das gleiche Ergebnis liefern würde, würden Fehler an vielen Stellen gleichzeitig passieren und wären so deutliche weitreichender, als die eines Menschen.",['Z.P3'],"[(0, 396)]"
20230720_133104_793986,4,user,Aber das Juristische System ist überlastet und es würde helfen,['Z.P2'],"[(0, 62)]"
20230720_133104_793986,5,bot,"Du meinst also, dass die Justiz überlastet ist. Das kann ich nachvollziehen. Andererseits: Die Beschleunigung des Verfahrens durch den Einsatz der jurKI könnte allerdings zur Folge haben, dass aufgrund der wegfallenden Wartezeit weniger neue Betrachtungsweisen oder Beweise ans Licht kommen.","['intro_23', 'Z.P2', 'intro_49', 'Z.P2-2']","[(0, 21), (21, 48), (48, 91), (91, 292)]"
20230720_133104_793986,6,user,Ja aber die KI ist doch gut geschult und kann alle betrachtunsgweisen nachvollziehen,['Z.P4'],"[(0, 84)]"
20230720_133104_793986,7,bot,"Ich bin mir nicht sicher, was du meinst. Bitte wähle aus der folgenden Liste ein Argument aus, das deinen Standpunkt am besten repräsentiert. | jurKI folgt einem strikten Regelwerk |   Das ist möglich. Selbst wenn die KI ihr Ergebnis begründen kann, wie können wir uns sicher sein, dass es sich hierbei auch tatsächlich um ihre Gründe handelt, die zum Ergebnis geführt haben?",['Z.K2-1'],"[(0, 378)]"
20230720_133104_793986,8,user,Ja weil die KI das dann begründen kann,['Z.K2-1'],"[(0, 38)]"
20230720_133104_793986,9,bot,"Dein Argument ist, dass die KI einem strikten Regelwerk und kann ihre Entscheidung begründen folgt. Das verstehe ich. Die Kosten für die Herstellung von algorithmischen Entscheidungen könnten sich erhöhen, da alle wichtigen Entscheidungen manuell überprüft werden müssten, um sicherzustellen, dass sie auch tatsächlich transparent und somit interpretierbar sind.","['intro_25', 'Z.K2-1', 'intro_1', 'Z.K2-1-1']","[(0, 24), (24, 100), (100, 118), (118, 363)]"
20230720_133104_793986,10,user,Der Staat würde sich viele Kosten sparen,['Z.P8'],"[(0, 41)]"
20230720_133104_793986,11,bot,"Du meinst also, dass die KI günstiger ist. Das verstehe ich. Direkt dazu: Richter:innen entscheiden über Recht und Unrecht. Dabei spielen die Kosten eine eher untergeordnete Rolle. Zudem führt der Einsatz der jurKI eher zu noch mehr finanziellen Belastungen, da die Richter:innen mit der Implementierung der Sachlage beschäftigt bleiben.","['intro_23', 'Z.P8', 'intro_51', 'Z.P8-1']","[(0, 21), (21, 43), (43, 74), (74, 338)]"
20230720_133104_793986,12,user,"Das verstehe ich, aber vielleicht gibt es durch die KI weniger Falschurteile",['Z.GP1'],"[(0, 76)]"
20230720_133104_793986,13,bot,"Mit anderen Worten, flexible Ergebnisse im Zivilrecht sind nicht notwendig. Dem würde ich zustimmen. Ein weiterer Gesichtspunkt gehört hierher. Die Entwicklung von KI ist bisher nahezu keinen moralischen Leitlinien und Regeln unterworfen und kann nicht werten. Richter:innen hingegen bekennen sich zu Werten durch die Ausübung ihres Berufs und des rechtlichen Rahmens.","['intro_32', 'Z.K4-1', 'intro_4', 'z_trans_16', 'Z.K6']","[(0, 20), (20, 76), (76, 101), (101, 144), (144, 369)]"
20230720_133104_793986,14,user,Durch KI können Falsche Urteile verhindert werden,['Z.GP1'],"[(0, 49)]"
20230720_133104_793986,15,bot,"Ich bin mir nicht sicher, was du meinst. Bitte wähle aus der folgenden Liste ein Argument aus, das deinen Standpunkt am besten repräsentiert. | Kein Druck |   Das kann ich nachvollziehen.  Darüber hinaus finde ich, dass hier noch folgendes beachtet werden sollte: Um Gesetze zu interpretieren und anzuwenden bedarf es stets einer menschlichen Bewertung, ein sog. Werturteil. Das kann nur duch empathische Richter:innen sichergestellt werden, ohne zu riskieren, dass die menschlichen Rechte und die Würde verletzt bzw. beeinträchtigt werden.",['Z.P3'],"[(0, 540)]"
20230720_133104_793986,16,user,Die KI klaut Juristen nicht ihren Job,['OTHER'],"[(0, 37)]"
20230720_133104_793986,17,bot,"Du argumentierst, dass die KI nicht unter Druck steht. Das ist ein gutes Argument. Aber zu beachten ist: Auch eine jurKI kann nicht alle Faktoren vollständig aufdecken, da stets eine Einschränkung in Bezug auf die Datenqualität und -quantität, Algorithmen und Rechenleistung gegeben ist. Im menschlichen Bewusstsein könnten noch weitere Variablen verborgen sein.","['intro_26', 'Z.P3', 'intro_52', 'z_trans_12', 'Z.P4-1']","[(0, 23), (23, 55), (55, 83), (83, 105), (105, 363)]"
20230720_133104_793986,18,user,Da sie nur assistiert,['OTHER'],"[(0, 21)]"
20230720_133104_793986,19,bot,"Ich bin mir nicht sicher, was du meinst. Bitte wähle aus der folgenden Liste ein Argument aus, das deinen Standpunkt am besten repräsentiert. | Ich stimme deiner Argumentation zu. |   Freut mich, dass du mein Argument gut findest.   Ansprechen möchte ich noch: Die jurKI kann dem/der Adressat:in ihrer Macht nicht menschlich begegnen, sondern dies allenfalls simulieren, da die Black Box undurchschaubar ist. Wie kann sie über das Leben der Bürger:innen urteilen, wenn sie hiervon keine Ahnung hat?",['OTHER'],"[(0, 499)]"
20230720_120159_755146,0,user,"Wenn KI richterliche Entscheidung treffen, würden Kosten eingespart werden 
KI würde Kosten einsparen","['Z.P8', 'Z.P8']","[(0, 74), (76, 101)]"
20230720_120159_755146,1,bot,"Ich bin mir nicht sicher, was du meinst. Bitte wähle aus der folgenden Liste ein Argument aus, das deinen Standpunkt am besten repräsentiert. | Keines der genannten Argumente trifft zu. |    Wir werden dein Argument evaluieren und in einer neuen Version berücksichtigen. Bitte fahre mit deinem nächsten Argument fort.",['NoneOfTheAbove'],"[(0, 319)]"
20230720_120159_755146,2,user,"Oft sind richterliche Entscheidungen subjektiv während KI die Entscheidung objektiv Anhand der Tatsachen treffen würde 
Richter treffen Entscheidungen eher subjektiv während KI die Entscheidungen anhand objektiver Tatsachen treffen","['Z.P1', 'Z.P1']","[(0, 118), (120, 231)]"
20230720_120159_755146,3,bot,"Du meinst also, dass die jurKI objektiv ist. Dem würde ich zustimmen. Zudem sagen manche Leute:  Die Entwicklung von KI ist bisher nahezu keinen moralischen Leitlinien und Regeln unterworfen und kann nicht werten. Richter:innen hingegen bekennen sich zu Werten durch die Ausübung ihres Berufs und des rechtlichen Rahmens. Dagegen spricht: Die jurKI ist ein zertifizierter Service des Staates, der die moralischen Leitlinien und Regeln vorgibt. Hierfür werden insb. auch die Erkenntnisse der Philosophie und Computerwissenschaft hinzugezogen und z.B. in ein passendes Diskriminierungsgesetz übersetzt.","['intro_23', 'Z.P1', 'intro_43', 'Z.K6', 'z_trans_18', 'Z.K6-1']","[(0, 21), (21, 45), (45, 97), (97, 322), (322, 339), (339, 601)]"
20230720_120159_755146,4,user,"Da hast du recht Richter können eigene Erfahrungen und Werte in die Entscheidung mit einfließen lassen können 
Zudem würde das Rechtssystem zerfallen, da eine KI ja nicht den Richterplatz in einem Gericht einnehmen kann und so Gerichtsverhandlungen nicht mehr stattfinden könnten","['Z.P1-1', 'OTHER']","[(0, 110), (111, 279)]"
20230720_120159_755146,5,bot,"Kurz zusammengefasst, KI könnte von fehlerhaften Urteilen falsch lernen und Leitlinien sowie sonstige Regeln verletzen. Das ist im Szenario bereits berücksichtigt: Neben der Umsetzung der Regeln und Leitlinien wird eine jurKI ausschließlich aus selektierten Fällen, die gerade nicht vorurteilsbehaftet und diskriminierend sind, lernen und somit bestehende Vorurteile oder Diskriminierungen nicht berücksichtigen.","['intro_24', 'Z.K6-1-1', 'intro_56', 'Z.K6-1-1-1']","[(0, 22), (22, 120), (120, 164), (164, 413)]"
20230720_120159_755146,6,user,"Allerdings hat die KI nicht das juristische Fachwissen eines ausgebildeten Richters. Des Weiteren sammeln Richter und immer weiter Erfahrungen die ihre Entscheidungen beeinflussen 
Ein anderes Argument ist, dass viele Arbeitsplätze wegfallen würden","['FAQ.5', 'Z.P1-1', 'Z.K16']","[(0, 84), (84, 179), (181, 248)]"
20230720_120159_755146,7,bot,"Kurz zusammengefasst, die menschliche Subjektivtät ist für eine Entscheidung notwendig. Das mag sein. Der Einwand, die jurKI hätte keine eigenen Emotionen und Empfindungen ist insoweit hinfällig, als dass auch Richter:innen nicht nach ihren eigenen Gefühlen, sondern auf der Grundlage des Gesetzes entscheiden.","['intro_24', 'Z.P1-1', 'intro_3', 'Z.P1-1-1']","[(0, 22), (22, 88), (88, 102), (102, 311)]"
20230720_120159_755146,8,user,"Allerdings kann es auch wichtig sein nicht immer nur nach Grundlage des Gesetzes zu entscheidet, da auch Gesetzestexte ausgelegt werden müssen um auf den konkreten Fall angewandt werden zu können",['Z.K4'],"[(0, 195)]"
20230720_111638_322546,0,user,Ki sollte nicht Menschen verurteilen.,['Z.K2'],"[(0, 39)]"
20230720_111638_322546,1,bot,"Ich bin mir nicht sicher, was du meinst. Bitte wähle aus der folgenden Liste ein Argument aus, das deinen Standpunkt am besten repräsentiert. | Werturteil erforderlich bei Entscheidungen; menschliche Subjektivität notwendig |   Das mag sein. Der Einwand, die jurKI hätte keine eigenen Emotionen und Empfindungen ist insoweit hinfällig, als dass auch Richter:innen nicht nach ihren eigenen Gefühlen, sondern auf der Grundlage des Gesetzes entscheiden.",['Z.P1-1'],"[(0, 452)]"
20230720_111638_322546,2,user,Ich denke Einzelfälle werden so nicht bedacht,['DISSENT'],"[(0, 45)]"
20230720_111638_322546,3,bot,"Kurz zusammengefasst, eine KI kann auch nicht stets alle Faktoren aufdecken. Da gebe ich dir recht. Ein weiterer Gesichtspunkt gehört hierher. Durch den Einsatz der jurKI kann der Faktor Subjektivität bei Gerichtsurteilen ausgeräumt werden. Eine jurKI lässt sich nicht etwa durch Mitgefühl von den objektiven Fakten ablenken. Dies führt zu mehr Gerechtigkeit.","['intro_24', 'Z.P4-1', 'intro_6', 'z_trans_16', 'Z.P1']","[(0, 22), (22, 77), (77, 100), (100, 143), (143, 360)]"
20230720_111638_322546,4,user,Neue Fälle kann eine ki nicht entscheiden weil es keine vorherigen Daten dazu gibt,['CON_NZARG'],"[(0, 83)]"
20230720_111638_322546,5,bot,"Ich bin mir nicht sicher, was du meinst. Bitte wähle aus der folgenden Liste ein Argument aus, das deinen Standpunkt am besten repräsentiert. | Umsetzung von Richtlinien und Regeln schwierig |   Darauf geht unser Szenario wie folgt ein: Neben der Umsetzung der Regeln und Leitlinien wird eine jurKI ausschließlich aus selektierten Fällen, die gerade nicht vorurteilsbehaftet und diskriminierend sind, lernen und somit bestehende Vorurteile oder Diskriminierungen nicht berücksichtigen.",['Z.K6-1-1'],"[(0, 487)]"
20230720_111638_322546,6,user,"Ki hat auch keine eigene Persönlichkeit, das ist schlecht um in Einzelfällen abseits vom Gesetz oder Daten zu reagieren",['Z.K2'],"[(0, 119)]"
