dialogue_id,utterance_id,utterance_type,utterance,labels,bounds
20230720_120420_556391,0,user,Das Recht ist stets Auslegungssache,['Z.P1-2'],"[(0, 35)]"
20230720_120420_556391,1,bot,"Ich bin mir nicht sicher, was du meinst. Bitte wähle aus der folgenden Liste ein Argument aus, das deinen Standpunkt am besten repräsentiert. | unterschiedliche Richter:innen; unterschiedliche Urteile |   Das ist ein gutes Argument.  Ein weiterer Gesichtspunkt gehört hierher. Durch den Einsatz der jurKI kann der Faktor Subjektivität bei Gerichtsurteilen ausgeräumt werden. Eine jurKI lässt sich nicht etwa durch Mitgefühl von den objektiven Fakten ablenken. Dies führt zu mehr Gerechtigkeit.",['Z.P1-2'],"[(0, 493)]"
20230720_120420_556391,2,user,Es würden viele Arbeitsstellen wegfallen,['Z.K16'],"[(0, 40)]"
20230720_120420_556391,3,bot,"Ich bin mir nicht sicher, was du meinst. Bitte wähle aus der folgenden Liste ein Argument aus, das deinen Standpunkt am besten repräsentiert. | Rechte der Betroffenen werden eingeschränkt |   Dem würde ich zustimmen.  Darüber hinaus finde ich, dass hier noch folgendes beachtet werden sollte: Die jurKI erweitert den Zugang zu Rechtshilfe, da die Gerichte ihr Regelsystem zur Verfügung stellen können. Bestehende Systeme würden es leichter haben, da nur noch Fakten festgestellt werden müssen und schon vorab die zu erwartende Entscheidung gegeben werden kann.",['Z.P5-1'],"[(0, 560)]"
20230720_120420_556391,4,user,"Es fehlt jedoch die menschliche Abwägung und Auslegung der speziellen Situation, bei der es auch um menschliches Verhalten geht",['Z.P1-1'],"[(0, 127)]"
20230720_120420_556391,5,bot,"Dein Argument ist, dass die menschliche Subjektivtät für eine Entscheidung notwendig ist. Das mag sein. Der Einwand, die jurKI hätte keine eigenen Emotionen und Empfindungen ist insoweit hinfällig, als dass auch Richter:innen nicht nach ihren eigenen Gefühlen, sondern auf der Grundlage des Gesetzes entscheiden.","['intro_25', 'Z.P1-1', 'intro_3', 'Z.P1-1-1']","[(0, 24), (24, 90), (90, 104), (104, 313)]"
20230720_120420_556391,6,user,Das System könnte hintergangen werden,['Z.K14'],"[(0, 37)]"
20230720_120420_556391,7,bot,"Kurz zusammengefasst, Gerichte werden interessanter für Cyberkriminalität. Dein Argument ist nicht spezifisch bzgl. der jurKI sondern gilt für viele fortgeschrittliche Innovationen. Mit der zunehmenden Digitalisierung, etwa mit Einführung der digitalen Patient:innenakte, müssen sich Kliniken ohnehin stärker gegen Cyberangriffe schützen. Die fertigen Systeme laufen im geschützten Bereich der Klinik und unterliegen dem gleichen Schutz wie Patient:innendaten.","['intro_24', 'Z.K14', 'intro_57', 'Z.K14-1']","[(0, 22), (22, 75), (75, 182), (182, 461)]"
20230720_120420_556391,8,user,Das System kann nicht in den Verhandlungssaal integriert werden,['OTHER'],"[(0, 63)]"
20230720_120420_556391,9,bot,"Ich bin mir nicht sicher, was du meinst. Bitte wähle aus der folgenden Liste ein Argument aus, das deinen Standpunkt am besten repräsentiert. | wenig Akzeptanz |   Dein Argument ist nicht spezifisch bzgl. der jurKI sondern gilt für viele fortgeschrittliche Innovationen. Die Pandemie hat bereits dafür gesorgt, dass die Technik viel mehr an Akzeptanz gewinnt. Warum die jurKI als Richter:in nicht an Akzeptanz hinzugewinnen sollte, ist nicht ersichtlich.",['Z.K9'],"[(0, 456)]"
20230720_120420_556391,10,user,Außenstehende und Laien insbesondere Zeugen könnten die KI nicht ernst nehmen und sich über sie hinwegsetzen,['Z.K9'],"[(0, 109)]"
20230720_120420_556391,11,bot,"Ich bin mir nicht sicher, was du meinst. Bitte wähle aus der folgenden Liste ein Argument aus, das deinen Standpunkt am besten repräsentiert. | Nicht alle Faktoren können aufgedeckt werden |   Dem würde ich zustimmen.  Darüber hinaus finde ich, dass hier noch folgendes beachtet werden sollte: Die jurKI kann eine hohe Komplexität an Datenmengen verarbeiten und darauf trainiert werden, so viele Korrelationen wie möglich zu identifizieren und dadurch die Faktoren aufdecken, die ein/e menschliche/r Richter:in übersehen könnte.",['Z.P4-1'],"[(0, 528)]"
20230720_105806_532825,0,user,Das spart viel Zeit die die justiz besser verwenden kann,['Z.P2'],"[(0, 56)]"
20230720_105806_532825,1,bot,"Mit anderen Worten, die Justiz ist überlastet. Das kann ich nachvollziehen. Direkt dazu: Die Beschleunigung des Verfahrens durch den Einsatz der jurKI könnte allerdings zur Folge haben, dass aufgrund der wegfallenden Wartezeit weniger neue Betrachtungsweisen oder Beweise ans Licht kommen.","['intro_32', 'Z.P2', 'intro_48', 'Z.P2-2']","[(0, 20), (20, 47), (47, 89), (89, 290)]"
20230720_105806_532825,2,user,In den meisten zivilrechtlichen Verfahren ist fast alles standardisiert damit dass wenig unterschied macht,['Z.K4-1'],"[(0, 106)]"
20230720_105806_532825,3,bot,"Du merkst an, dass flexible Ergebnisse im Zivilrecht nicht notwendig sind. Ich denke damit liegst du richtig. Aber zu beachten ist: Die Entwicklung von KI ist bisher nahezu keinen moralischen Leitlinien und Regeln unterworfen und kann nicht werten. Richter:innen hingegen bekennen sich zu Werten durch die Ausübung ihres Berufs und des rechtlichen Rahmens.","['intro_28', 'Z.K4-1', 'intro_5', 'z_trans_12', 'Z.K6']","[(0, 19), (19, 75), (75, 110), (110, 132), (132, 357)]"
20230720_105806_532825,4,user,Ich denke eine KI kann leicht lernen vorstrafen oder ähnliche ein Urteil beeinflussende Faktoren zu beachten,['Z.K6-1-1-1'],"[(0, 108)]"
20230720_105806_532825,5,bot,"Ich bin mir nicht sicher, was du meinst. Bitte wähle aus der folgenden Liste ein Argument aus, das deinen Standpunkt am besten repräsentiert. | Moralische Leitlinien und Regeln vorgegeben |   Das kann ich nachvollziehen. Direkt dazu: Die Regel und Leitlinien sind schnell erlassen, allerdings dürfte sich die Umsetzung beispielsweise eines Diskriminierungsgesetzes für die jurKI als schwierig erweisen, da eine KI auch aus Fällen lernt, in denen möglicherweise vorurteilsbehaftet und diskriminierend von menschlichen Richter:innen entschieden wurde.",['Z.K6-1'],"[(0, 551)]"
20230720_105806_532825,6,user,Die KI hat trotzdem weniger Vorteile als normale Richter wenn man sich gedanken macht sie richtig zu trainieren,['Z.P1'],"[(0, 111)]"
20230720_105806_532825,7,bot,"Ich bin mir nicht sicher, was du meinst. Bitte wähle aus der folgenden Liste ein Argument aus, das deinen Standpunkt am besten repräsentiert. | keine subjektiven Urteile; mehr Gerechtigkeit; Objektivität der KI |   Das ist ein gutes Argument. Direkt dazu: Die Richter:innen sind immer unterschiedliche Personen und entscheiden dementsprechend unterschiedlich. Dies ist für ein funktionierendes Rechtssystem von großer Bedeutung, da unterschiedliche Urteile auch das Ergebnis verschiedener an sich richtiger Abwägungen sein können.",['Z.P1'],"[(0, 532)]"
20230720_105806_532825,8,user,Die ki ist viel objektiver,['Z.P1'],"[(0, 26)]"
20230720_105806_532825,9,bot,"Du sagst, dass die jurKI objektiv ist. Das verstehe ich. Direkt dazu: Um Gesetze zu interpretieren und anzuwenden bedarf es stets einer menschlichen Bewertung, ein sog. Werturteil. Das kann nur duch empathische Richter:innen sichergestellt werden, ohne zu riskieren, dass die menschlichen Rechte und die Würde verletzt bzw. beeinträchtigt werden.","['intro_27', 'Z.P1', 'intro_51', 'Z.P1-1']","[(0, 15), (15, 39), (39, 70), (70, 347)]"
20230720_105806_532825,10,user,Die ki kann ethische Entscheidungen treffen,['Z.K6-1'],"[(0, 43)]"
20230720_105806_532825,11,bot,"Du meinst also, dass moralische Leitlinien und Regeln vorgegeben sind. Das ist ein gutes Argument. Aber zu beachten ist: Die von der jurKI präsentierten Ergebnisse sind in ihrer Ausgabe weniger flexibel. Die Befassung menschlicher Richter:innen zur endgültigen Entscheidung erlaubt ihnen die Ausübung der notwendigen Ermessensmacht. Dies ist Ausdruck einer individualisierten Rechtsprechung.","['intro_23', 'Z.K6-1', 'intro_52', 'z_trans_12', 'Z.K4']","[(0, 21), (21, 71), (71, 99), (99, 121), (121, 392)]"
20230720_105806_532825,12,user,Urteile mit KI könnten viel schneller gemacht werden was Angeklagten und klägern zeit spart,['Z.P2'],"[(0, 91)]"
20230720_105806_532825,13,bot,"Du merkst an, dass die Justiz überlastet ist. Das ist ein gutes Argument. Andererseits: Beim Einsatz der jurki gibt es allerdings auch Bedenken, die berücksichtigt werden sollten. So besteht die Gefahr, dass eine Entscheidung der jurKI möglicherweise nicht so gut verstanden wird, wie die eines/einer Richter:in, mit der Folge, dass sie schwerer anzufechten sind. Immerhin beruht die KI-Entscheidung auf einer sehr komplexen Analyse von Gesetzen und Daten, die für Menschen schwer nachvollziehbar ist. Auch die Akzeptanz der KI-Entscheidungen könnte darunter leiden.","['intro_28', 'Z.P2', 'intro_46', 'Z.P2-1']","[(0, 19), (19, 46), (46, 88), (88, 567)]"
20230720_105806_532825,14,user,KGB,['OTHER'],"[(0, 3)]"
20230720_105806_532825,15,bot,"Ich bin mir nicht sicher, was du meinst. Bitte wähle aus der folgenden Liste ein Argument aus, das deinen Standpunkt am besten repräsentiert. | Richter:innen werden weiterhin gebraucht |   Da gebe ich dir recht.  Ein weiterer Gesichtspunkt gehört hierher. Richter:in ist für viele ein Berufswunsch und mithin Motiv für das Studium. Ohne dieses Berufsbild, würden sich möglicherweise weniger Menschen für das Studium entscheiden. Dies würde dazu führen, dass es weniger Jurist:innen gibt, was jedoch wichtig für die Demokratie ist.",['Z.K7-1'],"[(0, 530)]"
20230720_105806_532825,16,user,Außerdem kann KI mehr Korellationen finden,['Z.P4'],"[(0, 42)]"
20230720_105806_532825,17,bot,"Du meinst also, dass ein KI viel mehr Korrelationen finden kann. Das verstehe ich. Direkt dazu: Auch eine jurKI kann nicht alle Faktoren vollständig aufdecken, da stets eine Einschränkung in Bezug auf die Datenqualität und -quantität, Algorithmen und Rechenleistung gegeben ist. Im menschlichen Bewusstsein könnten noch weitere Variablen verborgen sein.","['intro_23', 'Z.P4', 'intro_51', 'Z.P4-1']","[(0, 21), (21, 65), (65, 96), (96, 354)]"
20230720_121609_442226,0,user,Nehmen uns die Arbeitsplätze weg,['Z.K16'],"[(0, 33)]"
20230720_121609_442226,1,bot,"Ich bin mir nicht sicher, was du meinst. Bitte wähle aus der folgenden Liste ein Argument aus, das deinen Standpunkt am besten repräsentiert. | Umsetzung von Richtlinien und Regeln schwierig |   Das ist im Szenario bereits berücksichtigt: Neben der Umsetzung der Regeln und Leitlinien wird eine jurKI ausschließlich aus selektierten Fällen, die gerade nicht vorurteilsbehaftet und diskriminierend sind, lernen und somit bestehende Vorurteile oder Diskriminierungen nicht berücksichtigen.",['Z.K6-1-1'],"[(0, 489)]"
20230720_121609_442226,2,user,Die KI hat kein Fingerspitzengefühl wie es ein Mensch hat,['Z.P1-1'],"[(0, 58)]"
20230720_121609_442226,3,bot,"Ich bin mir nicht sicher, was du meinst. Bitte wähle aus der folgenden Liste ein Argument aus, das deinen Standpunkt am besten repräsentiert. | Werturteil erforderlich bei Entscheidungen; menschliche Subjektivität notwendig |   Das verstehe ich. Der Einwand, die jurKI hätte keine eigenen Emotionen und Empfindungen ist insoweit hinfällig, als dass auch Richter:innen nicht nach ihren eigenen Gefühlen, sondern auf der Grundlage des Gesetzes entscheiden.",['Z.P1-1'],"[(0, 456)]"
20230720_121609_442226,4,user,Aber bei Wiederholungstätern gibt es keine genauen Angaben über die Strafe,['OTHER'],"[(0, 75)]"
20230720_121609_442226,5,bot,"Ich bin mir nicht sicher, was du meinst. Bitte wähle aus der folgenden Liste ein Argument aus, das deinen Standpunkt am besten repräsentiert. | Umsetzung von Richtlinien und Regeln schwierig |   Darauf geht unser Szenario wie folgt ein:  Aber zu beachten ist: Die jurKI ist ein zertifizierter Service des Staates, der die moralischen Leitlinien und Regeln vorgibt. Hierfür werden insb. auch die Erkenntnisse der Philosophie und Computerwissenschaft hinzugezogen und z.B. in ein passendes Diskriminierungsgesetz übersetzt.",['Z.K6-1-1'],"[(0, 521)]"
20230720_124505_399382,0,user,Ki kann auch richtigr Gesetze raussuchen und mithilfe alter Fälle könnte man vllt eine gewisse Empathie mit reinbringen,['OTHER'],"[(0, 119)]"
20230720_124505_399382,1,bot,"Mit anderen Worten, flexible Ergebnisse im Zivilrecht sind nicht notwendig. Da gebe ich dir recht. Aber zu beachten ist: Die Entwicklung von KI ist bisher nahezu keinen moralischen Leitlinien und Regeln unterworfen und kann nicht werten. Richter:innen hingegen bekennen sich zu Werten durch die Ausübung ihres Berufs und des rechtlichen Rahmens.","['intro_32', 'Z.K4-1', 'intro_6', 'z_trans_12', 'Z.K6']","[(0, 20), (20, 76), (76, 99), (99, 121), (121, 346)]"
20230720_124505_399382,2,user,Ki kann auch richtige Gesetze raussuchen und mithilfe alter Fälle könnte man vllt eine gewisse Empathie mit reinbringen,"['Z.P1-1-1', 'Z.K6-2']","[(0, 40), (40, 119)]"
20230720_124505_399382,3,bot,"Ich bin mir nicht sicher, was du meinst. Bitte wähle aus der folgenden Liste ein Argument aus, das deinen Standpunkt am besten repräsentiert. | keine subjektiven Urteile; mehr Gerechtigkeit; Objektivität der KI |   Das ist ein gutes Argument. Direkt dazu: Die Richter:innen sind immer unterschiedliche Personen und entscheiden dementsprechend unterschiedlich. Dies ist für ein funktionierendes Rechtssystem von großer Bedeutung, da unterschiedliche Urteile auch das Ergebnis verschiedener an sich richtiger Abwägungen sein können.",['Z.P1'],"[(0, 532)]"
20230720_124505_399382,4,user,Ja Empathie kann man durch Fütterung von alten Fällen ggfs simulieren,['Z.K6-2'],"[(0, 69)]"
20230720_124505_399382,5,bot,"Ich bin mir nicht sicher, was du meinst. Bitte wähle aus der folgenden Liste ein Argument aus, das deinen Standpunkt am besten repräsentiert. | Keines der genannten Argumente trifft zu. |    Wir werden dein Argument evaluieren und in einer neuen Version berücksichtigen. Bitte fahre mit deinem nächsten Argument fort.",['NoneOfTheAbove'],"[(0, 319)]"
20230720_124505_399382,6,user,KI ist günstiger,['Z.P8'],"[(0, 17)]"
20230720_124505_399382,7,bot,"Dein Argument ist, dass die KI günstiger ist. Das kann ich nachvollziehen. Direkt dazu: Richter:innen entscheiden über Recht und Unrecht. Dabei spielen die Kosten eine eher untergeordnete Rolle. Zudem führt der Einsatz der jurKI eher zu noch mehr finanziellen Belastungen, da die Richter:innen mit der Implementierung der Sachlage beschäftigt bleiben.","['intro_25', 'Z.P8', 'intro_48', 'Z.P8-1']","[(0, 24), (24, 46), (46, 88), (88, 352)]"
20230720_124505_399382,8,user,Gerichte sind überlastet,['Z.P2'],"[(0, 25)]"
20230720_124505_399382,9,bot,"Du merkst an, dass die Justiz überlastet ist. Das verstehe ich. Direkt dazu: Die Beschleunigung des Verfahrens durch den Einsatz der jurKI könnte allerdings zur Folge haben, dass aufgrund der wegfallenden Wartezeit weniger neue Betrachtungsweisen oder Beweise ans Licht kommen.","['intro_28', 'Z.P2', 'intro_51', 'Z.P2-2']","[(0, 19), (19, 46), (46, 77), (77, 278)]"
20230720_124505_399382,10,user,Jursiten machen auch Fehler,['OTHER'],"[(0, 28)]"
20230720_124505_399382,11,bot,"Du meinst also, dass die Verfahrensordnung an sich nicht geändert werden würde. Ich denke damit liegst du richtig. Um auch noch einmal eine andere Seite zu beleuchten: Die jurKI kann dem/der Adressat:in ihrer Macht nicht menschlich begegnen, sondern dies allenfalls simulieren, da die Black Box undurchschaubar ist. Wie kann sie über das Leben der Bürger:innen urteilen, wenn sie hiervon keine Ahnung hat?","['intro_23', 'Z.P2-2-1', 'intro_5', 'z_trans_13', 'Z.K2']","[(0, 21), (21, 80), (80, 115), (115, 168), (168, 407)]"
20230720_124505_399382,12,user,Juristen machen auch Fehler,['Z.K10-1'],"[(0, 28)]"
20230720_124505_399382,13,bot,"Ich bin mir nicht sicher, was du meinst. Bitte wähle aus der folgenden Liste ein Argument aus, das deinen Standpunkt am besten repräsentiert. | Keines der genannten Argumente trifft zu. |    Wir werden dein Argument evaluieren und in einer neuen Version berücksichtigen. Bitte fahre mit deinem nächsten Argument fort.",['NoneOfTheAbove'],"[(0, 319)]"
20230720_124505_399382,14,user,Gerechtere Gerichtshilfe unabhängig von Einkommen,['Z.P5'],"[(0, 50)]"
20230720_124505_399382,15,bot,"Dein Argument ist, dass durch die KI mehr Zugang zu Rechtshilfe ermöglicht wird. Das verstehe ich. Direkt dazu: Durch das System der KI-Entscheidungen könnten unter Umständen die Recht der Betroffenen eingeschränkt werden, sollten die Entscheidungen auf unvollständigen oder sogar auf teilweise fehlerhaften Daten basieren.","['intro_25', 'Z.P5', 'intro_51', 'Z.P5-1']","[(0, 24), (24, 81), (81, 112), (112, 324)]"
20230720_124505_399382,16,user,Prozesskosten werden gespart,['Z.P8'],"[(0, 29)]"
20230720_124505_399382,17,bot,"Du sagst, dass die KI günstiger ist. Das verstehe ich. Direkt dazu: Man müsste wie in unserem Szenario auch gegen eine jurKI eine Berufung einer höheren Instanz zulassen, die dann nicht von der gleichen jurKI entschieden werden dürfte (da jene das gleiche Ergebnis erzielen würde), sondern von menschlichen Richter:innen.","['intro_27', 'Z.P8', 'intro_51', 'Z.P8-2']","[(0, 15), (15, 37), (37, 68), (68, 322)]"
20230720_124505_399382,18,user,Ja der Prozess davor wird ja trotzdem eingespart?,['Z.P8'],"[(0, 49)]"
20230720_124505_399382,19,bot,"Dein Argument ist, dass die KI günstiger ist. Das kann ich nachvollziehen. Ansprechen möchte ich noch: Die von der jurKI präsentierten Ergebnisse sind in ihrer Ausgabe weniger flexibel. Die Befassung menschlicher Richter:innen zur endgültigen Entscheidung erlaubt ihnen die Ausübung der notwendigen Ermessensmacht. Dies ist Ausdruck einer individualisierten Rechtsprechung.","['intro_25', 'Z.P8', 'intro_53', 'z_trans_11', 'Z.K4']","[(0, 24), (24, 46), (46, 75), (75, 103), (103, 374)]"
20230720_114733_881052,0,user,Cyberangriffe,['Z.K14'],"[(0, 13)]"
20230720_114733_881052,1,bot,"Dein Argument ist, dass Gerichte interessanter für Cyberkriminalität werden. Dein Argument ist nicht spezifisch bzgl. der jurKI sondern gilt für viele fortgeschrittliche Innovationen. Mit der zunehmenden Digitalisierung, etwa mit Einführung der digitalen Patient:innenakte, müssen sich Kliniken ohnehin stärker gegen Cyberangriffe schützen. Die fertigen Systeme laufen im geschützten Bereich der Klinik und unterliegen dem gleichen Schutz wie Patient:innendaten.","['intro_25', 'Z.K14', 'intro_57', 'Z.K14-1']","[(0, 24), (24, 77), (77, 184), (184, 463)]"
20230720_114733_881052,2,user,Ok,['OTHER'],"[(0, 2)]"
20230720_114733_881052,3,bot,"Ich bin mir nicht sicher, was du meinst. Bitte wähle aus der folgenden Liste ein Argument aus, das deinen Standpunkt am besten repräsentiert. | Ergebnisse KI wenig flexibel; Ermessensmacht und individualisierte Rechtsprechung des/der Richter:in |   Das ist ein gutes Argument.  Aber zu beachten ist: Neben der Umsetzung der Regeln und Leitlinien wird eine jurKI ausschließlich aus selektierten Fällen, die gerade nicht vorurteilsbehaftet und diskriminierend sind, lernen und somit bestehende Vorurteile oder Diskriminierungen nicht berücksichtigen.",['Z.K4'],"[(0, 548)]"
20230720_114733_881052,4,user,Die KI kann die Komplexität des Prozesses noch begreifen,['FAQ.5'],"[(0, 56)]"
20230720_114733_881052,5,bot,"Ich bin mir nicht sicher, was du meinst. Bitte wähle aus der folgenden Liste ein Argument aus, das deinen Standpunkt am besten repräsentiert. | die JurKI fühlt keine Verantwortung. |   Das ist möglich. Die jurKI würde in unserem Szenario gerade nicht den kompletten Menschen durchleuchten. Vielmehr würde sie lediglich auf die durch Menschen implementierte Sachlage (Fakten) zugreifen können.",['Z.K13'],"[(0, 394)]"
20230720_114733_881052,6,user,Die subjektive Wirkung leidet,['Z.K11'],"[(0, 30)]"
20230720_114733_881052,7,bot,"Kurz zusammengefasst, die subjektive Wirkung leidet. Das verstehe ich. In Deutschland sitzen die Menschen bereits durchschnittlich über 10h am Tag vor einem Bildschirm. Das zeigt, dass die Menschen keine echte Persönlichkeit vor sich brauchen, auch nicht bei Entscheidungen. Der menschliche Aspekt wird immer weiter in den Hintergrund gedrängt.","['intro_24', 'Z.K11', 'intro_1', 'Z.K11-1']","[(0, 22), (22, 53), (53, 71), (71, 345)]"
20230720_114733_881052,8,user,KI wird nicht akzeptiert,['Z.K9'],"[(0, 24)]"
20230720_114733_881052,9,bot,"Du argumentierst, dass die KI nicht akzeptiert wird. Dein Argument ist nicht spezifisch bzgl. der jurKI sondern gilt für viele fortgeschrittliche Innovationen. Die Pandemie hat bereits dafür gesorgt, dass die Technik viel mehr an Akzeptanz gewinnt. Warum die jurKI als Richter:in nicht an Akzeptanz hinzugewinnen sollte, ist nicht ersichtlich.","['intro_26', 'Z.K9', 'intro_57', 'Z.K9-1']","[(0, 23), (23, 53), (53, 160), (160, 344)]"
20230720_114733_881052,10,user,KI hat keine Werte,['Z.K6'],"[(0, 18)]"
20230720_114733_881052,11,bot,"Du argumentierst, dass eine KI auch nicht stets alle Faktoren aufdecken kann. Dem würde ich zustimmen. Ein weiterer Gesichtspunkt gehört hierher. Durch den Einsatz der jurKI kann der Faktor Subjektivität bei Gerichtsurteilen ausgeräumt werden. Eine jurKI lässt sich nicht etwa durch Mitgefühl von den objektiven Fakten ablenken. Dies führt zu mehr Gerechtigkeit.","['intro_26', 'Z.P4-1', 'intro_4', 'z_trans_16', 'Z.P1']","[(0, 23), (23, 78), (78, 103), (103, 146), (146, 363)]"
20230720_114733_881052,12,user,KI kann nicht alle Faktoren aufdecken,['Z.P4-1'],"[(0, 37)]"
20230720_114733_881052,13,bot,"Du merkst an, dass eine KI auch nicht stets alle Faktoren aufdecken kann. Ich denke damit liegst du richtig. Ein weiterer Gesichtspunkt gehört hierher. Die jurKI kann eine hohe Komplexität an Datenmengen verarbeiten und darauf trainiert werden, so viele Korrelationen wie möglich zu identifizieren und dadurch die Faktoren aufdecken, die ein/e menschliche/r Richter:in übersehen könnte.","['intro_28', 'Z.P4-1', 'intro_5', 'z_trans_16', 'Z.P4']","[(0, 19), (19, 74), (74, 109), (109, 152), (152, 387)]"
20230720_114733_881052,14,user,KI wird nicht angenommen,['Z.K9'],"[(0, 24)]"
20230720_114733_881052,15,bot,"Du merkst an, dass die KI nicht akzeptiert wird. Dein Argument ist nicht spezifisch bzgl. der jurKI sondern gilt für viele fortgeschrittliche Innovationen. Aber zu beachten ist: Transparenz und Interpretierbarkeit könnten Zurechnungshindernisse bei der jurKI überwinden. Die jurKI folgt einem strikten Regelwerk und wäre hierdurch durchaus in der Lage ihre Entscheidung zu begründen.","['intro_28', 'Z.K9', 'intro_57', 'z_trans_12', 'Z.K2-1']","[(0, 19), (19, 49), (49, 156), (156, 178), (178, 384)]"
20230720_121434_686972,0,user,"Naja, viele Prozesse und Urteile sind davon abhängig, ob der/die Angeklagte für schuldig oder unschuldig gehalten und das ist vom Verhalten bzw. davon abhängig ob der/die Angeklagte glaubhaft Reue zeigt",['Z.P1-1'],"[(0, 202)]"
20230720_121434_686972,1,bot,"Ich bin mir nicht sicher, was du meinst. Bitte wähle aus der folgenden Liste ein Argument aus, das deinen Standpunkt am besten repräsentiert. | Werturteil erforderlich bei Entscheidungen; menschliche Subjektivität notwendig |   Das verstehe ich. Der Einwand, die jurKI hätte keine eigenen Emotionen und Empfindungen ist insoweit hinfällig, als dass auch Richter:innen nicht nach ihren eigenen Gefühlen, sondern auf der Grundlage des Gesetzes entscheiden.",['Z.P1-1'],"[(0, 456)]"
20230720_121434_686972,2,user,"Das stimmt. Aber je nachdem, ob jemand Reue zeigt oder nicht, kann das Urteil milder oder härter ausfallen","['CONSENT', 'Z.P1-1']","[(0, 11), (11, 106)]"
20230720_121434_686972,3,bot,"Ich bin mir nicht sicher, was du meinst. Bitte wähle aus der folgenden Liste ein Argument aus, das deinen Standpunkt am besten repräsentiert. | mangelnde Persönlichkeit der KI; algorithmische Tyrannei |   Das mag sein. Transparenz und Interpretierbarkeit könnten Zurechnungshindernisse bei der jurKI überwinden. Die jurKI folgt einem strikten Regelwerk und wäre hierdurch durchaus in der Lage ihre Entscheidung zu begründen.",['Z.K2'],"[(0, 426)]"
20230720_121434_686972,4,user,Aber sie hat keine Empathie.,['Z.K2'],"[(0, 29)]"
20230720_121434_686972,5,bot,"Du merkst an, dass die KI eine mangelnde Persönlichkeit hat. Ich denke damit liegst du richtig. Aber hast Du schon einmal daran gedacht: Durch den Einsatz der jurKI kann der Faktor Subjektivität bei Gerichtsurteilen ausgeräumt werden. Eine jurKI lässt sich nicht etwa durch Mitgefühl von den objektiven Fakten ablenken. Dies führt zu mehr Gerechtigkeit.","['intro_28', 'Z.K2', 'intro_5', 'z_trans_2', 'Z.P1']","[(0, 19), (19, 61), (61, 96), (96, 137), (137, 354)]"
20230720_121434_686972,6,user,"Das mag sein, aber Empathie ist trotzdem wichtig, denn auch wenn es sich objektiv um den gleichen Tatbestand handelt, ist es doch von Fall zu Fall anders",['Z.P1-1'],"[(0, 153)]"
20230720_121434_686972,7,bot,"Mit anderen Worten, die menschliche Subjektivtät ist für eine Entscheidung notwendig. Ich denke damit liegst du richtig. Ein weiterer Gesichtspunkt gehört hierher. Die jurKI kann eine hohe Komplexität an Datenmengen verarbeiten und darauf trainiert werden, so viele Korrelationen wie möglich zu identifizieren und dadurch die Faktoren aufdecken, die ein/e menschliche/r Richter:in übersehen könnte.","['intro_32', 'Z.P1-1', 'intro_5', 'z_trans_16', 'Z.P4']","[(0, 20), (20, 86), (86, 121), (121, 164), (164, 399)]"
20230720_121434_686972,8,user,Aber auch die jurKI kann Fehler machen.,['Z.K10'],"[(0, 40)]"
