dialogue_id,utterance_id,utterance_type,utterance,labels,bounds
20230720_133100_528091,1,bot,"Dein Argument ist, dass die Ergebnisse der KI wenig flexibel sind. Das ist ein gutes Argument. Aber zu beachten ist: Neben der Umsetzung der Regeln und Leitlinien wird eine jurKI ausschließlich aus selektierten Fällen, die gerade nicht vorurteilsbehaftet und diskriminierend sind, lernen und somit bestehende Vorurteile oder Diskriminierungen nicht berücksichtigen.","['intro_25', 'Z.K4', 'intro_52', 'z_trans_12', 'Z.K6-1-1-1']","[(0, 24), (24, 67), (67, 95), (95, 117), (117, 366)]"
20230720_133721_425365,0,user,"Eine KI könnte vergangene Urteile miteinbeziehen, was Urteile deutlich beschleunigen könnte.",['Z.P2'],"[(0, 92)]"
20230720_133721_425365,1,bot,"Ich bin mir nicht sicher, was du meinst. Bitte wähle aus der folgenden Liste ein Argument aus, das deinen Standpunkt am besten repräsentiert. | jurKI folgt einem strikten Regelwerk |   Das verstehe ich. Selbst wenn die KI ihr Ergebnis begründen kann, wie können wir uns sicher sein, dass es sich hierbei auch tatsächlich um ihre Gründe handelt, die zum Ergebnis geführt haben?",['Z.K2-1'],"[(0, 379)]"
20230720_133721_425365,2,user,"Eine KI hat keine subjektive Sicht auf die Sachlage wie die menschlichen Richter, und wird daher nicht von Emotionen etc. beeinflusst",['Z.P1'],"[(0, 133)]"
20230720_133721_425365,3,bot,"Du meinst also, dass die jurKI objektiv ist. Das verstehe ich. Andererseits: Die Richter:innen sind immer unterschiedliche Personen und entscheiden dementsprechend unterschiedlich. Dies ist für ein funktionierendes Rechtssystem von großer Bedeutung, da unterschiedliche Urteile auch das Ergebnis verschiedener an sich richtiger Abwägungen sein können.","['intro_23', 'Z.P1', 'intro_50', 'Z.P1-2']","[(0, 21), (21, 45), (45, 77), (77, 352)]"
20230720_133721_425365,4,user,Aber ist das nicht unfair wenn jeder Fall zu einer Einzelfall-Entscheidung wird? Das Regelwerk in der Justiz ist einheitlich und sollte daher auch einheitlich angewendet werden.,['Z.P3'],"[(0, 177)]"
20230720_133721_425365,5,bot,"Ich bin mir nicht sicher, was du meinst. Bitte wähle aus der folgenden Liste ein Argument aus, das deinen Standpunkt am besten repräsentiert. | jurKI folgt einem strikten Regelwerk |   Das mag sein. Die Kosten für die Herstellung von algorithmischen Entscheidungen könnten sich erhöhen, da alle wichtigen Entscheidungen manuell überprüft werden müssten, um sicherzustellen, dass sie auch tatsächlich transparent und somit interpretierbar sind.",['Z.K2-1'],"[(0, 445)]"
20230720_133721_425365,6,user,"Ich sehe darin kein Problem, da die KI den Gesamtprozess günstiger macht bzw. dessen Kosten allgemein senkt.",['Z.P8'],"[(0, 108)]"
20230720_133721_425365,7,bot,"Du merkst an, dass die KI günstiger ist. Das kann ich nachvollziehen. Direkt dazu: Richter:innen entscheiden über Recht und Unrecht. Dabei spielen die Kosten eine eher untergeordnete Rolle. Zudem führt der Einsatz der jurKI eher zu noch mehr finanziellen Belastungen, da die Richter:innen mit der Implementierung der Sachlage beschäftigt bleiben.","['intro_28', 'Z.P8', 'intro_48', 'Z.P8-1']","[(0, 19), (19, 41), (41, 83), (83, 347)]"
20230720_133721_425365,8,user,"Die Richter müssen sich nur mit der Entscheidung der KI beschäftigen, und werden nicht psychisch durch die Interaktion mit den Betroffenen belastet.",['Z.P3'],"[(0, 148)]"
20230720_133721_425365,9,bot,"Du meinst also, dass die KI nicht unter Druck steht. Das kann ich nachvollziehen. Direkt dazu: Da die JurKI bei gleichem Input immer das gleiche Ergebnis liefern würde, würden Fehler an vielen Stellen gleichzeitig passieren und wären so deutliche weitreichender, als die eines Menschen.","['intro_23', 'Z.P3', 'intro_48', 'Z.P3-1']","[(0, 21), (21, 53), (53, 95), (95, 288)]"
20230720_133721_425365,10,user,Deswegen werden die Entscheidungen aber auch nochmal von einem Menschen überprüft,['Z.K3-2'],"[(0, 82)]"
20230720_133721_425365,11,bot,"Ich bin mir nicht sicher, was du meinst. Bitte wähle aus der folgenden Liste ein Argument aus, das deinen Standpunkt am besten repräsentiert. | Richter:innen werden weiterhin gebraucht |   Da gebe ich dir recht.  Darüber hinaus finde ich, dass hier noch folgendes beachtet werden sollte: Richter:in ist für viele ein Berufswunsch und mithin Motiv für das Studium. Ohne dieses Berufsbild, würden sich möglicherweise weniger Menschen für das Studium entscheiden. Dies würde dazu führen, dass es weniger Jurist:innen gibt, was jedoch wichtig für die Demokratie ist.",['Z.K7-1'],"[(0, 562)]"
20230720_125438_037893,0,user,"Hallo EthiBot, das Problem bei einer KI ist, dass sie in der Theorie zwar alle gleich behandelt, tatsächlich aber internalisiert sie die bereits zugrunde liegenden systematischen Ungleichheiten in ihren Referenzdaten, also die menschlichen Fehler ihrer Erschaffer. Die Unfähigkeit der Ki über den Gesetzestext hinaus, den individuellen Fall zu beurteilen ist ihr großer Nachteil.","['Z.K6-1-1', 'Z.K4']","[(0, 264), (264, 379)]"
20230720_125438_037893,1,bot,"Ich bin mir nicht sicher, was du meinst. Bitte wähle aus der folgenden Liste ein Argument aus, das deinen Standpunkt am besten repräsentiert. | strukturelle Fehler |   Das verstehe ich. Direkt dazu: Ein fehlerhaftes Urteil durch die jurKI hat die gleiche Tragweite und Auswirkung wie ein fehlerhaftes Urteil durch eine:n menschliche:n Richter:in. Daher besteht kein Grund hier von weitreichenderen Schäden bei der jurKI als Richter:in auszugehen.",['Z.P3-1'],"[(0, 448)]"
20230720_125438_037893,2,user,"Die Ki betrachtet jedoch nur die faktische Lage, sie ignoriert vollständig individuelle Faktoren und daraus folgende Straf und Präventionsmaßnahmen",['Z.P4-1'],"[(0, 147)]"
20230720_125438_037893,3,bot,"Du argumentierst, dass eine KI auch nicht stets alle Faktoren aufdecken kann. Da gebe ich dir recht. Darüber hinaus finde ich, dass hier noch folgendes beachtet werden sollte: Durch den Einsatz der jurKI kann der Faktor Subjektivität bei Gerichtsurteilen ausgeräumt werden. Eine jurKI lässt sich nicht etwa durch Mitgefühl von den objektiven Fakten ablenken. Dies führt zu mehr Gerechtigkeit.","['intro_26', 'Z.P4-1', 'intro_6', 'z_trans_1', 'Z.P1']","[(0, 23), (23, 78), (78, 101), (101, 176), (176, 393)]"
20230720_125438_037893,4,user,"Du vergisst dass Straftaten nicht schlicht böse Taten von schlechten Menschen sondern ein Resultat der sozioökonomischen Bedingungen die den Täter dazu treiben, gerade deshalb ist ein rein faktischer Ansatz ungerecht",['Z.P1-1'],"[(0, 217)]"
20230720_125438_037893,5,bot,"Ich bin mir nicht sicher, was du meinst. Bitte wähle aus der folgenden Liste ein Argument aus, das deinen Standpunkt am besten repräsentiert. | Haftungsfragen sind noch nicht eindeutig geregelt. |   Das ist möglich. Menschliche Richter:innen machen sich nur wegen Rechtsbeugung strafbar, wenn sie bei der Entscheidung vorsätzlich das Recht falsch anwenden. Bei einer jurKI ist dies ausgeschlossen, da sie stets an ein festes Regelwerk gebunden sein wird.",['Z.K3'],"[(0, 456)]"
20230720_125438_037893,6,user,"Ein anderer Punkt ist, dass sich Recht durch die juristische Praxis weiterentwickelt, die Ki hingegen reproduziert lediglich den Status quo",['Z.K5'],"[(0, 139)]"
20230720_125438_037893,7,bot,"Mit anderen Worten, es gäbe keine Rechtsprechungsänderungen mehr. Darauf geht unser Szenario wie folgt ein: Menschliche Richter:innen und Informatiker:innen in Kompetenzzentren übernehmen die Weiterentwicklung und Überwachung der jurKI. Durch ein derartiges Expert:innengremium wird auch die neue Rechtsprechung beeinflusst werden können.","['intro_32', 'Z.K5', 'intro_55', 'Z.K5-1']","[(0, 20), (20, 66), (66, 108), (108, 339)]"
20230720_125438_037893,8,user,"Dem Expertengremium fehlt jedoch die persönliche Erfahrung die zur Weiterentwicklung des Rechts nötig wäre, statt unmengen von Daten auszuwerten",['CON_ZARG'],"[(0, 144)]"
20230720_125438_037893,9,bot,"Dein Argument ist, dass die menschliche Subjektivtät für eine Entscheidung notwendig ist. Das mag sein. Der Einwand, die jurKI hätte keine eigenen Emotionen und Empfindungen ist insoweit hinfällig, als dass auch Richter:innen nicht nach ihren eigenen Gefühlen, sondern auf der Grundlage des Gesetzes entscheiden.","['intro_25', 'Z.P1-1', 'intro_3', 'Z.P1-1-1']","[(0, 24), (24, 90), (90, 104), (104, 313)]"
20230720_125438_037893,10,user,"Ja, aber die Auslegung von Gesetzestexten in individuellen Fällen erfordert eine persönlichen Erfahrungsschatz",['Z.P1-2'],"[(0, 110)]"
20230720_125438_037893,11,bot,"Ich bin mir nicht sicher, was du meinst. Bitte wähle aus der folgenden Liste ein Argument aus, das deinen Standpunkt am besten repräsentiert. | unterschiedliche Richter:innen; unterschiedliche Urteile |   Das kann ich nachvollziehen.  Darüber hinaus finde ich, dass hier noch folgendes beachtet werden sollte: Die jurKI kann eine hohe Komplexität an Datenmengen verarbeiten und darauf trainiert werden, so viele Korrelationen wie möglich zu identifizieren und dadurch die Faktoren aufdecken, die ein/e menschliche/r Richter:in übersehen könnte.",['Z.P1-2'],"[(0, 544)]"
20230720_125438_037893,12,user,"Hier geht jedoch die Individualität des Falls verloren, die Datenlage erfasst lediglich den wahrscheinlichsten Ausgang",['Z.P4-1'],"[(0, 118)]"
20230720_125438_037893,13,bot,"Du sagst, dass eine KI auch nicht stets alle Faktoren aufdecken kann. Dem würde ich zustimmen. Darüber hinaus finde ich, dass hier noch folgendes beachtet werden sollte: Richter:innen stehen intern und extern unter enormem Druck. Die jurKI verspürt keinen Druck und erzielt gleichbleibend gute Ergebnisse. Stabile, nichtdiskriminierende Schlussfolgerungen fördern ein einheitliches Entscheidungsergebnis sowie Stabilität und Autorität des Rechts.","['intro_27', 'Z.P4-1', 'intro_4', 'z_trans_1', 'Z.P3']","[(0, 15), (15, 70), (70, 95), (95, 170), (170, 447)]"
20230720_130339_304405,0,user,KI kann sich nicht in Menschen einfühlen,['Z.K2'],"[(0, 40)]"
20230720_130339_304405,1,bot,"Du sagst, dass die KI eine mangelnde Persönlichkeit hat. Das verstehe ich. Transparenz und Interpretierbarkeit könnten Zurechnungshindernisse bei der jurKI überwinden. Die jurKI folgt einem strikten Regelwerk und wäre hierdurch durchaus in der Lage ihre Entscheidung zu begründen.","['intro_27', 'Z.K2', 'intro_1', 'Z.K2-1']","[(0, 15), (15, 57), (57, 75), (75, 281)]"
20230720_130339_304405,2,user,okay,['OTHER'],"[(0, 4)]"
20230720_130339_304405,3,bot,"Ich bin mir nicht sicher, was du meinst. Bitte wähle aus der folgenden Liste ein Argument aus, das deinen Standpunkt am besten repräsentiert. | Ergebnisse KI wenig flexibel; Ermessensmacht und individualisierte Rechtsprechung des/der Richter:in |   Das verstehe ich.  Aber zu beachten ist: Neben der Umsetzung der Regeln und Leitlinien wird eine jurKI ausschließlich aus selektierten Fällen, die gerade nicht vorurteilsbehaftet und diskriminierend sind, lernen und somit bestehende Vorurteile oder Diskriminierungen nicht berücksichtigen.",['Z.K4'],"[(0, 538)]"
20230720_130339_304405,4,user,Die KI kann falsch programmiert sein,['Z.K10'],"[(0, 36)]"
20230720_130339_304405,5,bot,"Dein Argument ist, dass KI sich irren kann. Das stimmt, allerdings ist es nicht sehr wahrscheinlich. Irren ist menschlich. Eine KI darf daher auch zu einem gewissen Grad irren. Der Instanzentzug würde die Prozessparteien schützen. Um Fehler zu verhindern, wird man die jurKI mit einer hohen Qualität an Trainingsdaten trainieren.","['intro_25', 'Z.K10', 'intro_59', 'Z.K10-1']","[(0, 24), (24, 44), (44, 101), (101, 331)]"
20230720_130339_304405,6,user,"Wenn die KI sich auch irren kann, kann man auch einen Menschen nehmen",['Z.K10'],"[(0, 70)]"
20230720_130339_304405,7,bot,"Ich bin mir nicht sicher, was du meinst. Bitte wähle aus der folgenden Liste ein Argument aus, das deinen Standpunkt am besten repräsentiert. | KI kann sich irren |   Das ist möglich, aber nicht sehr wahrscheinlich. Die jurKI wird außerdem Fälle, die sie nicht selbst beurteilen kann, an menschliche Richter:innen delegieren und würde aus diesen für zukünftige, ähnliche Fälle lernen.",['Z.K10'],"[(0, 386)]"
20230720_130339_304405,8,user,Wer übernimmt die Verantwortung bei Fehlern?,['Z.K3'],"[(0, 44)]"
20230720_130339_304405,9,bot,"Du argumentierst, dass Haftungsfragen noch nicht eindeutig geregelt sind. Das mag sein. Menschliche Richter:innen machen sich nur wegen Rechtsbeugung strafbar, wenn sie bei der Entscheidung vorsätzlich das Recht falsch anwenden. Bei einer jurKI ist dies ausgeschlossen, da sie stets an ein festes Regelwerk gebunden sein wird.","['intro_26', 'Z.K3', 'intro_3', 'Z.K3-1']","[(0, 23), (23, 74), (74, 88), (88, 327)]"
20230720_130339_304405,10,user,Was machen Richter dann stattdessen?,['FAQ.G1'],"[(0, 36)]"
20230720_130339_304405,11,bot,"Ich bin mir nicht sicher, was du meinst. Bitte wähle aus der folgenden Liste ein Argument aus, das deinen Standpunkt am besten repräsentiert. | Berufsbild Motivation Studierende |   Dein Argument ist nicht spezifisch bzgl. der jurKI sondern gilt für viele fortgeschrittliche Innovationen. In höheren Instanzen sowie in strafrechtlichen Prozessen wird es zunächst noch keine jurKI geben, sodass weiterhin auf die menschlichen Richter:innen vollumfänglich zurückgegriffen wird.",['Z.K7'],"[(0, 477)]"
20230720_124334_849064,0,user,Eine Maschine kann menschliches Handeln nicht nachvollziehen,['Z.P1-1'],"[(0, 60)]"
20230720_124334_849064,1,bot,"Ich bin mir nicht sicher, was du meinst. Bitte wähle aus der folgenden Liste ein Argument aus, das deinen Standpunkt am besten repräsentiert. | Werturteil erforderlich bei Entscheidungen; menschliche Subjektivität notwendig |   Das mag sein. Der Einwand, die jurKI hätte keine eigenen Emotionen und Empfindungen ist insoweit hinfällig, als dass auch Richter:innen nicht nach ihren eigenen Gefühlen, sondern auf der Grundlage des Gesetzes entscheiden.",['Z.P1-1'],"[(0, 452)]"
20230720_124334_849064,2,user,Aber die Gefühle der Richter fließen trotzdem immer in das Urteil mit ein,['Z.P1-1'],"[(0, 73)]"
20230720_124334_849064,3,bot,"Ich bin mir nicht sicher, was du meinst. Bitte wähle aus der folgenden Liste ein Argument aus, das deinen Standpunkt am besten repräsentiert. | mangelnde Persönlichkeit der KI; algorithmische Tyrannei |   Das verstehe ich. Transparenz und Interpretierbarkeit könnten Zurechnungshindernisse bei der jurKI überwinden. Die jurKI folgt einem strikten Regelwerk und wäre hierdurch durchaus in der Lage ihre Entscheidung zu begründen.",['Z.K2'],"[(0, 430)]"
20230720_124334_849064,4,user,Eine KI würde unmenschliche Entscheidungen treffen,['Z.K6'],"[(0, 50)]"
20230720_124334_849064,5,bot,"Mit anderen Worten, KI befolgt keine Werte. Das ist im Szenario bereits berücksichtigt: Die jurKI ist ein zertifizierter Service des Staates, der die moralischen Leitlinien und Regeln vorgibt. Hierfür werden insb. auch die Erkenntnisse der Philosophie und Computerwissenschaft hinzugezogen und z.B. in ein passendes Diskriminierungsgesetz übersetzt.","['intro_32', 'Z.K6', 'intro_56', 'Z.K6-1']","[(0, 20), (20, 44), (44, 88), (88, 350)]"
20230720_124334_849064,6,user,Eine KI kann nicht unterschiedliche Urteile abwägen,['Z.P1-2'],"[(0, 51)]"
20230720_124334_849064,7,bot,"Du sagst, dass unterschiedliche Richter:innen zu unterschiedlichen Urteilen, aufgrund verschiedener richtiger Abwägungen führen. Das ist ein gutes Argument. Aber zu beachten ist: Durch den Einsatz der jurKI kann der Faktor Subjektivität bei Gerichtsurteilen ausgeräumt werden. Eine jurKI lässt sich nicht etwa durch Mitgefühl von den objektiven Fakten ablenken. Dies führt zu mehr Gerechtigkeit.","['intro_27', 'Z.P1-2', 'intro_52', 'z_trans_12', 'Z.P1']","[(0, 15), (15, 129), (129, 157), (157, 179), (179, 396)]"
20230720_124334_849064,8,user,Nur Menschen sollten über Menschen richten,['Z.K2'],"[(0, 42)]"
20230720_124334_849064,9,bot,"Dein Argument ist, dass die KI eine mangelnde Persönlichkeit hat. Ich denke damit liegst du richtig. Ansprechen möchte ich noch: Neben der Umsetzung der Regeln und Leitlinien wird eine jurKI ausschließlich aus selektierten Fällen, die gerade nicht vorurteilsbehaftet und diskriminierend sind, lernen und somit bestehende Vorurteile oder Diskriminierungen nicht berücksichtigen.","['intro_25', 'Z.K2', 'intro_5', 'z_trans_11', 'Z.K6-1-1-1']","[(0, 24), (24, 66), (66, 101), (101, 129), (129, 378)]"
20230720_124334_849064,10,user,KI kann manipuliert werden,['Z.P5-1'],"[(0, 26)]"
20230720_124334_849064,11,bot,"Dein Argument ist, dass die Rechte der Betroffenen durch unvollständige bzw fehlerhafte Daten eingeschränkt werden. Da gebe ich dir recht. Darüber hinaus finde ich, dass hier noch folgendes beachtet werden sollte: Die jurKI erweitert den Zugang zu Rechtshilfe, da die Gerichte ihr Regelsystem zur Verfügung stellen können. Bestehende Systeme würden es leichter haben, da nur noch Fakten festgestellt werden müssen und schon vorab die zu erwartende Entscheidung gegeben werden kann.","['intro_25', 'Z.P5-1', 'intro_6', 'z_trans_1', 'Z.P5']","[(0, 24), (24, 116), (116, 139), (139, 214), (214, 482)]"
20230720_124334_849064,12,user,Es gehen Jobs verloren,['Z.K16'],"[(0, 22)]"
20230720_124334_849064,13,bot,"Ich bin mir nicht sicher, was du meinst. Bitte wähle aus der folgenden Liste ein Argument aus, das deinen Standpunkt am besten repräsentiert. | die JurKI fühlt keine Verantwortung. |   Das verstehe ich. Die jurKI würde in unserem Szenario gerade nicht den kompletten Menschen durchleuchten. Vielmehr würde sie lediglich auf die durch Menschen implementierte Sachlage (Fakten) zugreifen können.",['Z.K13'],"[(0, 395)]"
20230720_124334_849064,14,user,Woher weiß die KI was richtig/falsch ist,['Z.K6'],"[(0, 40)]"
20230720_124334_849064,15,bot,"Ich bin mir nicht sicher, was du meinst. Bitte wähle aus der folgenden Liste ein Argument aus, das deinen Standpunkt am besten repräsentiert. | Keine moralischen Leitlinien und Regeln für KI, kein Werten |   Das ist im Szenario bereits berücksichtigt: Dieser Einwand beruht auf einem technisch überholten Bild und setzt ein idealisiertes Bild von Richter:innen voraus. Das Lernverfahren erfolgt mittlerweile Bottom-Up, also bspw. zunächst anhand kleinerer und einfacher Fälle bis hin zu komplexen und schwierigen Sachverhalten, und der jurKI können Werte beigebracht werden, etwa durch das sog. supervised learning.",['Z.K6'],"[(0, 618)]"
20230720_132921_356927,0,user,"Prozesse im Zivilrecht enden oft in Einzelfallentscheidungen, bei denen viele umfassende Informationen dazu kommen. Dazu halte ich keine KI nicht imstande",['Z.P4-1'],"[(0, 155)]"
20230720_132921_356927,1,bot,"Du meinst also, dass die Ergebnisse der KI wenig flexibel sind. Das verstehe ich. Darüber hinaus finde ich, dass hier noch folgendes beachtet werden sollte: Neben der Umsetzung der Regeln und Leitlinien wird eine jurKI ausschließlich aus selektierten Fällen, die gerade nicht vorurteilsbehaftet und diskriminierend sind, lernen und somit bestehende Vorurteile oder Diskriminierungen nicht berücksichtigen.","['intro_23', 'Z.K4', 'intro_54', 'z_trans_1', 'Z.K6-1-1-1']","[(0, 21), (21, 64), (64, 82), (82, 157), (157, 406)]"
20230720_132921_356927,2,user,"Das könnte korrekt sein, jedoch ist auch ein Richter dazu imstande und kann der Kläger oder Beklagte kann einen Rechtsschritt weiter gehen.",['OTHER'],"[(0, 140)]"
20230720_132921_356927,3,bot,"Ich bin mir nicht sicher, was du meinst. Bitte wähle aus der folgenden Liste ein Argument aus, das deinen Standpunkt am besten repräsentiert. | Keines der genannten Argumente trifft zu. |    Wir werden dein Argument evaluieren und in einer neuen Version berücksichtigen. Bitte fahre mit deinem nächsten Argument fort.",['NoneOfTheAbove'],"[(0, 319)]"
20230720_132921_356927,4,user,"Gerade in diskriminierenden Fällen, also mit diesem Streitpunkt, sollte ein persönlicher Richter anwesend sein um diese zu beurteilen.",['Z.P1-1'],"[(0, 134)]"
20230720_132921_356927,5,bot,"Ich bin mir nicht sicher, was du meinst. Bitte wähle aus der folgenden Liste ein Argument aus, das deinen Standpunkt am besten repräsentiert. | Subjektive Wirkung leidet |   Das ist möglich. In Deutschland sitzen die Menschen bereits durchschnittlich über 10h am Tag vor einem Bildschirm. Das zeigt, dass die Menschen keine echte Persönlichkeit vor sich brauchen, auch nicht bei Entscheidungen. Der menschliche Aspekt wird immer weiter in den Hintergrund gedrängt.",['Z.K11'],"[(0, 466)]"
20230720_132921_356927,6,user,"Das ist nicht wahr. MENSCHEN brauchen Menschen, damit sie zu sozialisierten Personen werden und im miteinander lernen.","['DISSENT', 'Z.P1-1']","[(0, 19), (19, 118)]"
20230720_132921_356927,7,bot,"Mit anderen Worten, die menschliche Subjektivtät ist für eine Entscheidung notwendig. Das verstehe ich. Der Einwand, die jurKI hätte keine eigenen Emotionen und Empfindungen ist insoweit hinfällig, als dass auch Richter:innen nicht nach ihren eigenen Gefühlen, sondern auf der Grundlage des Gesetzes entscheiden.","['intro_32', 'Z.P1-1', 'intro_1', 'Z.P1-1-1']","[(0, 20), (20, 86), (86, 104), (104, 313)]"
20230720_132921_356927,8,user,"Genau, ein Richter hat einen Eid abgelegt und darauf sollte man sich verlassen können, er repräsentiert Vertrauen in den Staat",['Z.K11'],"[(0, 126)]"
20230720_132921_356927,9,bot,"Ich bin mir nicht sicher, was du meinst. Bitte wähle aus der folgenden Liste ein Argument aus, das deinen Standpunkt am besten repräsentiert. | Keines der genannten Argumente trifft zu. |    Wir werden dein Argument evaluieren und in einer neuen Version berücksichtigen. Bitte fahre mit deinem nächsten Argument fort.",['NoneOfTheAbove'],"[(0, 319)]"
20230720_132921_356927,10,user,Zudem würde eine KI Angriffe auf die Cyperwelt und damit Kriminalität fördern,['Z.K14'],"[(0, 77)]"
20230720_132921_356927,11,bot,"Du merkst an, dass Gerichte interessanter für Cyberkriminalität werden. Dein Argument ist nicht spezifisch bzgl. der jurKI sondern gilt für viele fortgeschrittliche Innovationen. Mit der zunehmenden Digitalisierung, etwa mit Einführung der digitalen Patient:innenakte, müssen sich Kliniken ohnehin stärker gegen Cyberangriffe schützen. Die fertigen Systeme laufen im geschützten Bereich der Klinik und unterliegen dem gleichen Schutz wie Patient:innendaten.","['intro_28', 'Z.K14', 'intro_57', 'Z.K14-1']","[(0, 19), (19, 72), (72, 179), (179, 458)]"
20230720_132921_356927,12,user,Cyberkriminalität kann hier aber zu falscher Rechtsprechung führen,['Z.P5-1'],"[(0, 66)]"
20230720_132921_356927,13,bot,"Du sagst, dass Gerichte interessanter für Cyberkriminalität werden. Dein Argument ist nicht spezifisch bzgl. der jurKI sondern gilt für viele fortgeschrittliche Innovationen. Aber zu beachten ist: Durch den Einsatz der jurKI kann der Faktor Subjektivität bei Gerichtsurteilen ausgeräumt werden. Eine jurKI lässt sich nicht etwa durch Mitgefühl von den objektiven Fakten ablenken. Dies führt zu mehr Gerechtigkeit.","['intro_27', 'Z.K14', 'intro_57', 'z_trans_12', 'Z.P1']","[(0, 15), (15, 68), (68, 175), (175, 197), (197, 414)]"
20230720_132921_356927,14,user,Subjektivität wird durch das Studium ausgeräumt zudem ist eine Richterliche Subjektivität in bestimmten Umfang gewährleistet,['Z.P1-1'],"[(0, 124)]"
20230720_132921_356927,15,bot,"Mit anderen Worten, die subjektive Wirkung leidet. Ich denke damit liegst du richtig. Darüber hinaus finde ich, dass hier noch folgendes beachtet werden sollte: Transparenz und Interpretierbarkeit könnten Zurechnungshindernisse bei der jurKI überwinden. Die jurKI folgt einem strikten Regelwerk und wäre hierdurch durchaus in der Lage ihre Entscheidung zu begründen.","['intro_32', 'Z.K11', 'intro_5', 'z_trans_1', 'Z.K2-1']","[(0, 20), (20, 51), (51, 86), (86, 161), (161, 367)]"
20230720_132921_356927,16,user,"Das eine Entscheidung begründet werden kann, kann zu härteren Entscheidungen insb. In Härtefällen führen.",['Z.K6'],"[(0, 105)]"
20230720_132921_356927,17,bot,"Ich bin mir nicht sicher, was du meinst. Bitte wähle aus der folgenden Liste ein Argument aus, das deinen Standpunkt am besten repräsentiert. | mangelnde Persönlichkeit der KI; algorithmische Tyrannei |   Da gebe ich dir recht.  Um auch noch einmal eine andere Seite zu beleuchten: Die jurKI kann eine hohe Komplexität an Datenmengen verarbeiten und darauf trainiert werden, so viele Korrelationen wie möglich zu identifizieren und dadurch die Faktoren aufdecken, die ein/e menschliche/r Richter:in übersehen könnte.",['Z.K2'],"[(0, 516)]"
20230720_132921_356927,18,user,"Ja, das kann sein, jedoch halte ich es für ethisch fragwürdig.",['OTHER'],"[(0, 62)]"
20230720_132921_356927,19,bot,"Du argumentierst, dass KI keine Werte befolgt. Darauf geht unser Szenario wie folgt ein: Die jurKI ist ein zertifizierter Service des Staates, der die moralischen Leitlinien und Regeln vorgibt. Hierfür werden insb. auch die Erkenntnisse der Philosophie und Computerwissenschaft hinzugezogen und z.B. in ein passendes Diskriminierungsgesetz übersetzt.","['intro_26', 'Z.K6', 'intro_55', 'Z.K6-1']","[(0, 23), (23, 47), (47, 89), (89, 351)]"
20230720_132921_356927,20,user,"Aber eine ki lernt zwar dazu aber reicht das, was ist wenn sie falsch lernt?",['Z.K6-1-1'],"[(0, 77)]"
20230720_132921_356927,21,bot,"Ich bin mir nicht sicher, was du meinst. Bitte wähle aus der folgenden Liste ein Argument aus, das deinen Standpunkt am besten repräsentiert. | Umsetzung von Richtlinien und Regeln schwierig |   Das ist im Szenario bereits berücksichtigt:  Aber zu beachten ist: Gerade in zivilrechtlichen Verfahren werden die verkündeten Ergebnisse der jurKI wenig flexibel sein müssen, da in der Regel die individuelle Fakten(sach)lage klar erfasst werden kann und nicht auf weitere menschliche Aspekte bzw. Motive eingegangen werden muss.",['Z.K6-1-1'],"[(0, 524)]"
