dialogue_id,utterance_id,utterance_type,utterance,labels,bounds
20230720_121434_686972,9,bot,"Du argumentierst, dass KI sich irren kann. Das ist möglich, aber nicht sehr wahrscheinlich. Irren ist menschlich. Eine KI darf daher auch zu einem gewissen Grad irren. Der Instanzentzug würde die Prozessparteien schützen. Um Fehler zu verhindern, wird man die jurKI mit einer hohen Qualität an Trainingsdaten trainieren.","['intro_26', 'Z.K10', 'intro_58', 'Z.K10-1']","[(0, 23), (23, 43), (43, 92), (92, 322)]"
20230720_121434_686972,10,user,"Wenn eine KI sich also auch irren kann, warum soll man den Menschen dann überhaupt ersetzen?!",['OTHER'],"[(0, 94)]"
20230720_121434_686972,11,bot,"Ich bin mir nicht sicher, was du meinst. Bitte wähle aus der folgenden Liste ein Argument aus, das deinen Standpunkt am besten repräsentiert. | strukturelle Fehler |   Das ist ein gutes Argument. Andererseits: Ein fehlerhaftes Urteil durch die jurKI hat die gleiche Tragweite und Auswirkung wie ein fehlerhaftes Urteil durch eine:n menschliche:n Richter:in. Daher besteht kein Grund hier von weitreichenderen Schäden bei der jurKI als Richter:in auszugehen.",['Z.P3-1'],"[(0, 459)]"
20230720_121434_686972,12,user,Deshalb braucht man keine KI. Der Mensch agiert genauso gut,['DISSENT'],"[(0, 59)]"
20230720_121434_686972,13,bot,"Ich bin mir nicht sicher, was du meinst. Bitte wähle aus der folgenden Liste ein Argument aus, das deinen Standpunkt am besten repräsentiert. | Ich finde deine Argumentation nicht überzeugend. |   Schade, dass dich meine Argumentation nicht überzeugt.  Aber hast Du schon einmal daran gedacht: Neben der Umsetzung der Regeln und Leitlinien wird eine jurKI ausschließlich aus selektierten Fällen, die gerade nicht vorurteilsbehaftet und diskriminierend sind, lernen und somit bestehende Vorurteile oder Diskriminierungen nicht berücksichtigen.",['OTHER'],"[(0, 542)]"
20230720_121434_686972,14,user,"Und was ist, wenn die KI falsch trainiert wird?",['Z.K6-1-1'],"[(0, 48)]"
20230720_121434_686972,15,bot,"Du meinst also, dass KI von fehlerhaften Urteilen falsch lernen und Leitlinien sowie sonstige Regeln verletzen könnte. Das ist im Szenario bereits berücksichtigt: Darüber hinaus finde ich, dass hier noch folgendes beachtet werden sollte: Die jurKI ist ein zertifizierter Service des Staates, der die moralischen Leitlinien und Regeln vorgibt. Hierfür werden insb. auch die Erkenntnisse der Philosophie und Computerwissenschaft hinzugezogen und z.B. in ein passendes Diskriminierungsgesetz übersetzt.","['intro_23', 'Z.K6-1-1', 'intro_56', 'z_trans_1', 'Z.K6-1']","[(0, 21), (21, 119), (119, 163), (163, 238), (238, 500)]"
20230720_141909_281407,0,user,Weil diese Rechte in verschiedene Szenarien sehr unterschiedlich sein können und ich glaube KI kann nicht solche individualisierte Entscheidungen treffe,['Z.K4'],"[(0, 153)]"
20230720_141909_281407,1,bot,"Du argumentierst, dass die Ergebnisse der KI wenig flexibel sind. Das ist ein gutes Argument. Aber zu beachten ist: Neben der Umsetzung der Regeln und Leitlinien wird eine jurKI ausschließlich aus selektierten Fällen, die gerade nicht vorurteilsbehaftet und diskriminierend sind, lernen und somit bestehende Vorurteile oder Diskriminierungen nicht berücksichtigen.","['intro_26', 'Z.K4', 'intro_52', 'z_trans_12', 'Z.K6-1-1-1']","[(0, 23), (23, 66), (66, 94), (94, 116), (116, 365)]"
20230720_111832_920960,0,user,"- Die KI basiert auf vielen Daten aber hat keine eigenständigen Ideen, wenn sie mit vielen Daten von beispielsweise rassistischen Richtern gefüttert wird, dann wird die  KI selbst auch rassistisch sein",['Z.K6-1-1'],"[(0, 201)]"
20230720_111832_920960,1,bot,"Ich bin mir nicht sicher, was du meinst. Bitte wähle aus der folgenden Liste ein Argument aus, das deinen Standpunkt am besten repräsentiert. | Rechte der Betroffenen werden eingeschränkt |   Dem würde ich zustimmen.  Darüber hinaus finde ich, dass hier noch folgendes beachtet werden sollte: Die jurKI erweitert den Zugang zu Rechtshilfe, da die Gerichte ihr Regelsystem zur Verfügung stellen können. Bestehende Systeme würden es leichter haben, da nur noch Fakten festgestellt werden müssen und schon vorab die zu erwartende Entscheidung gegeben werden kann.",['Z.P5-1'],"[(0, 560)]"
20230720_111832_920960,2,user,"Da hätte ich bedenken, dass Richter sich nicht trauen gegen die Entscheidung der ki zu gehen, weil es zur norm wird diese Entscheidung anzunehmen und sich der Richter dann mehr in der Verantwortung sieht",['Z.GK5'],"[(0, 203)]"
20230720_111832_920960,3,bot,"Ich bin mir nicht sicher, was du meinst. Bitte wähle aus der folgenden Liste ein Argument aus, das deinen Standpunkt am besten repräsentiert. | Keines der genannten Argumente trifft zu. |    Wir werden dein Argument evaluieren und in einer neuen Version berücksichtigen. Bitte fahre mit deinem nächsten Argument fort.",['NoneOfTheAbove'],"[(0, 319)]"
20230720_111832_920960,4,user,Die KI könnte anfällig für Hawking sein,['Z.K14'],"[(0, 39)]"
20230720_111832_920960,5,bot,"Du meinst also, dass die Rechte der Betroffenen durch unvollständige bzw fehlerhafte Daten eingeschränkt werden. Da gebe ich dir recht. Ansprechen möchte ich noch: Durch den Einsatz der jurKI kann der Faktor Subjektivität bei Gerichtsurteilen ausgeräumt werden. Eine jurKI lässt sich nicht etwa durch Mitgefühl von den objektiven Fakten ablenken. Dies führt zu mehr Gerechtigkeit.","['intro_23', 'Z.P5-1', 'intro_6', 'z_trans_11', 'Z.P1']","[(0, 21), (21, 113), (113, 136), (136, 164), (164, 381)]"
20230720_111832_920960,6,user,Manchmal führt dieses Mitgefühl allerdings zu gerechteren Entscheidungen auch wenn sich diese nicht mit dem Gesetz decken,['Z.P1-1'],"[(0, 121)]"
20230720_111832_920960,7,bot,"Mit anderen Worten, die menschliche Subjektivtät ist für eine Entscheidung notwendig. Das verstehe ich. Der Einwand, die jurKI hätte keine eigenen Emotionen und Empfindungen ist insoweit hinfällig, als dass auch Richter:innen nicht nach ihren eigenen Gefühlen, sondern auf der Grundlage des Gesetzes entscheiden.","['intro_32', 'Z.P1-1', 'intro_1', 'Z.P1-1-1']","[(0, 20), (20, 86), (86, 104), (104, 313)]"
20230720_111832_920960,8,user,Ich denke nicht dass es für einen Menschen möglich ist 100% objektiv zu sein,['DISSENT'],"[(0, 76)]"
20230720_111832_920960,9,bot,"Ich bin mir nicht sicher, was du meinst. Bitte wähle aus der folgenden Liste ein Argument aus, das deinen Standpunkt am besten repräsentiert. | Ich finde deine Argumentation nicht überzeugend. |   Schade, dass dich meine Argumentation nicht überzeugt.  Aber zu beachten ist: Neben der Umsetzung der Regeln und Leitlinien wird eine jurKI ausschließlich aus selektierten Fällen, die gerade nicht vorurteilsbehaftet und diskriminierend sind, lernen und somit bestehende Vorurteile oder Diskriminierungen nicht berücksichtigen.",['OTHER'],"[(0, 523)]"
20230720_111832_920960,10,user,"Ja vielleicht das nicht aber aktueller Zeitgeist wird mit einfließen und während ein Richter diesen kennt, würde eine KI nach einigen Jahren veraltete Daten nutzen, neue Daten zu bekommen wäre schwer, weil dann schon viele der Daten auf ki Entscheidungen basieren",['Z.K5'],"[(0, 263)]"
20230720_111832_920960,11,bot,"Ich bin mir nicht sicher, was du meinst. Bitte wähle aus der folgenden Liste ein Argument aus, das deinen Standpunkt am besten repräsentiert. | strukturelle Fehler |   Das verstehe ich. Direkt dazu: Ein fehlerhaftes Urteil durch die jurKI hat die gleiche Tragweite und Auswirkung wie ein fehlerhaftes Urteil durch eine:n menschliche:n Richter:in. Daher besteht kein Grund hier von weitreichenderen Schäden bei der jurKI als Richter:in auszugehen.",['Z.P3-1'],"[(0, 448)]"
20230720_115230_784126,0,user,Da das Modell eine Blackbox ist kann man nicht voll nachvollziehen aufgrund welcher Argumente ein Urteil gefällt word,['Z.P2-1'],"[(0, 117)]"
20230720_115230_784126,1,bot,"Ich bin mir nicht sicher, was du meinst. Bitte wähle aus der folgenden Liste ein Argument aus, das deinen Standpunkt am besten repräsentiert. | strukturelle Fehler |   Das kann ich nachvollziehen. Direkt dazu: Ein fehlerhaftes Urteil durch die jurKI hat die gleiche Tragweite und Auswirkung wie ein fehlerhaftes Urteil durch eine:n menschliche:n Richter:in. Daher besteht kein Grund hier von weitreichenderen Schäden bei der jurKI als Richter:in auszugehen.",['Z.P3-1'],"[(0, 459)]"
20230720_115230_784126,2,user,Aber wer trägt am Ende Verantwortung für das Urteil?,['Z.K3'],"[(0, 52)]"
20230720_115230_784126,3,bot,"Du merkst an, dass Haftungsfragen noch nicht eindeutig geregelt sind. Das ist möglich. Menschliche Richter:innen machen sich nur wegen Rechtsbeugung strafbar, wenn sie bei der Entscheidung vorsätzlich das Recht falsch anwenden. Bei einer jurKI ist dies ausgeschlossen, da sie stets an ein festes Regelwerk gebunden sein wird.","['intro_28', 'Z.K3', 'intro_2', 'Z.K3-1']","[(0, 19), (19, 70), (70, 87), (87, 326)]"
20230720_115230_784126,4,user,Trotzdem ist es höchst fraglich wenn dchlüsse automatisch angewendet werden ohne durch menschliche Stellen geprüfte zu werden,['Z.K12'],"[(0, 125)]"
20230720_115230_784126,5,bot,"Ich bin mir nicht sicher, was du meinst. Bitte wähle aus der folgenden Liste ein Argument aus, das deinen Standpunkt am besten repräsentiert. | Keines der genannten Argumente trifft zu. |    Wir werden dein Argument evaluieren und in einer neuen Version berücksichtigen. Bitte fahre mit deinem nächsten Argument fort.",['NoneOfTheAbove'],"[(0, 319)]"
20230720_115230_784126,6,user,Es könnte zu inflationär Einsatz kommen,['OTHER'],"[(0, 39)]"
20230720_115230_784126,7,bot,"Du sagst, dass es keine Rechtsprechungsänderungen mehr gäbe. Das ist im Szenario bereits berücksichtigt: Menschliche Richter:innen und Informatiker:innen in Kompetenzzentren übernehmen die Weiterentwicklung und Überwachung der jurKI. Durch ein derartiges Expert:innengremium wird auch die neue Rechtsprechung beeinflusst werden können.","['intro_27', 'Z.K5', 'intro_56', 'Z.K5-1']","[(0, 15), (15, 61), (61, 105), (105, 336)]"
20230720_115230_784126,8,user,Das meinte ich nicht,['OTHER'],"[(0, 20)]"
20230720_115230_784126,9,bot,"Ich bin mir nicht sicher, was du meinst. Bitte wähle aus der folgenden Liste ein Argument aus, das deinen Standpunkt am besten repräsentiert. | Keines der genannten Argumente trifft zu. |    Wir werden dein Argument evaluieren und in einer neuen Version berücksichtigen. Bitte fahre mit deinem nächsten Argument fort.",['NoneOfTheAbove'],"[(0, 319)]"
20230720_115230_784126,10,user,Was wenn es aus den falschen Dingen lernt. Zum Beispiel implizite Rassismus oder Sexismus,['Z.K6-1-1'],"[(0, 89)]"
20230720_115230_784126,11,bot,"Ich bin mir nicht sicher, was du meinst. Bitte wähle aus der folgenden Liste ein Argument aus, das deinen Standpunkt am besten repräsentiert. | Umsetzung von Richtlinien und Regeln schwierig |   Das ist im Szenario bereits berücksichtigt: Neben der Umsetzung der Regeln und Leitlinien wird eine jurKI ausschließlich aus selektierten Fällen, die gerade nicht vorurteilsbehaftet und diskriminierend sind, lernen und somit bestehende Vorurteile oder Diskriminierungen nicht berücksichtigen.",['Z.K6-1-1'],"[(0, 489)]"
20230720_125243_521032,0,user,Es spart Geld,['Z.P8'],"[(0, 14)]"
20230720_125243_521032,1,bot,"Du meinst also, dass die KI günstiger ist. Das ist ein gutes Argument. Direkt dazu: Richter:innen entscheiden über Recht und Unrecht. Dabei spielen die Kosten eine eher untergeordnete Rolle. Zudem führt der Einsatz der jurKI eher zu noch mehr finanziellen Belastungen, da die Richter:innen mit der Implementierung der Sachlage beschäftigt bleiben.","['intro_23', 'Z.P8', 'intro_47', 'Z.P8-1']","[(0, 21), (21, 43), (43, 84), (84, 348)]"
20230720_125243_521032,2,user,Naja - viele Gerichtsverfahren haben ja eine klare Sachlage. Da kann die KI viel Arbeit einsparen,['Z.P2'],"[(0, 97)]"
20230720_125243_521032,3,bot,"Kurz zusammengefasst, die Justiz ist überlastet. Das verstehe ich. Direkt dazu: Die Beschleunigung des Verfahrens durch den Einsatz der jurKI könnte allerdings zur Folge haben, dass aufgrund der wegfallenden Wartezeit weniger neue Betrachtungsweisen oder Beweise ans Licht kommen.","['intro_24', 'Z.P2', 'intro_51', 'Z.P2-2']","[(0, 22), (22, 49), (49, 80), (80, 281)]"
20230720_125243_521032,4,user,Ist das so wichtig?,['OTHER'],"[(0, 19)]"
20230720_125243_521032,5,bot,"Ich bin mir nicht sicher, was du meinst. Bitte wähle aus der folgenden Liste ein Argument aus, das deinen Standpunkt am besten repräsentiert. | Kein Druck |   Das ist ein gutes Argument. Direkt dazu: Da die JurKI bei gleichem Input immer das gleiche Ergebnis liefern würde, würden Fehler an vielen Stellen gleichzeitig passieren und wären so deutliche weitreichender, als die eines Menschen.",['Z.P3'],"[(0, 394)]"
20230720_125243_521032,6,user,Ist das denn wirklich so? Also ist die KI nicht dadurch eine JI,['OTHER'],"[(0, 63)]"
20230720_125243_521032,7,bot,"Ich bin mir nicht sicher, was du meinst. Bitte wähle aus der folgenden Liste ein Argument aus, das deinen Standpunkt am besten repräsentiert. | Lernt aus selektierten Daten aus vorurteils- und diskriminierungsfreien Fällen |   Das kann ich nachvollziehen.  Darüber hinaus finde ich, dass hier noch folgendes beachtet werden sollte: Die Entwicklung von KI ist bisher nahezu keinen moralischen Leitlinien und Regeln unterworfen und kann nicht werten. Richter:innen hingegen bekennen sich zu Werten durch die Ausübung ihres Berufs und des rechtlichen Rahmens.",['Z.K6-1-1-1'],"[(0, 556)]"
20230720_125243_521032,8,user,Die KI kann nicht bestochen werden,['Z.P1'],"[(0, 34)]"
20230720_125243_521032,9,bot,"Dein Argument ist, dass die KI nicht unter Druck steht. Das ist ein gutes Argument. Ein weiterer Gesichtspunkt gehört hierher. Um Gesetze zu interpretieren und anzuwenden bedarf es stets einer menschlichen Bewertung, ein sog. Werturteil. Das kann nur duch empathische Richter:innen sichergestellt werden, ohne zu riskieren, dass die menschlichen Rechte und die Würde verletzt bzw. beeinträchtigt werden.","['intro_25', 'Z.P3', 'intro_52', 'z_trans_16', 'Z.P1-1']","[(0, 24), (24, 56), (56, 84), (84, 127), (127, 404)]"
20230720_125243_521032,10,user,"Empathie ist aber nicht immer gut, oder?",['OTHER'],"[(0, 40)]"
20230720_125243_521032,11,bot,"Ich bin mir nicht sicher, was du meinst. Bitte wähle aus der folgenden Liste ein Argument aus, das deinen Standpunkt am besten repräsentiert. | Ergebnisse KI wenig flexibel; Zivilrecht Faktenlage bestimmbar |   Ich denke damit liegst du richtig.  Ein weiterer Gesichtspunkt gehört hierher. Die von der jurKI präsentierten Ergebnisse sind in ihrer Ausgabe weniger flexibel. Die Befassung menschlicher Richter:innen zur endgültigen Entscheidung erlaubt ihnen die Ausübung der notwendigen Ermessensmacht. Dies ist Ausdruck einer individualisierten Rechtsprechung.",['Z.K4-1'],"[(0, 560)]"
20230720_125243_521032,12,user,Nach den Gesetzen ist der Einsatz von KI verboten.,['Z.K12'],"[(0, 50)]"
20230720_125243_521032,13,bot,"Ich bin mir nicht sicher, was du meinst. Bitte wähle aus der folgenden Liste ein Argument aus, das deinen Standpunkt am besten repräsentiert. | Keines der genannten Argumente trifft zu. |    Wir werden dein Argument evaluieren und in einer neuen Version berücksichtigen. Bitte fahre mit deinem nächsten Argument fort.",['NoneOfTheAbove'],"[(0, 319)]"
20230720_125243_521032,14,user,Wollen wir als Gesellschaft KI über Menschen bestimmen lassen?,['OTHER'],"[(0, 62)]"
20230720_125243_521032,15,bot,"Ich bin mir nicht sicher, was du meinst. Bitte wähle aus der folgenden Liste ein Argument aus, das deinen Standpunkt am besten repräsentiert. | Richter:innen werden weiterhin gebraucht |   Ich denke damit liegst du richtig.  Aber zu beachten ist: Richter:in ist für viele ein Berufswunsch und mithin Motiv für das Studium. Ohne dieses Berufsbild, würden sich möglicherweise weniger Menschen für das Studium entscheiden. Dies würde dazu führen, dass es weniger Jurist:innen gibt, was jedoch wichtig für die Demokratie ist.",['Z.K7-1'],"[(0, 521)]"
20230720_125243_521032,16,user,Warum?,['OTHER'],"[(0, 6)]"
20230720_125243_521032,17,bot,"Ich bin mir nicht sicher, was du meinst. Bitte wähle aus der folgenden Liste ein Argument aus, das deinen Standpunkt am besten repräsentiert. | keine subjektiven Urteile; mehr Gerechtigkeit; Objektivität der KI |   Das ist ein gutes Argument. Andererseits: Die Richter:innen sind immer unterschiedliche Personen und entscheiden dementsprechend unterschiedlich. Dies ist für ein funktionierendes Rechtssystem von großer Bedeutung, da unterschiedliche Urteile auch das Ergebnis verschiedener an sich richtiger Abwägungen sein können.",['Z.P1'],"[(0, 533)]"
20230720_125243_521032,18,user,Die KI spart Zeit.,['Z.P2'],"[(0, 18)]"
20230720_125243_521032,19,bot,"Ich bin mir nicht sicher, was du meinst. Bitte wähle aus der folgenden Liste ein Argument aus, das deinen Standpunkt am besten repräsentiert. | Kosten sparen |   Das kann ich nachvollziehen. Andererseits: Man müsste wie in unserem Szenario auch gegen eine jurKI eine Berufung einer höheren Instanz zulassen, die dann nicht von der gleichen jurKI entschieden werden dürfte (da jene das gleiche Ergebnis erzielen würde), sondern von menschlichen Richter:innen.",['Z.P8'],"[(0, 460)]"
20230720_125243_521032,20,user,Aber ab welcher Instanz soll die JurKI nicht mehr verwendet werden dürfen?,['FAQ.G1'],"[(0, 74)]"
20230720_125243_521032,21,bot,"Ich bin mir nicht sicher, was du meinst. Bitte wähle aus der folgenden Liste ein Argument aus, das deinen Standpunkt am besten repräsentiert. | Keines der genannten Argumente trifft zu. |    Wir werden dein Argument evaluieren und in einer neuen Version berücksichtigen. Bitte fahre mit deinem nächsten Argument fort.",['NoneOfTheAbove'],"[(0, 319)]"
20230720_125243_521032,22,user,In der Vergangenheit haben Richter nicht immer objektiv geurteilt - warum sollte die KI das tun?,['Z.K6-1-1'],"[(0, 96)]"
20230720_125243_521032,23,bot,"Dein Argument ist, dass die jurKI objektiv ist. Das kann ich nachvollziehen. Aber zu beachten ist: Auch eine jurKI kann nicht alle Faktoren vollständig aufdecken, da stets eine Einschränkung in Bezug auf die Datenqualität und -quantität, Algorithmen und Rechenleistung gegeben ist. Im menschlichen Bewusstsein könnten noch weitere Variablen verborgen sein.","['intro_25', 'Z.P1', 'intro_53', 'z_trans_12', 'Z.P4-1']","[(0, 24), (24, 48), (48, 77), (77, 99), (99, 357)]"
20230720_125243_521032,24,user,Einflussnahme durch menschliche Faktoren findet nicht mehr statt.,['Z.P1-1-1'],"[(0, 65)]"
20230720_125243_521032,25,bot,"Ich bin mir nicht sicher, was du meinst. Bitte wähle aus der folgenden Liste ein Argument aus, das deinen Standpunkt am besten repräsentiert. | keine subjektiven Urteile; mehr Gerechtigkeit; Objektivität der KI |   Das ist ein gutes Argument.  Um auch noch einmal eine andere Seite zu beleuchten: Die jurKI kann dem/der Adressat:in ihrer Macht nicht menschlich begegnen, sondern dies allenfalls simulieren, da die Black Box undurchschaubar ist. Wie kann sie über das Leben der Bürger:innen urteilen, wenn sie hiervon keine Ahnung hat?",['Z.P1'],"[(0, 535)]"
20230720_125243_521032,26,user,Alles klar.,['OTHER'],"[(0, 11)]"
20230720_125243_521032,27,bot,"Kurz zusammengefasst, KI lernt nur aus vorurteils- und diskriminierungsfreien Fällen. Das ist ein gutes Argument. Aber zu beachten ist: Die Regel und Leitlinien sind schnell erlassen, allerdings dürfte sich die Umsetzung beispielsweise eines Diskriminierungsgesetzes für die jurKI als schwierig erweisen, da eine KI auch aus Fällen lernt, in denen möglicherweise vorurteilsbehaftet und diskriminierend von menschlichen Richter:innen entschieden wurde.","['intro_24', 'Z.K6-1-1-1', 'intro_52', 'z_trans_12', 'Z.K6-1-1']","[(0, 22), (22, 86), (86, 114), (114, 136), (136, 452)]"
20230720_125243_521032,28,user,Du hast mich überzeugt.,['CONSENT'],"[(0, 23)]"
20230720_125243_521032,29,bot,"Ich bin mir nicht sicher, was du meinst. Bitte wähle aus der folgenden Liste ein Argument aus, das deinen Standpunkt am besten repräsentiert. | Ich stimme deiner Argumentation zu. |   Freut mich, dass du mein Argument gut findest.   Aber zu beachten ist: Die jurKI als Richter:in könnte auf wenig Akzeptanz in der Gesellschaft stoßen.",['OTHER'],"[(0, 334)]"
20230720_125243_521032,30,user,Das ist mir egal. Das Rauchverbot in der Gastronomie hatte auch keine Akzeptanz in der Gesellschaft und ist gut,"['DISSENT', 'Z.K9-1']","[(0, 17), (17, 111)]"
20230720_125243_521032,31,bot,"Ich bin mir nicht sicher, was du meinst. Bitte wähle aus der folgenden Liste ein Argument aus, das deinen Standpunkt am besten repräsentiert. | Akzeptanz in Gesellschaft nimmt zu |   Da gebe ich dir recht.  Ein weiterer Gesichtspunkt gehört hierher. Bei der jurKI könnte die subjektive Wirkung auf dem Weg liegen bleiben. Man denke z.B. an die Wirkung, die Richter:innen mit dem Spruch ""im Namen des Volkes"" bei den Verfahrensteilnehmenden hervorruft. Diese wäre nur sehr schwer durch eine Maschine zu reproduzieren.",['Z.K9-1'],"[(0, 516)]"
20230720_133542_244414,0,user,keine vorurteile zu den betroffenen menschen aufgrund von aussehen/ sympathie,['Z.P1'],"[(0, 77)]"
20230720_133542_244414,1,bot,"Du meinst also, dass die jurKI objektiv ist. Das verstehe ich. Direkt dazu: Die Richter:innen sind immer unterschiedliche Personen und entscheiden dementsprechend unterschiedlich. Dies ist für ein funktionierendes Rechtssystem von großer Bedeutung, da unterschiedliche Urteile auch das Ergebnis verschiedener an sich richtiger Abwägungen sein können.","['intro_23', 'Z.P1', 'intro_51', 'Z.P1-2']","[(0, 21), (21, 45), (45, 76), (76, 351)]"
20230720_133542_244414,2,user,ja aber vielleicht keine verurteilung wegen rassistischen Hintergründen,['Z.K6-1-1-1'],"[(0, 71)]"
20230720_133542_244414,3,bot,"Ich bin mir nicht sicher, was du meinst. Bitte wähle aus der folgenden Liste ein Argument aus, das deinen Standpunkt am besten repräsentiert. | Lernt aus selektierten Daten aus vorurteils- und diskriminierungsfreien Fällen |   Das verstehe ich.  Aber zu beachten ist: Die Entwicklung von KI ist bisher nahezu keinen moralischen Leitlinien und Regeln unterworfen und kann nicht werten. Richter:innen hingegen bekennen sich zu Werten durch die Ausübung ihres Berufs und des rechtlichen Rahmens.",['Z.K6-1-1-1'],"[(0, 492)]"
20230720_133542_244414,4,user,stimme zu,['CONSENT'],"[(0, 10)]"
20230720_133542_244414,5,bot,"Ich bin mir nicht sicher, was du meinst. Bitte wähle aus der folgenden Liste ein Argument aus, das deinen Standpunkt am besten repräsentiert. | Ich stimme deiner Argumentation zu. |   Schön, dass du mein Argument gut findest.   Aber zu beachten ist: Die jurKI kann dem/der Adressat:in ihrer Macht nicht menschlich begegnen, sondern dies allenfalls simulieren, da die Black Box undurchschaubar ist. Wie kann sie über das Leben der Bürger:innen urteilen, wenn sie hiervon keine Ahnung hat?",['OTHER'],"[(0, 488)]"
20230720_133542_244414,6,user,ja aber ist ja auch nicht notwendig nur der fall muss objektiv bewertet werden,['Z.P1'],"[(0, 78)]"
20230720_133542_244414,7,bot,"Du meinst also, dass KI nur aus vorurteils- und diskriminierungsfreien Fällen lernt. Das verstehe ich. Aber zu beachten ist: Die von der jurKI präsentierten Ergebnisse sind in ihrer Ausgabe weniger flexibel. Die Befassung menschlicher Richter:innen zur endgültigen Entscheidung erlaubt ihnen die Ausübung der notwendigen Ermessensmacht. Dies ist Ausdruck einer individualisierten Rechtsprechung.","['intro_23', 'Z.K6-1-1-1', 'intro_54', 'z_trans_12', 'Z.K4']","[(0, 21), (21, 85), (85, 103), (103, 125), (125, 396)]"
20230720_133542_244414,8,user,kontrolle des KI Urteils durch menschen,['OTHER'],"[(0, 39)]"
20230720_133542_244414,9,bot,"Ich bin mir nicht sicher, was du meinst. Bitte wähle aus der folgenden Liste ein Argument aus, das deinen Standpunkt am besten repräsentiert. | Richter:innen werden weiterhin gebraucht |   Ich denke damit liegst du richtig.  Aber zu beachten ist: Richter:in ist für viele ein Berufswunsch und mithin Motiv für das Studium. Ohne dieses Berufsbild, würden sich möglicherweise weniger Menschen für das Studium entscheiden. Dies würde dazu führen, dass es weniger Jurist:innen gibt, was jedoch wichtig für die Demokratie ist.",['Z.K7-1'],"[(0, 521)]"
20230720_133542_244414,10,user,ich denke nicht vor allem weil ki mit menschen zusammenarbeiten,['Z.K7-1'],"[(0, 63)]"
20230720_133542_244414,11,bot,"Ich bin mir nicht sicher, was du meinst. Bitte wähle aus der folgenden Liste ein Argument aus, das deinen Standpunkt am besten repräsentiert. | Richter:innen werden weiterhin gebraucht |   Dem würde ich zustimmen.  Darüber hinaus finde ich, dass hier noch folgendes beachtet werden sollte: Wenn eine jurKI immer nur aufgrund der bestehenden Rechtsprechung entscheidet, ergeben sich keine Rechtsprechungsänderungen, die wichtig für das Vorankommen in der Gesellschaft und ein wichtiges Instrument sind.",['Z.K7-1'],"[(0, 501)]"
20230720_133542_244414,12,user,ki günstiger als menschen,['Z.P8'],"[(0, 25)]"
20230720_133542_244414,13,bot,"Du merkst an, dass die KI günstiger ist. Das verstehe ich. Direkt dazu: Richter:innen entscheiden über Recht und Unrecht. Dabei spielen die Kosten eine eher untergeordnete Rolle. Zudem führt der Einsatz der jurKI eher zu noch mehr finanziellen Belastungen, da die Richter:innen mit der Implementierung der Sachlage beschäftigt bleiben.","['intro_28', 'Z.P8', 'intro_51', 'Z.P8-1']","[(0, 19), (19, 41), (41, 72), (72, 336)]"
20230720_133542_244414,14,user,stimme zu,['CONSENT'],"[(0, 9)]"
