Unnamed: 0,dialogue,utterance_id,utterance_type,utterance_text,labels,bounds
251,20230130_123220_792150,3,bot,"Das ist möglich. Aber zu beachten ist: Eine medKI wäre rund um die Uhr erreichbar; in der Nacht oder am Wochenende, wenn auch nur in einer Notbesetzung mit medizinischem Hilfspersonal. Das ließe sich ohne medKI sonst nur in großen Kliniken sicherstellen und wäre auf dem Land nicht möglich.","['intro_2', 'z_trans_12', 'Z.P1']","[(0, 17), (17, 39), (39, 291)]"
252,20230130_123220_792150,4,user,"Ja, aber deswegen gibt es trotzdem kein richtiges Arzt-Patientengespräch, selbst wenn die KI rund um die Uhr erreichbar ist.",['Z.K1'],"[(0, 124)]"
253,20230130_123220_792150,5,bot,"Du merkst an, dass eine rund um die Uhr erreichbare medKI sehr teuer wäre. Das ist möglich. Es wird große und kleine Untersuchungszentren geben, die bei gleicher Größe günstiger als entsprechende Arztpraxen sind.","['intro_28', 'Z.P1-2', 'intro_2', 'Z.P1-2-1']","[(0, 19), (19, 75), (75, 92), (92, 213)]"
254,20230130_123220_792150,6,user,"Ja teuer wäre es außerdem, jedoch ist/sollte medizinisches Personal auch gut bezahlt werden.",['OTHER'],"[(0, 92)]"
255,20230130_123220_792150,7,bot,"Ich bin mir nicht sicher, was du genau meinst. Kannst du das anders ausdrücken?",['intro_62'],"[(0, 80)]"
256,20230130_123220_792150,8,user,KI ist meiner Meinung nach kein vollständiger Ersatz von Ärzten/Ärztinnen.,['NZ.K10'],"[(0, 74)]"
257,20230130_123220_792150,9,bot,Das mag sein. Aber zu beachten ist: Die Anwendung einer medKI ist standardisiert und reproduzierbar. Sie hängt nicht von den unterschiedlichen Fähigkeiten oder der Tagesform der behandelnden Ärzt:innen ab. Stattdessen liefert sie gleichbleibend gute Ergebnisse und ermüdet im Gegensatz zum menschlichen Gehirn nicht.,"['intro_3', 'z_trans_12', 'Z.P2']","[(0, 14), (14, 36), (36, 317)]"
258,20230130_122552_615291,0,user,Menschen sind einfühlsamer und können denke ich einfach präziser arbeiten,['Z.K7'],"[(0, 74)]"
259,20230130_122552_615291,1,bot,"Ich bin mir nicht sicher, was du genau meinst. Kannst du das anders formulieren?",['intro_61'],"[(0, 81)]"
260,20230130_122552_615291,2,user,"Maschinen können nicht die Qualität erbringen, welche Ärzte leisten",['Z.K6'],"[(0, 68)]"
261,20230130_122552_615291,3,bot,"Das ist möglich. Um auch noch einmal eine andere Seite zu beleuchten: Eine medKI wäre rund um die Uhr erreichbar; in der Nacht oder am Wochenende, wenn auch nur in einer Notbesetzung mit medizinischem Hilfspersonal. Das ließe sich ohne medKI sonst nur in großen Kliniken sicherstellen und wäre auf dem Land nicht möglich.","['intro_2', 'z_trans_13', 'Z.P1']","[(0, 17), (17, 70), (70, 322)]"
262,20230130_122552_615291,4,user,Das stimmt. Ich habe allerdings mehr Vertrauen in Menschen als in Maschinen. Maschinen können auch Fehler machen,"['CONSENT', 'Z.K10', 'Z.K15']","[(0, 12), (12, 76), (76, 113)]"
263,20230130_122552_615291,5,bot,"Dein Argument ist, dass Computersysteme oft technische Schwierigkeiten haben. Dem würde ich eher nicht zustimmen. Technische Probleme treten bei jeder neuen bzw. günstigen Technologie auf. Wenn es allerdings um Leben und Tod geht, werden Systeme durch ausführlich getestet und geprüft, sodass das Risiko von Fehlern auf ein vertretbares Maß sinkt. Beispiele dafür sind Flugzeuge oder Kernkraftwerke. Ich würde hier noch folgenden Punkt hinzufügen: Die Anwendung einer medKI ist standardisiert und reproduzierbar. Sie hängt nicht von den unterschiedlichen Fähigkeiten oder der Tagesform der behandelnden Ärzt:innen ab. Stattdessen liefert sie gleichbleibend gute Ergebnisse und ermüdet im Gegensatz zum menschlichen Gehirn nicht.","['intro_25', 'NZ.K9', 'intro_8', 'NZ.K9-1', 'z_trans_9', 'Z.P2']","[(0, 24), (24, 78), (78, 114), (114, 400), (400, 448), (448, 729)]"
264,20230130_122552_615291,6,user,"Die Sicherheit, dass nichts schief geht hat man nie. Nicht beim Menschen und nicht bei der Maschine. Allerdings finde ich auch, dass Ärzte nicht umsonst studiert haben sollten um dann von Maschinen abgelöst zu werden","['Z.K15', 'Z.K14']","[(0, 101), (101, 216)]"
265,20230130_122552_615291,7,bot,"Ich bin mir nicht sicher, was du genau meinst. Kannst du das anders ausdrücken?",['intro_62'],"[(0, 80)]"
266,20230130_122552_615291,8,user,Maschinen sollten ausgebildeten Ärzten nicht die Arbeitsplätze wegnehmen,['Z.K14'],"[(0, 73)]"
267,20230130_122552_615291,9,bot,"Das mag sein. Ansprechen möchte ich noch: Ärztliche Leistungen werden immer mehr nachgefragt, sowohl wegen höheren Ansprüchen als auch der Alterung der Gesellschaft. Die medKIs sind notwendig, um den steigenden Bedarf qualitativ hochwertig zu befriedigen, insbesondere auch auf dem Land.","['intro_3', 'z_trans_11', 'Z.P4']","[(0, 14), (14, 42), (42, 288)]"
268,20230130_122552_615291,10,user,"Als zusätzliche Hilfe vielleicht, aber ich stimme nicht zu, dass es ausschließlich medKIs geben sollte",['NZ.K10'],"[(0, 102)]"
269,20230130_122552_615291,11,bot,"Ich bin mir nicht sicher, was du genau meinst. Kannst du das anders ausdrücken?",['intro_62'],"[(0, 80)]"
270,20230130_122552_615291,12,user,"MedKIs könnten als Unterstützung dienen, aber nicht als Arztersatz",['NZ.K10'],"[(0, 66)]"
271,20230130_122552_615291,13,bot,"Das verstehe ich. Um auch noch einmal eine andere Seite zu beleuchten: Patient:innen haben ein Recht auf die neuesten evidenzbasierten Empfehlungen hinsichtlich ihrer Diagnostik und Therapie, was durch eine medKI gewährleistet ist. Das ist bei Ärzt:innen, die sich neben ihrem stressigen Job mühsam weiterbilden müssen, nicht immer gewährleistet.","['intro_1', 'z_trans_13', 'Z.P3']","[(0, 18), (18, 71), (71, 347)]"
272,20230130_122552_615291,14,user,Es hat bisher geklappt. Also warum sollte man alles auf KIs umrüsten?,['NZ.K10'],"[(0, 69)]"
273,20230130_122552_615291,15,bot,"Ich bin mir nicht sicher, was du genau meinst. Kannst du das anders formulieren?",['intro_61'],"[(0, 81)]"
274,20230130_122552_615291,16,user,Bisher haben Ärzte ihre Arbeit geleistet und das passend. Ich sehe keine 100%ige Nötigkeit dies auf ausschließlich KIs umzurüsten.,['NZ.K10'],"[(0, 131)]"
275,20230130_122552_615291,17,bot,"Das verstehe ich. Aber hast Du schon einmal daran gedacht: Die Aus- und Weiterbildung von Ärzt:innen ist sehr teuer. MedKIs entlasten sie bezüglich medizinischem Fachwissen, machen sie aber nicht überflüssig, da sie für Untersuchungen und Gespräche weiterhin notwendig sind. Insgesamt ist das Szenario kostengünstiger - bei höherer Qualität der Behandlung.","['intro_1', 'z_trans_2', 'Z.P5']","[(0, 18), (18, 59), (59, 357)]"
276,20230130_122552_615291,18,user,"Ärzte haben Fachwissen und wenden ihr Wissen gekonnt an. Bei Maschinen ist dies nicht der Fall. Diese werden programmiert und wissen nicht was sie tun, das sie nur Befehle ausführen.",['CON_NZARG'],"[(0, 183)]"
277,20230130_122552_615291,19,bot,"Ich bin mir nicht sicher, was du genau meinst. Kannst du das anders ausdrücken?",['intro_62'],"[(0, 80)]"
278,20230130_122552_615291,20,user,Maschinen folgen ausschließlich Befehlen und haben keine eigene Denkfähigkeit.,['CON_NZARG'],"[(0, 79)]"
279,20230130_122552_615291,21,bot,Das ist möglich. Aber hast Du schon einmal daran gedacht: Ein medKI könnte aufgrund der bekannten Datenmengen Diagnosen und Therapieeffekte genauer einschätzen als Ärzt:innen. Dadurch könnte sie verschiedene Alternativen mit Wahrscheinlichkeitsangaben für Patient:innen in schwierigen Situationen aufzeigen.,"['intro_2', 'z_trans_2', 'Z.P6']","[(0, 17), (17, 58), (58, 308)]"
280,20230130_122552_615291,22,user,Ich denke wir kommen hier nicht auf einen grünen azweig,['OTHER'],"[(0, 55)]"
281,20230130_122552_615291,23,bot,"Ich bin mir nicht sicher, was du genau meinst. Kannst du das anders ausdrücken?",['intro_62'],"[(0, 80)]"
282,20230130_131525_553413,0,user,"Meiner Meinung nach ist es wichtig, dass Ärtze eine Einschätzung der gesundheitlichen Lage in Person und vor Ort durchführen müssen, was durch eine KI nicht möglich ist.",['Z.K1'],"[(0, 169)]"
283,20230130_131525_553413,1,bot,"Ich bin mir nicht sicher, was du genau meinst. Kannst du das anders formulieren?",['intro_61'],"[(0, 81)]"
284,20230130_131525_553413,2,user,Echte Ärzte sind nicht durch KI zu ersetzen.,['Z.K6'],"[(0, 44)]"
285,20230130_131525_553413,3,bot,"Das ist möglich. Um auch noch einmal eine andere Seite zu beleuchten: Eine medKI wäre rund um die Uhr erreichbar; in der Nacht oder am Wochenende, wenn auch nur in einer Notbesetzung mit medizinischem Hilfspersonal. Das ließe sich ohne medKI sonst nur in großen Kliniken sicherstellen und wäre auf dem Land nicht möglich.","['intro_2', 'z_trans_13', 'Z.P1']","[(0, 17), (17, 70), (70, 322)]"
286,20230130_131525_553413,4,user,"Ja das mag sein, aber Ferndiagnosen zu stellen, ist keine adäquate Lösung.",['Z.K2'],"[(0, 74)]"
287,20230130_131525_553413,5,bot,"Ich bin mir nicht sicher, was du genau meinst. Kannst du das anders ausdrücken?",['intro_62'],"[(0, 80)]"
288,20230130_131525_553413,6,user,Es würden auch Arbeitsplätze verloren gehen.,['Z.K14'],"[(0, 44)]"
289,20230130_131525_553413,7,bot,Das verstehe ich. Ansprechen möchte ich noch: Die Anwendung einer medKI ist standardisiert und reproduzierbar. Sie hängt nicht von den unterschiedlichen Fähigkeiten oder der Tagesform der behandelnden Ärzt:innen ab. Stattdessen liefert sie gleichbleibend gute Ergebnisse und ermüdet im Gegensatz zum menschlichen Gehirn nicht.,"['intro_1', 'z_trans_11', 'Z.P2']","[(0, 18), (18, 46), (46, 327)]"
290,20230130_131525_553413,8,user,Eine persönliche und emphatische Einschätzung ist aber wichtig.,['Z.K7'],"[(0, 63)]"
291,20230130_131525_553413,9,bot,"Kurz zusammengefasst, die medKI hat kein Einfühlungsvermögen zB für verzweifelte Patient:innen. Darauf geht unser Szenario wie folgt ein: Da der medKI echtes Einfühlungsvermögen fehlt, sollte das medizinische Fachpersonal in den Untersuchungszentren die Kommunikation insbesondere bei schwierigen Situationen übernehmen.","['intro_24', 'Z.K7', 'intro_55', 'Z.K7-1']","[(0, 22), (22, 96), (96, 138), (138, 321)]"
292,20230130_131525_553413,10,user,"Ich glaube aber, dass eine emphatische Fähigkeit bei Ärzten notwendig ist",['Z.K1'],"[(0, 74)]"
293,20230130_131525_553413,11,bot,"Du merkst an, dass die medKI kein Einfühlungsvermögen zB für verzweifelte Patient:innen hat. Das ist im Szenario bereits berücksichtigt: Aber zu beachten ist: Ärztliche Leistungen werden immer mehr nachgefragt, sowohl wegen höheren Ansprüchen als auch der Alterung der Gesellschaft. Die medKIs sind notwendig, um den steigenden Bedarf qualitativ hochwertig zu befriedigen, insbesondere auch auf dem Land.","['intro_28', 'Z.K7', 'intro_56', 'z_trans_12', 'Z.P4']","[(0, 19), (19, 93), (93, 137), (137, 159), (159, 405)]"
294,20230130_130821_890592,0,user,"Ärztinnen können die Verantwortung über Fehler übernehmen, die KI aber nicht.",['Z.K3'],"[(0, 78)]"
295,20230130_130821_890592,1,bot,"Kurz zusammengefasst, unvermeidliche Fehlentscheidungen der medKI werden nicht akzeptiert. Das verstehe ich. Andererseits: Mangelnde Akzeptanz unvermeidlicher technischer Fehlentscheidungen sind ein gesellschaftliches und juristisches Problem. Einerseits sollte man Patient:innen die Wahl zwischen einer medKI und bisherigen Ärzt:innen lassen, andererseits ärztliche Schadenersatz-Regelungen übernehmen.","['intro_24', 'Z.K3', 'intro_50', 'Z.K3-1']","[(0, 22), (22, 91), (91, 123), (123, 404)]"
296,20230130_130821_890592,2,user,"Für viele Patienten spielt zudem die zwischenmenschliche Bindung zu ihrem Arzt. Eine KI wird niemals die gleiche emotionale Bindung enwickeln, wie ein Arzt.",['Z.K7'],"[(0, 157)]"
297,20230130_130821_890592,3,bot,"Mit anderen Worten, die medKI hat kein Einfühlungsvermögen zB für verzweifelte Patient:innen. Das ist im Szenario bereits berücksichtigt: Da der medKI echtes Einfühlungsvermögen fehlt, sollte das medizinische Fachpersonal in den Untersuchungszentren die Kommunikation insbesondere bei schwierigen Situationen übernehmen.","['intro_32', 'Z.K7', 'intro_56', 'Z.K7-1']","[(0, 20), (20, 94), (94, 138), (138, 321)]"
298,20230130_130821_890592,4,user,Medizinisches Fachpersonal ist aber nicht so erfahren wie ein Arzt.,['CON_NZARG'],"[(0, 67)]"
299,20230130_130821_890592,5,bot,"Ich bin mir nicht sicher, was du genau meinst. Kannst du das anders formulieren?",['intro_61'],"[(0, 81)]"
300,20230130_130821_890592,6,user,Und genau deswegen sollst du nicht operieren,['OTHER'],"[(0, 44)]"
301,20230130_130821_890592,7,bot,"Das verstehe ich. Aber hast Du schon einmal daran gedacht: Eine medKI wäre rund um die Uhr erreichbar; in der Nacht oder am Wochenende, wenn auch nur in einer Notbesetzung mit medizinischem Hilfspersonal. Das ließe sich ohne medKI sonst nur in großen Kliniken sicherstellen und wäre auf dem Land nicht möglich.","['intro_1', 'z_trans_2', 'Z.P1']","[(0, 18), (18, 59), (59, 311)]"
302,20230130_130821_890592,8,user,"Nur wenig Operationen müssen akut gemacht werden, das System funktioniert doch gut",['CON_NZARG'],"[(0, 83)]"
303,20230130_130821_890592,9,bot,"Ich bin mir nicht sicher, was du genau meinst. Kannst du das anders ausdrücken?",['intro_62'],"[(0, 80)]"
304,20230130_130821_890592,10,user,Wofür muss ein Arzt durchgehend erreichbar sein? Viele Operationen können auch am nächsten Tag durchgeführt werden.,['CON_NZARG'],"[(0, 115)]"
305,20230130_130821_890592,11,bot,Das ist möglich. Um auch noch einmal eine andere Seite zu beleuchten: Die Anwendung einer medKI ist standardisiert und reproduzierbar. Sie hängt nicht von den unterschiedlichen Fähigkeiten oder der Tagesform der behandelnden Ärzt:innen ab. Stattdessen liefert sie gleichbleibend gute Ergebnisse und ermüdet im Gegensatz zum menschlichen Gehirn nicht.,"['intro_2', 'z_trans_13', 'Z.P2']","[(0, 17), (17, 70), (70, 351)]"
306,20230130_130821_890592,12,user,Wer übernimmt die Verantwortung für Fehler?,['Z.K3'],"[(0, 43)]"
307,20230130_130821_890592,13,bot,"Du argumentierst, dass unvermeidliche Fehlentscheidungen der medKI nicht akzeptiert werden. Das ist ein gutes Argument. Andererseits: Fehlerfreie Entscheidungen sind in der Medizin unmöglich. Es geht darum, möglichst gut zu sein. Wenn eine medKI die gleiche Leistungsfähigkeit wie Fachärzt:innen nachweist, sollte sie wie diese Schadenersatz nur bei grober Fahrlässigkeit zahlen.","['intro_26', 'Z.K3', 'intro_46', 'Z.K3-2']","[(0, 23), (23, 92), (92, 134), (134, 380)]"
308,20230130_130821_890592,14,user,Es geht bei Verantwortung nicht nur um Schadensersatz sondern auch im moralische Verantwortung,['CON_ZARG'],"[(0, 94)]"
309,20230130_130821_890592,15,bot,"Mit anderen Worten, unvermeidliche Fehlentscheidungen der medKI werden nicht akzeptiert. Das ist ein gutes Argument. Aber hast Du schon einmal daran gedacht: Ärztliche Leistungen werden immer mehr nachgefragt, sowohl wegen höheren Ansprüchen als auch der Alterung der Gesellschaft. Die medKIs sind notwendig, um den steigenden Bedarf qualitativ hochwertig zu befriedigen, insbesondere auch auf dem Land.","['intro_32', 'Z.K3', 'intro_52', 'z_trans_2', 'Z.P4']","[(0, 20), (20, 89), (89, 117), (117, 158), (158, 404)]"
310,20230130_130821_890592,16,user,Wer soll diese KI trainieren? Dafür sind doch auch Ärzte erforderlich,['FAQ.3'],"[(0, 70)]"
311,20230130_130821_890592,17,bot,"Ich bin mir nicht sicher, was du genau meinst. Kannst du das anders formulieren?",['intro_61'],"[(0, 81)]"
312,20230130_130821_890592,18,user,Wer übernimmt das Training der KI?,['FAQ.3'],"[(0, 34)]"
313,20230130_130821_890592,19,bot,"Das ist möglich. Ansprechen möchte ich noch: Patient:innen haben ein Recht auf die neuesten evidenzbasierten Empfehlungen hinsichtlich ihrer Diagnostik und Therapie, was durch eine medKI gewährleistet ist. Das ist bei Ärzt:innen, die sich neben ihrem stressigen Job mühsam weiterbilden müssen, nicht immer gewährleistet.","['intro_2', 'z_trans_11', 'Z.P3']","[(0, 17), (17, 45), (45, 321)]"
314,20230130_130821_890592,20,user,Was ist mir der persönlichen Beziehung?,['Z.K1'],"[(0, 39)]"
315,20230130_130821_890592,21,bot,"Ich bin mir nicht sicher, was du genau meinst. Kannst du das anders ausdrücken?",['intro_62'],"[(0, 80)]"
316,20230130_130821_890592,22,user,Nein,['DISSENT'],"[(0, 4)]"
317,20230130_130821_890592,23,bot,"Das mag sein. Aber hast Du schon einmal daran gedacht: Die Aus- und Weiterbildung von Ärzt:innen ist sehr teuer. MedKIs entlasten sie bezüglich medizinischem Fachwissen, machen sie aber nicht überflüssig, da sie für Untersuchungen und Gespräche weiterhin notwendig sind. Insgesamt ist das Szenario kostengünstiger - bei höherer Qualität der Behandlung.","['intro_3', 'z_trans_2', 'Z.P5']","[(0, 14), (14, 55), (55, 353)]"
318,20230130_130821_890592,24,user,Eine KI könnte auch gehackt werden,['Z.K9'],"[(0, 35)]"
319,20230130_130821_890592,25,bot,"Dein Argument ist, dass die medKI nicht vor Hacker- und Cyberangriffen geschützt werden kann. Das verstehe ich. Andererseits: Mit der zunehmenden Digitalisierung, etwa mit Einführung der digitalen Patient:innenakte, müssen sich Kliniken ohnehin stärker gegen Cyberangriffe schützen. Die fertigen Systeme laufen im geschützten Bereich der Klinik und unterliegen dem gleichen Schutz wie Patient:innendaten.","['intro_25', 'Z.K9', 'intro_50', 'Z.K9-1']","[(0, 24), (24, 94), (94, 126), (126, 405)]"
320,20230130_130821_890592,26,user,Ein System ist nie 100% sicher,['Z.K9'],"[(0, 30)]"
321,20230130_130821_890592,27,bot,"Ich bin mir nicht sicher, was du genau meinst. Kannst du das anders ausdrücken?",['intro_62'],"[(0, 80)]"
322,20230130_130821_890592,28,user,Versuche es bitte nochmal,['OTHER'],"[(0, 26)]"
323,20230130_130821_890592,29,bot,Das mag sein. Aber hast Du schon einmal daran gedacht: Ein medKI könnte aufgrund der bekannten Datenmengen Diagnosen und Therapieeffekte genauer einschätzen als Ärzt:innen. Dadurch könnte sie verschiedene Alternativen mit Wahrscheinlichkeitsangaben für Patient:innen in schwierigen Situationen aufzeigen.,"['intro_3', 'z_trans_2', 'Z.P6']","[(0, 14), (14, 55), (55, 305)]"
324,20230130_115758_330174,0,user,Bei einer Ärztlichen Untersuchung durch eine KI würde der menschliche Kontakt fehlen,['Z.K1'],"[(0, 84)]"
325,20230130_115758_330174,1,bot,"Du sagst, dass die medKI unpersönlicher ist. Darauf geht unser Szenario wie folgt ein: Eine medKI trifft nur Entscheidungen, menschliche Zuwendung wird nach wie vor durch psychologisch geschultes medizinisches Fachpersonal gewährleistet, auf Patient:innen-Wunsch auch feste Vertrauenspersonen. Daher ist eher eine Zunahme an psychischem Beistand zu erwarten.","['intro_27', 'Z.K1', 'intro_55', 'Z.K1-1']","[(0, 15), (15, 45), (45, 87), (87, 359)]"
326,20230130_115758_330174,2,user,Ja,['CONSENT'],"[(0, 2)]"
327,20230130_115758_330174,3,bot,"Ich bin mir nicht sicher, was du genau meinst. Kannst du das anders formulieren?",['intro_61'],"[(0, 81)]"
328,20230130_115758_330174,4,user,"Ein Arzt kann mit eher einfühlsamen Worten sowie geschulte Zuwendung eine beruhigende Wirkung auf den Patienten haben, wohingegen KIs nur die medizinischen fakten aufzählen würden",['Z.K1'],"[(0, 179)]"
329,20230130_115758_330174,5,bot,"Das ist möglich. Um auch noch einmal eine andere Seite zu beleuchten: Eine medKI wäre rund um die Uhr erreichbar; in der Nacht oder am Wochenende, wenn auch nur in einer Notbesetzung mit medizinischem Hilfspersonal. Das ließe sich ohne medKI sonst nur in großen Kliniken sicherstellen und wäre auf dem Land nicht möglich.","['intro_2', 'z_trans_13', 'Z.P1']","[(0, 17), (17, 70), (70, 322)]"
330,20230130_115758_330174,6,user,"Dies wäre aber nur bei größeren Notfällen von Bedeutung, zumahl extrem viele Arbeitsplätze verloren gehen würden",['Z.K14'],"[(0, 112)]"
331,20230130_115758_330174,7,bot,"Wenn ich richtig verstanden habe, fragst du  was mit medizinischen Notfällen ist. Notfälle werden nach wie vor von Medizinern behandelt, genauso wie Operationen und andere manuelle Eingriffe. Medikamentöse Therapie würden allerdings von der medKI übernommen. Um hier einen neuen Punkt in die Diskussion einzubringen: Die Anwendung einer medKI ist standardisiert und reproduzierbar. Sie hängt nicht von den unterschiedlichen Fähigkeiten oder der Tagesform der behandelnden Ärzt:innen ab. Stattdessen liefert sie gleichbleibend gute Ergebnisse und ermüdet im Gegensatz zum menschlichen Gehirn nicht.","['intro_37', 'FAQ.6', 'FAQ.6-1', 'faq_trans_1', 'Z.P2']","[(0, 45), (45, 82), (82, 259), (259, 317), (317, 598)]"
332,20230130_115758_330174,8,user,Eine medKI ist aber nur so gut wie ihr Programm selbst und kann technisch versagen,['NZ.K9'],"[(0, 82)]"
333,20230130_115758_330174,9,bot,"Ich bin mir nicht sicher, was du genau meinst. Kannst du das anders ausdrücken?",['intro_62'],"[(0, 80)]"
334,20230130_115758_330174,10,user,"Bei einer medKI können technische Probleme auftreten, bei Menschen nicht",['NZ.K9'],"[(0, 72)]"
335,20230130_115758_330174,11,bot,"Das ist möglich. Ansprechen möchte ich noch: Ärztliche Leistungen werden immer mehr nachgefragt, sowohl wegen höheren Ansprüchen als auch der Alterung der Gesellschaft. Die medKIs sind notwendig, um den steigenden Bedarf qualitativ hochwertig zu befriedigen, insbesondere auch auf dem Land.","['intro_2', 'z_trans_11', 'Z.P4']","[(0, 17), (17, 45), (45, 291)]"
336,20230130_115758_330174,12,user,"Das würde allerdings einen Ärzteüberschuss und tu hoher Arbeitslosigkeit führen, sowie den Verlust tausender Studienplätze",['Z.K14'],"[(0, 122)]"
337,20230130_115758_330174,13,bot,"Ich bin mir nicht sicher, was du genau meinst. Kannst du das anders formulieren?",['intro_61'],"[(0, 81)]"
338,20230130_115758_330174,14,user,Arbeitslosigkeit wäre eine folge,['Z.K14'],"[(0, 32)]"
339,20230130_115758_330174,15,bot,"Das ist möglich. Aber hast Du schon einmal daran gedacht: Patient:innen haben ein Recht auf die neuesten evidenzbasierten Empfehlungen hinsichtlich ihrer Diagnostik und Therapie, was durch eine medKI gewährleistet ist. Das ist bei Ärzt:innen, die sich neben ihrem stressigen Job mühsam weiterbilden müssen, nicht immer gewährleistet.","['intro_2', 'z_trans_2', 'Z.P3']","[(0, 17), (17, 58), (58, 334)]"
340,20230130_115758_330174,16,user,"Das stimmt, allerdings würde der Arztbesuch deutlich unangenehmer werden",['Z.K1'],"[(0, 72)]"
341,20230130_115758_330174,17,bot,"Ich bin mir nicht sicher, was du genau meinst. Kannst du das anders ausdrücken?",['intro_62'],"[(0, 80)]"
342,20230130_115758_330174,18,user,"Eine KI handelt immer nach der theoretisch besten Lösung, allerdings ist diese nicht immer moralisch Vertretbar",['Z.K2'],"[(0, 112)]"
343,20230130_115758_330174,19,bot,"Das mag sein. Aber zu beachten ist: Die Aus- und Weiterbildung von Ärzt:innen ist sehr teuer. MedKIs entlasten sie bezüglich medizinischem Fachwissen, machen sie aber nicht überflüssig, da sie für Untersuchungen und Gespräche weiterhin notwendig sind. Insgesamt ist das Szenario kostengünstiger - bei höherer Qualität der Behandlung.","['intro_3', 'z_trans_12', 'Z.P5']","[(0, 14), (14, 36), (36, 334)]"
344,20230130_125402_180758,0,user,Hallo,['OTHER'],"[(0, 5)]"
345,20230130_125402_180758,1,bot,"Ich bin mir nicht sicher, was du genau meinst. Kannst du das anders formulieren?",['intro_61'],"[(0, 81)]"
346,20230130_113214_864143,0,user,Medizin ist ein äußerst komplexes Tehemengebiet. Die Behandlung von Patienten erfordert Erfahrung und ist äußerst Vielschichtig,['Z.K6'],"[(0, 127)]"
347,20230130_113214_864143,1,bot,"Ich bin mir nicht sicher, was du genau meinst. Kannst du das anders formulieren?",['intro_61'],"[(0, 81)]"
348,20230130_113214_864143,2,user,"Nein, medizinische Behandlung sollte meiner Meinung nach auf persönlicher Ebene stattfinden, denn viele Krankeiten nur durch ausführliche Anamnese aufgedeckt werden können und zum Teil psychologisch behaftet sind",['Z.K1'],"[(0, 212)]"
349,20230130_113214_864143,3,bot,"Das verstehe ich. Aber zu beachten ist: Eine medKI wäre rund um die Uhr erreichbar; in der Nacht oder am Wochenende, wenn auch nur in einer Notbesetzung mit medizinischem Hilfspersonal. Das ließe sich ohne medKI sonst nur in großen Kliniken sicherstellen und wäre auf dem Land nicht möglich.","['intro_1', 'z_trans_12', 'Z.P1']","[(0, 18), (18, 40), (40, 292)]"
350,20230130_113214_864143,4,user,Der Trend geht ohnehin weg von kleinen Landarztpraxen und hin zu medizinischen Versorgungszentren,['Z.P1'],"[(0, 97)]"
351,20230130_113214_864143,5,bot,"Ich bin mir nicht sicher, was du genau meinst. Kannst du das anders ausdrücken?",['intro_62'],"[(0, 80)]"
352,20230130_113214_864143,6,user,Nein,['DISSENT'],"[(0, 4)]"
353,20230130_113214_864143,7,bot,Das ist möglich. Ansprechen möchte ich noch: Die Anwendung einer medKI ist standardisiert und reproduzierbar. Sie hängt nicht von den unterschiedlichen Fähigkeiten oder der Tagesform der behandelnden Ärzt:innen ab. Stattdessen liefert sie gleichbleibend gute Ergebnisse und ermüdet im Gegensatz zum menschlichen Gehirn nicht.,"['intro_2', 'z_trans_11', 'Z.P2']","[(0, 17), (17, 45), (45, 326)]"
354,20230130_113214_864143,8,user,"Andererseits hat sie ein sehr begrenztes Repertoire, denn anders als ein Mensch kommt MedKI nicht über ihre standardisierten Handlungsweisen hinaus",['Z.K2'],"[(0, 147)]"
355,20230130_113214_864143,9,bot,"Du merkst an, dass Fehler der medKI sich multiplizieren. Das stimmt, allerdings ist es nicht sehr wahrscheinlich. Fehler lassen sich in der Medizin nicht vermeiden. Eine medKI ist aber ein lernendes System und wird auf Dauer Strukturfehler korrigieren. Darin ist sie Menschen überlegen, da sie aus sehr vielen Fällen lernen kann.","['intro_28', 'Z.K4', 'intro_59', 'Z.K4-1']","[(0, 19), (19, 57), (57, 114), (114, 330)]"
356,20230130_113214_864143,10,user,"Nein, ich bezihe mich nicht auf Fehler, sondern auf eine begrenzte, eindimensionale Handlungsfähigkeit",['Z.K6'],"[(0, 102)]"
