Unnamed: 0,dialogue,utterance_id,utterance_type,utterance_text,labels,bounds
460,20230130_123655_293575,46,user,hat eine KI psychologische Fähigkeiten beim umgang mit Patienten?,['Z.K7'],"[(0, 65)]"
461,20230130_123655_293575,47,bot,"Mit anderen Worten, die medKI hat kein Einfühlungsvermögen zB für verzweifelte Patient:innen. Darauf geht unser Szenario wie folgt ein: Da der medKI echtes Einfühlungsvermögen fehlt, sollte das medizinische Fachpersonal in den Untersuchungszentren die Kommunikation insbesondere bei schwierigen Situationen übernehmen.","['intro_32', 'Z.K7', 'intro_55', 'Z.K7-1']","[(0, 20), (20, 94), (94, 136), (136, 319)]"
462,20230130_124521_815828,0,user,Keine Sozialkompetenz von Ärzten,['Z.K1'],"[(0, 32)]"
463,20230130_124521_815828,1,bot,"Ich bin mir nicht sicher, was du genau meinst. Kannst du das anders formulieren?",['intro_61'],"[(0, 81)]"
464,20230130_124521_815828,2,user,Dass KI im Vergleich zu Ärzten über keine sozialen Kompetenzen haben,['Z.K1'],"[(0, 69)]"
465,20230130_124521_815828,3,bot,"Das mag sein. Aber hast Du schon einmal daran gedacht: Eine medKI wäre rund um die Uhr erreichbar; in der Nacht oder am Wochenende, wenn auch nur in einer Notbesetzung mit medizinischem Hilfspersonal. Das ließe sich ohne medKI sonst nur in großen Kliniken sicherstellen und wäre auf dem Land nicht möglich.","['intro_3', 'z_trans_2', 'Z.P1']","[(0, 14), (14, 55), (55, 307)]"
466,20230130_124521_815828,4,user,Aber das wird doch zur Zeit auch gut geregelt mit Schichtdiensten,['OTHER'],"[(0, 65)]"
467,20230130_124521_815828,5,bot,"Ich bin mir nicht sicher, was du genau meinst. Kannst du das anders ausdrücken?",['intro_62'],"[(0, 80)]"
468,20230130_124521_815828,6,user,Ohne KI ist ja auch eine 24h Betreuung garantiert,['Z.P1'],"[(0, 50)]"
469,20230130_124521_815828,7,bot,Das verstehe ich. Aber zu beachten ist: Die Anwendung einer medKI ist standardisiert und reproduzierbar. Sie hängt nicht von den unterschiedlichen Fähigkeiten oder der Tagesform der behandelnden Ärzt:innen ab. Stattdessen liefert sie gleichbleibend gute Ergebnisse und ermüdet im Gegensatz zum menschlichen Gehirn nicht.,"['intro_1', 'z_trans_12', 'Z.P2']","[(0, 18), (18, 40), (40, 321)]"
470,20230130_130803_254629,0,user,"Menschen sind emotional, eine Maschine könnte das nicht",['Z.K7'],"[(0, 56)]"
471,20230130_130803_254629,1,bot,"Kurz zusammengefasst, die medKI hat kein Einfühlungsvermögen zB für verzweifelte Patient:innen. Das ist im Szenario bereits berücksichtigt: Da der medKI echtes Einfühlungsvermögen fehlt, sollte das medizinische Fachpersonal in den Untersuchungszentren die Kommunikation insbesondere bei schwierigen Situationen übernehmen.","['intro_24', 'Z.K7', 'intro_56', 'Z.K7-1']","[(0, 22), (22, 96), (96, 140), (140, 323)]"
472,20230130_130803_254629,2,user,Im Notfall nicht die richtige Entscheidung treffen,['FAQ.6'],"[(0, 51)]"
473,20230130_130803_254629,3,bot,"Dir scheint also unklar zu sein, was mit medizinischen Notfällen ist. Notfälle werden nach wie vor von Medizinern behandelt, genauso wie Operationen und andere manuelle Eingriffe. Medikamentöse Therapie würden allerdings von der medKI übernommen. Um hier einen neuen Punkt in die Diskussion einzubringen: Eine medKI wäre rund um die Uhr erreichbar; in der Nacht oder am Wochenende, wenn auch nur in einer Notbesetzung mit medizinischem Hilfspersonal. Das ließe sich ohne medKI sonst nur in großen Kliniken sicherstellen und wäre auf dem Land nicht möglich.","['intro_38', 'FAQ.6', 'FAQ.6-1', 'faq_trans_1', 'Z.P1']","[(0, 33), (33, 70), (70, 247), (247, 305), (305, 557)]"
474,20230130_130803_254629,4,user,"Psychische Probleme werden nicht schnell gemerkt, mangels Mimik",['Z.K7'],"[(0, 64)]"
475,20230130_130803_254629,5,bot,"Du meinst also, dass die medKI kein Einfühlungsvermögen zB für verzweifelte Patient:innen hat. Das ist im Szenario bereits berücksichtigt: Ansprechen möchte ich noch: Die Anwendung einer medKI ist standardisiert und reproduzierbar. Sie hängt nicht von den unterschiedlichen Fähigkeiten oder der Tagesform der behandelnden Ärzt:innen ab. Stattdessen liefert sie gleichbleibend gute Ergebnisse und ermüdet im Gegensatz zum menschlichen Gehirn nicht.","['intro_23', 'Z.K7', 'intro_56', 'z_trans_11', 'Z.P2']","[(0, 21), (21, 95), (95, 139), (139, 167), (167, 448)]"
476,20230130_130803_254629,6,user,Aber der Patient könnte ermüden,['OTHER'],"[(0, 31)]"
477,20230130_130803_254629,7,bot,"Du sagst, dass Fehler der medKI sich multiplizieren. Das stimmt, allerdings ist es nicht sehr wahrscheinlich. Fehler lassen sich in der Medizin nicht vermeiden. Eine medKI ist aber ein lernendes System und wird auf Dauer Strukturfehler korrigieren. Darin ist sie Menschen überlegen, da sie aus sehr vielen Fällen lernen kann.","['intro_27', 'Z.K4', 'intro_59', 'Z.K4-1']","[(0, 15), (15, 53), (53, 110), (110, 326)]"
478,20230130_130803_254629,8,user,"Echte Probleme sollten nicht nur als Versuch zur Verfügung stehen, sondern echt behandelt werden",['OTHER'],"[(0, 96)]"
479,20230130_130803_254629,9,bot,"Ich bin mir nicht sicher, was du genau meinst. Kannst du das anders formulieren?",['intro_61'],"[(0, 81)]"
480,20230130_134928_578055,0,user,"Die KI kann eine wertvolle Stütze sein in Diagnostik und Therapie und sollte da unbedingt eingesetzt werden. Ich finde aber, sie sollte Ärzt:innen nicht vollständig ersetzen.",['NZ.K10'],"[(0, 174)]"
481,20230130_134928_578055,1,bot,"Mit anderen Worten, die medKI wird im Vergleich zu Ärzt:innen nicht besser sein. Das ist im Szenario bereits berücksichtigt: Eine medKI braucht dazu außer Patient:innen-Fälle auch das gesamte Lehrbuchwissen und ein Verständnis medizinischer Publikationen. Wir wollen aber hier nicht über die technische Machbarkeit einer medKI, sondern über die ethische Sicht diskutieren.","['intro_32', 'Z.K6', 'intro_56', 'Z.K6-1']","[(0, 20), (20, 81), (81, 125), (125, 373)]"
482,20230130_134928_578055,2,user,"Ich finde, man muss das von beiden Seiten betrachten. Es gibt klare Vorteile, aber nur wenn bestimmte Rahmenbedingungen gegeben sind (z.B. Datenschutz auch ggü Krankenkassen) und eine KI kann aus meiner Sicht niemals menschliche Empathie ersetzen.","['INTRO', 'Z.K13', 'Z.K7']","[(0, 53), (53, 174), (174, 248)]"
483,20230130_134928_578055,3,bot,"Du merkst an, dass die medKI nicht vor Hacker- und Cyberangriffen geschützt werden kann. Das ist ein gutes Argument. Andererseits: Mit der zunehmenden Digitalisierung, etwa mit Einführung der digitalen Patient:innenakte, müssen sich Kliniken ohnehin stärker gegen Cyberangriffe schützen. Die fertigen Systeme laufen im geschützten Bereich der Klinik und unterliegen dem gleichen Schutz wie Patient:innendaten.","['intro_28', 'Z.K9', 'intro_46', 'Z.K9-1']","[(0, 19), (19, 89), (89, 131), (131, 410)]"
484,20230130_134928_578055,4,user,Ja. Das muss immer gut überwacht werden. Empathie- und schwingungsfähig ist die KI nicht.,"['CONSENT', 'OTHER', 'Z.K7']","[(0, 4), (4, 40), (40, 89)]"
485,20230130_134928_578055,5,bot,"Dein Argument ist, dass Menschen abhängig von der medKI werden. Dein Argument ist nicht spezifisch bzgl. der medKI sondern gilt für viele fortgeschrittliche Innovationen. In unserem Szenario wird die medKI von Fachärtzt:innen in Kompetenzzentren weiterentwickelt und überwacht. Ein ""Aussterben"" menschlicher Ärzt:innen ist nicht vorgesehen, und die volle Funktionsfähigkeit der medKI kann jederzeit unter menschlicher Aufsicht gewährleistet werden.","['intro_25', 'Z.K16', 'intro_57', 'Z.K16-1']","[(0, 24), (24, 64), (64, 171), (171, 449)]"
486,20230130_134928_578055,6,user,"Nein, das ist nicht mein Argument. Es geht um Empathie. Wenn Ärzt:innen weiterhin genau mit einbezogen werden, bin ich nicht gegen den Einsatz von KI.","['DISSENT', 'Z.K7', 'NZ.K10']","[(0, 35), (35, 55), (55, 150)]"
487,20230130_134928_578055,7,bot,"Du merkst an, dass die medKI kein Einfühlungsvermögen zB für verzweifelte Patient:innen hat. Das ist im Szenario bereits berücksichtigt: Da der medKI echtes Einfühlungsvermögen fehlt, sollte das medizinische Fachpersonal in den Untersuchungszentren die Kommunikation insbesondere bei schwierigen Situationen übernehmen.","['intro_28', 'Z.K7', 'intro_56', 'Z.K7-1']","[(0, 19), (19, 93), (93, 137), (137, 320)]"
488,20230130_134928_578055,8,user,"Das ist gut. Der Vorteil wäre, dass Ärzt:innen mehr Zeit für Patienten hätten - Dinge, die so zu kurz kommen. Ich habe mich vor allem am Begriff „ersetzen“ gestört. Die KI kann vielleicht auch in manchen Dingen besser sein, z.B. seltenere Fälle oder Studien zu Minderheiten einbeziehen.","['CONSENT', 'Z.P1-1-1', 'OTHER', 'Z.P6']","[(0, 13), (13, 109), (109, 164), (164, 286)]"
489,20230130_134928_578055,9,bot,"Ich bin mir nicht sicher, was du genau meinst. Kannst du das anders formulieren?",['intro_61'],"[(0, 81)]"
490,20230130_134928_578055,10,user,Die KI kann Ärzt:innen gut ergänzen. Sie sollte sie aber nicht ersetzen.,['NZ.K10'],"[(0, 72)]"
491,20230130_134928_578055,11,bot,"Das mag sein. Ansprechen möchte ich noch: Eine medKI wäre rund um die Uhr erreichbar; in der Nacht oder am Wochenende, wenn auch nur in einer Notbesetzung mit medizinischem Hilfspersonal. Das ließe sich ohne medKI sonst nur in großen Kliniken sicherstellen und wäre auf dem Land nicht möglich.","['intro_3', 'z_trans_11', 'Z.P1']","[(0, 14), (14, 42), (42, 294)]"
492,20230130_134928_578055,12,user,"Das ist gut, solange es ausführlich monitoriert wird.",['OTHER'],"[(0, 53)]"
493,20230130_134928_578055,13,bot,"Ich bin mir nicht sicher, was du genau meinst. Kannst du das anders ausdrücken?",['intro_62'],"[(0, 80)]"
494,20230130_130703_427160,0,user,"können keine emotionale Bindung zu Patienten aufbauen, keine Empathie, für fehlerfreie Ausführung von Aktionen müssen sehr viele Tests durchgeführt werden",['Z.K7'],"[(0, 154)]"
495,20230130_130703_427160,1,bot,"Mit anderen Worten, die medKI hat kein Einfühlungsvermögen zB für verzweifelte Patient:innen. Das ist im Szenario bereits berücksichtigt: Da der medKI echtes Einfühlungsvermögen fehlt, sollte das medizinische Fachpersonal in den Untersuchungszentren die Kommunikation insbesondere bei schwierigen Situationen übernehmen.","['intro_32', 'Z.K7', 'intro_56', 'Z.K7-1']","[(0, 20), (20, 94), (94, 138), (138, 321)]"
496,20230130_130703_427160,2,user,richitg,['CONSENT'],"[(0, 7)]"
497,20230130_130703_427160,3,bot,"Ich bin mir nicht sicher, was du genau meinst. Kannst du das anders formulieren?",['intro_61'],"[(0, 81)]"
498,20230130_130703_427160,4,user,ja,['CONSENT'],"[(0, 2)]"
499,20230130_130703_427160,5,bot,"Das verstehe ich. Aber zu beachten ist: Eine medKI wäre rund um die Uhr erreichbar; in der Nacht oder am Wochenende, wenn auch nur in einer Notbesetzung mit medizinischem Hilfspersonal. Das ließe sich ohne medKI sonst nur in großen Kliniken sicherstellen und wäre auf dem Land nicht möglich.","['intro_1', 'z_trans_12', 'Z.P1']","[(0, 18), (18, 40), (40, 292)]"
500,20230130_130703_427160,6,user,"das sehe ich auch so, als Alternative für Ärzte um einfach routine arbeit durchzuführen wären sie sinnvoll",['NZ.K10'],"[(0, 21), (21, 106)]"
501,20230130_130703_427160,7,bot,"Ich bin mir nicht sicher, was du genau meinst. Kannst du das anders ausdrücken?",['intro_62'],"[(0, 80)]"
502,20230130_130703_427160,8,user,und genau deswegen bist du dumm,['OTHER'],"[(0, 31)]"
503,20230130_130703_427160,9,bot,Das verstehe ich. Um auch noch einmal eine andere Seite zu beleuchten: Die Anwendung einer medKI ist standardisiert und reproduzierbar. Sie hängt nicht von den unterschiedlichen Fähigkeiten oder der Tagesform der behandelnden Ärzt:innen ab. Stattdessen liefert sie gleichbleibend gute Ergebnisse und ermüdet im Gegensatz zum menschlichen Gehirn nicht.,"['intro_1', 'z_trans_13', 'Z.P2']","[(0, 18), (18, 71), (71, 352)]"
504,20230130_130703_427160,10,user,das stimmt zwar jedoch sind Ärzte durch jahrelange erfahrung besser trainiert während KI erstmal test durchführen muss um bestimmte Krankheiten auszuschließen. Menschen können auch schon anhand der Emotionen und psychischen Beschaffenheit feststellen was das problem sein könnte,"['CONSENT', 'Z.K6', 'Z.K7']","[(0, 16), (16, 159), (159, 279)]"
505,20230130_130703_427160,11,bot,"Mit anderen Worten, die medKI hat kein Einfühlungsvermögen zB für verzweifelte Patient:innen. Das ist im Szenario bereits berücksichtigt: Um auch noch einmal eine andere Seite zu beleuchten: Ärztliche Leistungen werden immer mehr nachgefragt, sowohl wegen höheren Ansprüchen als auch der Alterung der Gesellschaft. Die medKIs sind notwendig, um den steigenden Bedarf qualitativ hochwertig zu befriedigen, insbesondere auch auf dem Land.","['intro_32', 'Z.K7', 'intro_56', 'z_trans_13', 'Z.P4']","[(0, 20), (20, 94), (94, 138), (138, 191), (191, 437)]"
506,20230130_130703_427160,12,user,"Du hast recht, wer finanziert die KI und welche Rohstoffe werden dann im übermaß dafür verbraucht",['FAQ.G1'],"[(0, 97)]"
507,20230130_130703_427160,13,bot,"Ich bin mir nicht sicher, was du genau meinst. Kannst du das anders ausdrücken?",['intro_62'],"[(0, 80)]"
508,20230130_130703_427160,14,user,ja dann weiß ich nicht,['OTHER'],"[(0, 23)]"
509,20230130_130703_427160,15,bot,"Das mag sein. Ansprechen möchte ich noch: Patient:innen haben ein Recht auf die neuesten evidenzbasierten Empfehlungen hinsichtlich ihrer Diagnostik und Therapie, was durch eine medKI gewährleistet ist. Das ist bei Ärzt:innen, die sich neben ihrem stressigen Job mühsam weiterbilden müssen, nicht immer gewährleistet.","['intro_3', 'z_trans_11', 'Z.P3']","[(0, 14), (14, 42), (42, 318)]"
510,20230130_123829_086705,0,user,Eine KI kann das Zwischenmenschliche nicht erkennen und so Diagnosen nicht schonend beibringen,['Z.K7'],"[(0, 95)]"
511,20230130_123829_086705,1,bot,"Du sagst, dass die medKI unpersönlicher ist. Das ist im Szenario bereits berücksichtigt: Eine medKI trifft nur Entscheidungen, menschliche Zuwendung wird nach wie vor durch psychologisch geschultes medizinisches Fachpersonal gewährleistet, auf Patient:innen-Wunsch auch feste Vertrauenspersonen. Daher ist eher eine Zunahme an psychischem Beistand zu erwarten.","['intro_27', 'Z.K1', 'intro_56', 'Z.K1-1']","[(0, 15), (15, 45), (45, 89), (89, 361)]"
512,20230130_123829_086705,2,user,Wenn eine falsche Entscheidung getroffen wird wer haftet dann,['Z.K3'],"[(0, 62)]"
513,20230130_123829_086705,3,bot,"Du argumentierst, dass unvermeidliche Fehlentscheidungen der medKI nicht akzeptiert werden. Das ist ein gutes Argument. Direkt dazu: Mangelnde Akzeptanz unvermeidlicher technischer Fehlentscheidungen sind ein gesellschaftliches und juristisches Problem. Einerseits sollte man Patient:innen die Wahl zwischen einer medKI und bisherigen Ärzt:innen lassen, andererseits ärztliche Schadenersatz-Regelungen übernehmen.","['intro_26', 'Z.K3', 'intro_47', 'Z.K3-1']","[(0, 23), (23, 92), (92, 133), (133, 414)]"
514,20230130_123829_086705,4,user,Wer bezahlt die KI,['FAQ.G1'],"[(0, 18)]"
515,20230130_123829_086705,5,bot,"Ich bin mir nicht sicher, was du genau meinst. Kannst du das anders formulieren?",['intro_61'],"[(0, 81)]"
516,20230130_123829_086705,6,user,Von welchem Geld wird die KI finanziert,['FAQ.G1'],"[(0, 40)]"
517,20230130_123829_086705,7,bot,"Das ist möglich. Ansprechen möchte ich noch: Eine medKI wäre rund um die Uhr erreichbar; in der Nacht oder am Wochenende, wenn auch nur in einer Notbesetzung mit medizinischem Hilfspersonal. Das ließe sich ohne medKI sonst nur in großen Kliniken sicherstellen und wäre auf dem Land nicht möglich.","['intro_2', 'z_trans_11', 'Z.P1']","[(0, 17), (17, 45), (45, 297)]"
518,20230130_123829_086705,8,user,Die KI ist zu teuer und aufwendig um sie in Massen einzusetzen,['Z.P1-2'],"[(0, 63)]"
519,20230130_123829_086705,9,bot,"Ich bin mir nicht sicher, was du genau meinst. Kannst du das anders ausdrücken?",['intro_62'],"[(0, 80)]"
520,20230130_123829_086705,10,user,Die medKI ist zu teuer zu installieren,['Z.P1-2'],"[(0, 39)]"
521,20230130_123829_086705,11,bot,Das mag sein. Aber hast Du schon einmal daran gedacht: Die Anwendung einer medKI ist standardisiert und reproduzierbar. Sie hängt nicht von den unterschiedlichen Fähigkeiten oder der Tagesform der behandelnden Ärzt:innen ab. Stattdessen liefert sie gleichbleibend gute Ergebnisse und ermüdet im Gegensatz zum menschlichen Gehirn nicht.,"['intro_3', 'z_trans_2', 'Z.P2']","[(0, 14), (14, 55), (55, 336)]"
522,20230130_123829_086705,12,user,Es wäre trotzdem nicht möglich sie an vielen Stellen einzusetzen,['Z.P1-2'],"[(0, 65)]"
523,20230130_123829_086705,13,bot,"Ich bin mir nicht sicher, was du genau meinst. Kannst du das anders formulieren?",['intro_61'],"[(0, 81)]"
524,20230130_123829_086705,14,user,Es ist nicht möglich die KI aufgrund von Geldmangel überall einzusetzen,['Z.P1-2'],"[(0, 72)]"
525,20230130_123829_086705,15,bot,"Das verstehe ich. Um auch noch einmal eine andere Seite zu beleuchten: Ärztliche Leistungen werden immer mehr nachgefragt, sowohl wegen höheren Ansprüchen als auch der Alterung der Gesellschaft. Die medKIs sind notwendig, um den steigenden Bedarf qualitativ hochwertig zu befriedigen, insbesondere auch auf dem Land.","['intro_1', 'z_trans_13', 'Z.P4']","[(0, 18), (18, 71), (71, 317)]"
526,20230130_123829_086705,16,user,Es müssten Produktionsstätten für die KIs gebaut werden,['Z.P1-2'],"[(0, 56)]"
527,20230130_123829_086705,17,bot,"Ich bin mir nicht sicher, was du genau meinst. Kannst du das anders ausdrücken?",['intro_62'],"[(0, 80)]"
528,20230130_123829_086705,18,user,Um die KI zu bauen müssten große Produktionen erschaffen werden,['Z.P1-2'],"[(0, 64)]"
529,20230130_123829_086705,19,bot,"Das mag sein. Um auch noch einmal eine andere Seite zu beleuchten: Patient:innen haben ein Recht auf die neuesten evidenzbasierten Empfehlungen hinsichtlich ihrer Diagnostik und Therapie, was durch eine medKI gewährleistet ist. Das ist bei Ärzt:innen, die sich neben ihrem stressigen Job mühsam weiterbilden müssen, nicht immer gewährleistet.","['intro_3', 'z_trans_13', 'Z.P3']","[(0, 14), (14, 67), (67, 343)]"
530,20230130_123829_086705,20,user,Die KI bräuchte viel Strom welchen wir momentan nicht haben,['Z.P1-2'],"[(0, 60)]"
531,20230130_123829_086705,21,bot,"Ich bin mir nicht sicher, was du genau meinst. Kannst du das anders ausdrücken?",['intro_62'],"[(0, 80)]"
532,20230130_123829_086705,22,user,Die KI braucht viel Strom,['Z.P1-2'],"[(0, 26)]"
533,20230130_123829_086705,23,bot,"Das verstehe ich. Ansprechen möchte ich noch: Die Aus- und Weiterbildung von Ärzt:innen ist sehr teuer. MedKIs entlasten sie bezüglich medizinischem Fachwissen, machen sie aber nicht überflüssig, da sie für Untersuchungen und Gespräche weiterhin notwendig sind. Insgesamt ist das Szenario kostengünstiger - bei höherer Qualität der Behandlung.","['intro_1', 'z_trans_11', 'Z.P5']","[(0, 18), (18, 46), (46, 344)]"
534,20230130_113523_693108,0,user,Da diese ärtzte nur unterstützen sollte da die Ki immer eine Fehlerquote hat,['NZ.K10'],"[(0, 76)]"
535,20230130_113523_693108,1,bot,"Du sagst, dass KI nur unterstützend tätig sein sollte. Das ist eher unwahrscheinlich. Die Unterstützung von Ärzten durch KI ist  ethisch relativ unproblematisch und findet bereits heute Anwendung. Allerdings wollen wir hier die weitergehende Frage diskutieren, ob eine KI auch die Entscheidungen von Ärzten ersetzen kann. Darüber hinaus finde ich, dass hier noch folgendes beachtet werden sollte: Eine medKI wäre rund um die Uhr erreichbar; in der Nacht oder am Wochenende, wenn auch nur in einer Notbesetzung mit medizinischem Hilfspersonal. Das ließe sich ohne medKI sonst nur in großen Kliniken sicherstellen und wäre auf dem Land nicht möglich.","['intro_27', 'NZ.K10', 'intro_7', 'NZ.K10-1', 'z_trans_1', 'Z.P1']","[(0, 15), (15, 55), (55, 86), (86, 322), (322, 397), (397, 649)]"
536,20230130_113523_693108,2,user,Ja für ungefährliche Krankheiten wäre das gut geeignet dennoch besteht die Gefahr das gefährliche Krankheiten nicht erkannt werden,['Z.K15'],"[(0, 130)]"
537,20230130_113523_693108,3,bot,"Ich bin mir nicht sicher, was du genau meinst. Kannst du das anders formulieren?",['intro_61'],"[(0, 81)]"
538,20230130_113523_693108,4,user,Gefährliche Krankheiten werden dann nicht erkannt,['Z.K15'],"[(0, 49)]"
539,20230130_113523_693108,5,bot,Das mag sein. Aber hast Du schon einmal daran gedacht: Die Anwendung einer medKI ist standardisiert und reproduzierbar. Sie hängt nicht von den unterschiedlichen Fähigkeiten oder der Tagesform der behandelnden Ärzt:innen ab. Stattdessen liefert sie gleichbleibend gute Ergebnisse und ermüdet im Gegensatz zum menschlichen Gehirn nicht.,"['intro_3', 'z_trans_2', 'Z.P2']","[(0, 14), (14, 55), (55, 336)]"
540,20230130_113523_693108,6,user,Ja aber nein,['OTHER'],"[(0, 12)]"
541,20230130_113523_693108,7,bot,"Ich bin mir nicht sicher, was du genau meinst. Kannst du das anders ausdrücken?",['intro_62'],"[(0, 80)]"
542,20230130_113523_693108,8,user,Dennoch kann die Ki den Menschen nicht abtasten,['Z.P1-1'],"[(0, 47)]"
543,20230130_113523_693108,9,bot,"Das verstehe ich. Aber hast Du schon einmal daran gedacht: Ärztliche Leistungen werden immer mehr nachgefragt, sowohl wegen höheren Ansprüchen als auch der Alterung der Gesellschaft. Die medKIs sind notwendig, um den steigenden Bedarf qualitativ hochwertig zu befriedigen, insbesondere auch auf dem Land.","['intro_1', 'z_trans_2', 'Z.P4']","[(0, 18), (18, 59), (59, 305)]"
544,20230130_120016_447210,0,user,Einfühlsamkeit,['Z.K1'],"[(0, 15)]"
545,20230130_120016_447210,1,bot,"Dein Argument ist, dass die medKI unpersönlicher ist. Das ist im Szenario bereits berücksichtigt: Eine medKI trifft nur Entscheidungen, menschliche Zuwendung wird nach wie vor durch psychologisch geschultes medizinisches Fachpersonal gewährleistet, auf Patient:innen-Wunsch auch feste Vertrauenspersonen. Daher ist eher eine Zunahme an psychischem Beistand zu erwarten.","['intro_25', 'Z.K1', 'intro_56', 'Z.K1-1']","[(0, 24), (24, 54), (54, 98), (98, 370)]"
546,20230130_120016_447210,2,user,Nicht zu 100% passend auf Situationen anwendbar,['Z.K2'],"[(0, 47)]"
547,20230130_120016_447210,3,bot,"Ich bin mir nicht sicher, was du genau meinst. Kannst du das anders formulieren?",['intro_61'],"[(0, 81)]"
548,20230130_120016_447210,4,user,Variabilität Umstände,['Z.K2'],"[(0, 21)]"
549,20230130_120016_447210,5,bot,"Das ist möglich. Um auch noch einmal eine andere Seite zu beleuchten: Eine medKI wäre rund um die Uhr erreichbar; in der Nacht oder am Wochenende, wenn auch nur in einer Notbesetzung mit medizinischem Hilfspersonal. Das ließe sich ohne medKI sonst nur in großen Kliniken sicherstellen und wäre auf dem Land nicht möglich.","['intro_2', 'z_trans_13', 'Z.P1']","[(0, 17), (17, 70), (70, 322)]"
550,20230130_120016_447210,6,user,Zu unpräzise,['Z.K6'],"[(0, 12)]"
551,20230130_120016_447210,7,bot,"Ich bin mir nicht sicher, was du genau meinst. Kannst du das anders ausdrücken?",['intro_62'],"[(0, 80)]"
552,20230130_120016_447210,8,user,Beobachtung nicht präzise,['Z.K6'],"[(0, 25)]"
553,20230130_120016_447210,9,bot,Das mag sein. Aber hast Du schon einmal daran gedacht: Die Anwendung einer medKI ist standardisiert und reproduzierbar. Sie hängt nicht von den unterschiedlichen Fähigkeiten oder der Tagesform der behandelnden Ärzt:innen ab. Stattdessen liefert sie gleichbleibend gute Ergebnisse und ermüdet im Gegensatz zum menschlichen Gehirn nicht.,"['intro_3', 'z_trans_2', 'Z.P2']","[(0, 14), (14, 55), (55, 336)]"
554,20230130_120016_447210,10,user,Systemfehler,['Z.K4'],"[(0, 12)]"
555,20230130_120016_447210,11,bot,"Mit anderen Worten, Fehler der medKI multiplizieren sich. Das stimmt, allerdings ist es nicht sehr wahrscheinlich. Fehler lassen sich in der Medizin nicht vermeiden. Eine medKI ist aber ein lernendes System und wird auf Dauer Strukturfehler korrigieren. Darin ist sie Menschen überlegen, da sie aus sehr vielen Fällen lernen kann.","['intro_32', 'Z.K4', 'intro_59', 'Z.K4-1']","[(0, 20), (20, 58), (58, 115), (115, 331)]"
556,20230130_120016_447210,12,user,Kann gehäckt werden,['Z.K9'],"[(0, 19)]"
557,20230130_120016_447210,13,bot,"Ich bin mir nicht sicher, was du genau meinst. Kannst du das anders formulieren?",['intro_61'],"[(0, 81)]"
558,20230130_120016_447210,14,user,Lebennotwendige Entscheidungen,['OTHER'],"[(0, 30)]"
559,20230130_120016_447210,15,bot,"Das mag sein. Aber hast Du schon einmal daran gedacht: Ärztliche Leistungen werden immer mehr nachgefragt, sowohl wegen höheren Ansprüchen als auch der Alterung der Gesellschaft. Die medKIs sind notwendig, um den steigenden Bedarf qualitativ hochwertig zu befriedigen, insbesondere auch auf dem Land.","['intro_3', 'z_trans_2', 'Z.P4']","[(0, 14), (14, 55), (55, 301)]"
560,20230130_120016_447210,16,user,Ethisch unmoralisch,['CON_NZARG'],"[(0, 19)]"
561,20230130_120016_447210,17,bot,"Ich bin mir nicht sicher, was du genau meinst. Kannst du das anders formulieren?",['intro_61'],"[(0, 81)]"
562,20230130_120016_447210,18,user,Ethik,['OTHER'],"[(0, 5)]"
563,20230130_120016_447210,19,bot,"Das verstehe ich. Aber hast Du schon einmal daran gedacht: Patient:innen haben ein Recht auf die neuesten evidenzbasierten Empfehlungen hinsichtlich ihrer Diagnostik und Therapie, was durch eine medKI gewährleistet ist. Das ist bei Ärzt:innen, die sich neben ihrem stressigen Job mühsam weiterbilden müssen, nicht immer gewährleistet.","['intro_1', 'z_trans_2', 'Z.P3']","[(0, 18), (18, 59), (59, 335)]"
564,20230130_112745_782979,0,user,"Das Wissen einer KI kann eine deutlich höhere Menge erreichen, als das Wissen eines Menschen.",['Z.P3'],"[(0, 94)]"
565,20230130_112745_782979,1,bot,"Ich bin mir nicht sicher, was du genau meinst. Kannst du das anders formulieren?",['intro_61'],"[(0, 81)]"
566,20230130_112745_782979,2,user,Eine KI kann mehr Wissen als ein Mensch,['Z.P3'],"[(0, 39)]"
