Unnamed: 0,dialogue,utterance_id,utterance_type,utterance_text,labels,bounds
808,20230130_120124_151956,2,user,Die Vermittlung der Diagnose sollte durch einen Menschen stattfinden.,['Z.K5-1'],"[(0, 69)]"
809,20230130_120124_151956,3,bot,"Das verstehe ich. Um auch noch einmal eine andere Seite zu beleuchten: Eine medKI wäre rund um die Uhr erreichbar; in der Nacht oder am Wochenende, wenn auch nur in einer Notbesetzung mit medizinischem Hilfspersonal. Das ließe sich ohne medKI sonst nur in großen Kliniken sicherstellen und wäre auf dem Land nicht möglich.","['intro_1', 'z_trans_13', 'Z.P1']","[(0, 18), (18, 71), (71, 323)]"
810,20230130_120124_151956,4,user,Trotzdem fehlt der künstlichen Intelligenz die Empathie.,['Z.K7'],"[(0, 56)]"
811,20230130_120124_151956,5,bot,"Du argumentierst, dass die medKI kein Einfühlungsvermögen zB für verzweifelte Patient:innen hat. Das ist im Szenario bereits berücksichtigt: Da der medKI echtes Einfühlungsvermögen fehlt, sollte das medizinische Fachpersonal in den Untersuchungszentren die Kommunikation insbesondere bei schwierigen Situationen übernehmen.","['intro_26', 'Z.K7', 'intro_56', 'Z.K7-1']","[(0, 23), (23, 97), (97, 141), (141, 324)]"
812,20230130_120124_151956,6,user,Und Arbeitsplätze gehen verloren und Menschen müssen sich langweilen und müssen einen Job machen der ihnen keinen Spaß macht.,['Z.K14'],"[(0, 125)]"
813,20230130_120124_151956,7,bot,"Ich bin mir nicht sicher, was du genau meinst. Kannst du das anders ausdrücken?",['intro_62'],"[(0, 80)]"
814,20230130_120124_151956,8,user,Ich habe mich deutlich ausgedrückt,['OTHER'],"[(0, 35)]"
815,20230130_120124_151956,9,bot,Das verstehe ich. Aber zu beachten ist: Die Anwendung einer medKI ist standardisiert und reproduzierbar. Sie hängt nicht von den unterschiedlichen Fähigkeiten oder der Tagesform der behandelnden Ärzt:innen ab. Stattdessen liefert sie gleichbleibend gute Ergebnisse und ermüdet im Gegensatz zum menschlichen Gehirn nicht.,"['intro_1', 'z_trans_12', 'Z.P2']","[(0, 18), (18, 40), (40, 321)]"
816,20230130_120124_151956,10,user,Ich bin deutsche Muttersprachlerin,['OTHER'],"[(0, 34)]"
817,20230130_120124_151956,11,bot,"Ich bin mir nicht sicher, was du genau meinst. Kannst du das anders formulieren?",['intro_61'],"[(0, 81)]"
818,20230130_120124_151956,12,user,Künstliche Intelligenz ist ausschließlich zum putzen geeignet!,['OTHER'],"[(0, 62)]"
819,20230130_120124_151956,13,bot,"Das ist möglich. Aber zu beachten ist: Ärztliche Leistungen werden immer mehr nachgefragt, sowohl wegen höheren Ansprüchen als auch der Alterung der Gesellschaft. Die medKIs sind notwendig, um den steigenden Bedarf qualitativ hochwertig zu befriedigen, insbesondere auch auf dem Land.","['intro_2', 'z_trans_12', 'Z.P4']","[(0, 17), (17, 39), (39, 285)]"
820,20230130_120124_151956,14,user,Dann sollen die Unis mehr Medizin Plätze anbieten dann gibt es mehr Ärzte,['Z.P4-1'],"[(0, 73)]"
821,20230130_120124_151956,15,bot,"Ich bin mir nicht sicher, was du genau meinst. Kannst du das anders ausdrücken?",['intro_62'],"[(0, 80)]"
822,20230130_121831_808939,0,user,"Da die Med-KI keine individuellen Diagnosen stellen kann, sondern anhand von Lehrbuchangaben agiert und das Verhalten und die Aussagen der patient*innen nur objektiv betrachtet",['Z.K2'],"[(0, 176)]"
823,20230130_121831_808939,1,bot,"Ich bin mir nicht sicher, was du genau meinst. Kannst du das anders formulieren?",['intro_61'],"[(0, 81)]"
824,20230130_121831_808939,2,user,Diagnosen werden nur objektiv gestellt,['Z.K2'],"[(0, 38)]"
825,20230130_121831_808939,3,bot,"Das ist möglich. Um auch noch einmal eine andere Seite zu beleuchten: Eine medKI wäre rund um die Uhr erreichbar; in der Nacht oder am Wochenende, wenn auch nur in einer Notbesetzung mit medizinischem Hilfspersonal. Das ließe sich ohne medKI sonst nur in großen Kliniken sicherstellen und wäre auf dem Land nicht möglich.","['intro_2', 'z_trans_13', 'Z.P1']","[(0, 17), (17, 70), (70, 322)]"
826,20230130_121831_808939,4,user,Das ist natürlich richtig,['CONSENT'],"[(0, 25)]"
827,20230130_121831_808939,5,bot,"Ich bin mir nicht sicher, was du genau meinst. Kannst du das anders ausdrücken?",['intro_62'],"[(0, 80)]"
828,20230130_121831_808939,6,user,Aber trotzdem ist besonders im medizinischen Bereich eine genaue Betrachtung des Patienten notwendig ist,['Z.K2'],"[(0, 104)]"
829,20230130_121831_808939,7,bot,Das verstehe ich. Ansprechen möchte ich noch: Die Anwendung einer medKI ist standardisiert und reproduzierbar. Sie hängt nicht von den unterschiedlichen Fähigkeiten oder der Tagesform der behandelnden Ärzt:innen ab. Stattdessen liefert sie gleichbleibend gute Ergebnisse und ermüdet im Gegensatz zum menschlichen Gehirn nicht.,"['intro_1', 'z_trans_11', 'Z.P2']","[(0, 18), (18, 46), (46, 327)]"
830,20230130_121831_808939,8,user,Vorteil ist natürlich die Erreichbarkeit und das unparteiische Verhalten gegenüber der Patienten,"['Z.P1', 'Z.P2']","[(0, 40), (40, 96)]"
831,20230130_121831_808939,9,bot,"Du argumentierst, dass die medKI zusätzliches medizinisches Fachpersonal benötigt. Das verstehe ich. Direkt dazu: Das Berufsbild des medizinischen Fachpersonal wird durch die medKI aufgewertet, da es weniger von Ärzt*innen abhängig ist und sich vollständig auf die Patient*innen konzentrieren kann, und daher voraussichtlich häufiger gewählt.","['intro_26', 'Z.P1-1', 'intro_51', 'Z.P1-1-1']","[(0, 23), (23, 83), (83, 114), (114, 345)]"
832,20230130_121831_808939,10,user,Aber die subjektive Betrachtung ist in der Medizin sehr notwendig,['Z.K2'],"[(0, 65)]"
833,20230130_121831_808939,11,bot,"Ich bin mir nicht sicher, was du genau meinst. Kannst du das anders formulieren?",['intro_61'],"[(0, 81)]"
834,20230130_121831_808939,12,user,Die individuelle Betrachtung durch das Fachpersonal ist notwendig,['Z.K2-4'],"[(0, 65)]"
835,20230130_121831_808939,13,bot,"Das verstehe ich. Ansprechen möchte ich noch: Ärztliche Leistungen werden immer mehr nachgefragt, sowohl wegen höheren Ansprüchen als auch der Alterung der Gesellschaft. Die medKIs sind notwendig, um den steigenden Bedarf qualitativ hochwertig zu befriedigen, insbesondere auch auf dem Land.","['intro_1', 'z_trans_11', 'Z.P4']","[(0, 18), (18, 46), (46, 292)]"
836,20230130_121831_808939,14,user,Was passiert mit den Studenten,['OTHER'],"[(0, 30)]"
837,20230130_121831_808939,15,bot,"Ich bin mir nicht sicher, was du genau meinst. Kannst du das anders ausdrücken?",['intro_62'],"[(0, 80)]"
838,20230130_121831_808939,16,user,Sie nehmen stellen weg,['Z.K14'],"[(0, 23)]"
839,20230130_121831_808939,17,bot,"Das verstehe ich. Ansprechen möchte ich noch: Patient:innen haben ein Recht auf die neuesten evidenzbasierten Empfehlungen hinsichtlich ihrer Diagnostik und Therapie, was durch eine medKI gewährleistet ist. Das ist bei Ärzt:innen, die sich neben ihrem stressigen Job mühsam weiterbilden müssen, nicht immer gewährleistet.","['intro_1', 'z_trans_11', 'Z.P3']","[(0, 18), (18, 46), (46, 322)]"
840,20230130_121831_808939,18,user,Aber Fortbildungen sind wichtig,['OTHER'],"[(0, 31)]"
841,20230130_121831_808939,19,bot,"Du argumentierst, dass die Weiterentwicklung der medKI fehleranfällig ist. Das verstehe ich. Die Fachärzt:innen und Informatiker:innen, die die Weiterentwicklung der medKI steuern, können sie sich vollständig darauf konzentrieren. Dies führt zu weniger Fehlern, als eine nebenberufliche Weiterbildung von Ärzt:innen.","['intro_26', 'Z.P3-1', 'intro_1', 'Z.P3-1-1']","[(0, 23), (23, 75), (75, 93), (93, 317)]"
842,20230130_114709_656689,0,user,"Um Patienten richtig behandeln zu können, muss der Arzt wichtige Entscheidungen treffen, welche womöglich über Leben und Tod entscheiden. Dazu ist nur ein Mensch in der Lage, welcher sich in die Lage des Patienten versetzen kann.",['Z.K7'],"[(0, 229)]"
843,20230130_114709_656689,1,bot,"Du meinst also, dass technische, tödliche Fehler der medKI prinzipiell nicht hinnehmbar sind. Das ist ein gutes Argument. Direkt dazu: Bei Ärzt:innen besteht jedoch das gleiche Problem. In der Medizin gibt es keine Garantien, sondern nur Abwägungen zwischen Risiken und Nutzen von Behandlungen. Zu hohe Ansprüche an die medKI würden deren Einsatz blockieren - zum Schaden der Patient:innen.","['intro_23', 'Z.K11', 'intro_47', 'Z.K11-1']","[(0, 21), (21, 94), (94, 135), (135, 391)]"
844,20230130_114709_656689,2,user,"KIs können bei der Behandlung objektiv die besten Entscheidungen treffen, doch das allein ist nicht genug um mit einem Arzt gleichgestellt zu werden. Was jedoch eine gute Lösung wäre, ist dass beide zusammen arbeiten.",['NZ.K10'],"[(0, 217)]"
845,20230130_114709_656689,3,bot,"Ich bin mir nicht sicher, was du genau meinst. Kannst du das anders formulieren?",['intro_61'],"[(0, 81)]"
846,20230130_114709_656689,4,user,"Die KIs sollten keine Einschränkungen im Sinn von Behandlugsmöglichkeiten haben, jedoch sollten die Ärzte die Leitung der Behandlung übernehmen können um so Fehler der KI zu stoppen.",['NZ.K10'],"[(0, 182)]"
847,20230130_114709_656689,5,bot,"Das mag sein. Um auch noch einmal eine andere Seite zu beleuchten: Eine medKI wäre rund um die Uhr erreichbar; in der Nacht oder am Wochenende, wenn auch nur in einer Notbesetzung mit medizinischem Hilfspersonal. Das ließe sich ohne medKI sonst nur in großen Kliniken sicherstellen und wäre auf dem Land nicht möglich.","['intro_3', 'z_trans_13', 'Z.P1']","[(0, 14), (14, 67), (67, 319)]"
848,20230130_114709_656689,6,user,"Das stimmt, in diesem Sinn würden medKIs eine große Hilfe darstellen. Das ändert jedoch nichts daran, dass viele Patienten sich nicht von einer KI behandeln lassen wollen.","['CONSENT', 'Z.K10']","[(0, 70), (70, 171)]"
849,20230130_114709_656689,7,bot,"Ich bin mir nicht sicher, was du genau meinst. Kannst du das anders ausdrücken?",['intro_62'],"[(0, 80)]"
850,20230130_114709_656689,8,user,"Ärzte sind doch auch Rund um die Uhr erreichbar?! Dafür werden Sie auch dementsprechend bezahlt. Auf dem Land natürlich nicht, aber eine KI könnte auch nicht ohne Beaufsichtigung das Krankenhaus leiten",['Z.P1'],"[(0, 201)]"
851,20230130_114709_656689,9,bot,Das verstehe ich. Um auch noch einmal eine andere Seite zu beleuchten: Die Anwendung einer medKI ist standardisiert und reproduzierbar. Sie hängt nicht von den unterschiedlichen Fähigkeiten oder der Tagesform der behandelnden Ärzt:innen ab. Stattdessen liefert sie gleichbleibend gute Ergebnisse und ermüdet im Gegensatz zum menschlichen Gehirn nicht.,"['intro_1', 'z_trans_13', 'Z.P2']","[(0, 18), (18, 71), (71, 352)]"
852,20230130_114709_656689,10,user,Das ist wahr. Allerdings werden die KIs von Menschen programmiert. Insofern ist die Fehlerquote mindestens genauso hoch.,"['CONSENT', 'Z.P3-1']","[(0, 13), (13, 120)]"
853,20230130_114709_656689,11,bot,"Ich bin mir nicht sicher, was du genau meinst. Kannst du das anders ausdrücken?",['intro_62'],"[(0, 80)]"
854,20230130_122823_887607,0,user,"Für mich sollte ein Arzt ein gewisses Maß an Empathie besitzen. Ich befürchte, dass ein medKI dazu nicht in der Lage ist.",['Z.K7'],"[(0, 121)]"
855,20230130_122823_887607,1,bot,"Kurz zusammengefasst, die medKI hat kein Einfühlungsvermögen zB für verzweifelte Patient:innen. Darauf geht unser Szenario wie folgt ein: Da der medKI echtes Einfühlungsvermögen fehlt, sollte das medizinische Fachpersonal in den Untersuchungszentren die Kommunikation insbesondere bei schwierigen Situationen übernehmen.","['intro_24', 'Z.K7', 'intro_55', 'Z.K7-1']","[(0, 22), (22, 96), (96, 138), (138, 321)]"
856,20230130_122823_887607,2,user,Dann sollte der Robotor aber grundsätzlich keinen Patienten alleine behandeln. Er sollte eher eine Unterstützung für den Arzt sein.,['NZ.K10'],"[(0, 131)]"
857,20230130_122823_887607,3,bot,"Du sagst, dass die medKI unpersönlicher ist. Darauf geht unser Szenario wie folgt ein: Eine medKI trifft nur Entscheidungen, menschliche Zuwendung wird nach wie vor durch psychologisch geschultes medizinisches Fachpersonal gewährleistet, auf Patient:innen-Wunsch auch feste Vertrauenspersonen. Daher ist eher eine Zunahme an psychischem Beistand zu erwarten.","['intro_27', 'Z.K1', 'intro_55', 'Z.K1-1']","[(0, 15), (15, 45), (45, 87), (87, 359)]"
858,20230130_122823_887607,4,user,Dies wäre eine gute Umsetzung. Aber wieso sollte man Ärzte nicht dennoch als Hauptakteur einsetzen und nur den medKI als Unterstützung?,"['CONSENT', 'NZ.K10']","[(0, 31), (31, 135)]"
859,20230130_122823_887607,5,bot,"Dein Argument ist, dass KI nur unterstützend tätig sein sollte. Ich denke damit liegst du nicht richtig. Die Unterstützung von Ärzten durch KI ist  ethisch relativ unproblematisch und findet bereits heute Anwendung. Allerdings wollen wir hier die weitergehende Frage diskutieren, ob eine KI auch die Entscheidungen von Ärzten ersetzen kann. Darüber hinaus finde ich, dass hier noch folgendes beachtet werden sollte: Eine medKI wäre rund um die Uhr erreichbar; in der Nacht oder am Wochenende, wenn auch nur in einer Notbesetzung mit medizinischem Hilfspersonal. Das ließe sich ohne medKI sonst nur in großen Kliniken sicherstellen und wäre auf dem Land nicht möglich.","['intro_25', 'NZ.K10', 'intro_10', 'NZ.K10-1', 'z_trans_1', 'Z.P1']","[(0, 24), (24, 64), (64, 105), (105, 341), (341, 416), (416, 668)]"
860,20230130_122823_887607,6,user,Das wäre eine gute Idee. Aber würden Ärzte dann komplett abgeschafft werden?,"['CONSENT', 'Z.K14']","[(0, 25), (25, 76)]"
861,20230130_122823_887607,7,bot,"Ich bin mir nicht sicher, was du genau meinst. Kannst du das anders formulieren?",['intro_61'],"[(0, 81)]"
862,20230130_122823_887607,8,user,Gäbe es dann noch menschliche Ärzte bzw. Mediziner?,['Z.K14'],"[(0, 51)]"
863,20230130_122823_887607,9,bot,Das ist möglich. Aber zu beachten ist: Die Anwendung einer medKI ist standardisiert und reproduzierbar. Sie hängt nicht von den unterschiedlichen Fähigkeiten oder der Tagesform der behandelnden Ärzt:innen ab. Stattdessen liefert sie gleichbleibend gute Ergebnisse und ermüdet im Gegensatz zum menschlichen Gehirn nicht.,"['intro_2', 'z_trans_12', 'Z.P2']","[(0, 17), (17, 39), (39, 320)]"
864,20230130_122823_887607,10,user,Einige Menschen würde die Möglichkeit verwehrt bleiben Mediziner zu werden. Für einige ist das ein Traumberuf. Sie hätten keine Berufung mehr.,['Z.K14'],"[(0, 142)]"
865,20230130_122823_887607,11,bot,"Ich bin mir nicht sicher, was du genau meinst. Kannst du das anders ausdrücken?",['intro_62'],"[(0, 80)]"
866,20230130_122823_887607,12,user,Mediziner hätten keinen Job mehr.,['Z.K14'],"[(0, 33)]"
867,20230130_122823_887607,13,bot,"Das mag sein. Um auch noch einmal eine andere Seite zu beleuchten: Ärztliche Leistungen werden immer mehr nachgefragt, sowohl wegen höheren Ansprüchen als auch der Alterung der Gesellschaft. Die medKIs sind notwendig, um den steigenden Bedarf qualitativ hochwertig zu befriedigen, insbesondere auch auf dem Land.","['intro_3', 'z_trans_13', 'Z.P4']","[(0, 14), (14, 67), (67, 313)]"
868,20230130_122823_887607,14,user,Kann es nicht Ärzte und medKI geben? Der medKI könnte das fehlende menschliche Personal ausgleichen. Dennoch könnten Ärzte zusätzlich tätig sein.,['NZ.K10'],"[(0, 145)]"
869,20230130_122823_887607,15,bot,"Du argumentierst, dass die medKI zusätzliches medizinisches Fachpersonal benötigt. Das verstehe ich. Andererseits: Das Berufsbild des medizinischen Fachpersonal wird durch die medKI aufgewertet, da es weniger von Ärzt*innen abhängig ist und sich vollständig auf die Patient*innen konzentrieren kann, und daher voraussichtlich häufiger gewählt.","['intro_26', 'Z.P1-1', 'intro_50', 'Z.P1-1-1']","[(0, 23), (23, 83), (83, 115), (115, 346)]"
870,20230130_122823_887607,16,user,Was würde mit bereits arbeitenden Medizinern passieren? Wären sie arbeitslos?,['Z.K14'],"[(0, 77)]"
871,20230130_122823_887607,17,bot,"Ich bin mir nicht sicher, was du genau meinst. Kannst du das anders formulieren?",['intro_61'],"[(0, 81)]"
872,20230130_122823_887607,18,user,Wäre der medKI in einer menschlichen Gestalt wie ein Androide oder nur auf einem Display?,['FAQ.G1'],"[(0, 89)]"
873,20230130_122823_887607,19,bot,"Das verstehe ich. Um auch noch einmal eine andere Seite zu beleuchten: Patient:innen haben ein Recht auf die neuesten evidenzbasierten Empfehlungen hinsichtlich ihrer Diagnostik und Therapie, was durch eine medKI gewährleistet ist. Das ist bei Ärzt:innen, die sich neben ihrem stressigen Job mühsam weiterbilden müssen, nicht immer gewährleistet.","['intro_1', 'z_trans_13', 'Z.P3']","[(0, 18), (18, 71), (71, 347)]"
874,20230130_122823_887607,20,user,"Der medKI wäre meiner Meinung nach z.B. nicht als Frauenarzt geeignet. Diese sind viel an Untersuchungen gebunden, die sie selbst durchführen müssen. Da hilft nicht nur reden.",['CON_ZARG'],"[(0, 175)]"
875,20230130_122823_887607,21,bot,"Ich bin mir nicht sicher, was du genau meinst. Kannst du das anders ausdrücken?",['intro_62'],"[(0, 80)]"
876,20230130_121325_598225,0,user,"kI ist sehr sicher, man kann viele Informationen vergleichen und unterschiedliche Quellen hinzuziehen. Das ermöglicht eine sehr genaue aussage",['Z.P6'],"[(0, 142)]"
877,20230130_121325_598225,1,bot,"Dir scheint also unklar zu sein, wie KI an Daten über Patient:innen gelangt. Die KI erhält Hilfe durch medizinisches Personal, welches sie instruiert. Beispielsweise wird das Personal angewiesen Patient:innen nach ihrer Lebenssituation zu befragen oder bestimmte standardisierte Untersuchungen vorzunehmen. Auf Grundlage der erhaltenen Daten fällt die KI ihre Entscheidungen. Was denkst du denn darüber: Eine medKI kann zwar den Ärztemangel lindern, aber dafür wird mehr medizinisches Fachpersonal (u.a.  Pflegeberufe, Praxishelfer:innen, medizinische Fachassistent:innnen usw.) einschl. neuer, ähnlicher Berufsbilder benötigt.","['intro_38', 'FAQ.1', 'FAQ.1-1', 'faq_trans_2', 'Z.P1-1']","[(0, 33), (33, 77), (77, 376), (376, 404), (404, 629)]"
878,20230130_121325_598225,2,user,"Ja das stimmt. Aber dann können die Menschen, die bisher als ärzte gearbeitet haben, jetzt als medizinisches Fachpersonal arbeiten","['CONSENT', 'Z.K14-1']","[(0, 15), (15, 130)]"
879,20230130_121325_598225,3,bot,"Kurz zusammengefasst, Das Berufsbild des Medizinisches Fachpersonals wird aufgewertet. Ich denke damit liegst du richtig. Darüber hinaus finde ich, dass hier noch folgendes beachtet werden sollte: Eine rund um die Uhr erreichbare medKI wäre allerdings sehr teuer, da in dem Untersuchungszentrum viel medizinisches Personal erforderlich ist.","['intro_24', 'Z.P1-1-1', 'intro_5', 'z_trans_1', 'Z.P1-2']","[(0, 22), (22, 87), (87, 122), (122, 197), (197, 341)]"
880,20230130_121325_598225,4,user,Das stimmt. Aber wieso braucht man denn wirklich rund um die Uhr die ki? Hausärzte sind ja auch nicht rund um die Uhr zu erreichen,"['CONSENT', 'Z.P1-2']","[(0, 12), (12, 130)]"
881,20230130_121325_598225,5,bot,"Mit anderen Worten, die medKI verbessert die medizinische Versorgung. Das kann ich nachvollziehen. Aber zu beachten ist: Wenn Fehler vom Fachpersonal in den Datenerhebungszentren gemacht werden, kommt die medKI zu falschen Schlussfolgerungen. Daher kann man sich auf die Entscheidungen nicht verlassen.","['intro_32', 'Z.P1', 'intro_53', 'z_trans_12', 'Z.K18']","[(0, 20), (20, 70), (70, 99), (99, 121), (121, 303)]"
882,20230130_121325_598225,6,user,"Ja aber diese Fehler würden doch auch entstehen, wenn es die ki nicht gäbe und die fachärzte die falschen Entscheidungen am Patienten treffen würden",['Z.K15-1'],"[(0, 148)]"
883,20230130_121325_598225,7,bot,"Ich bin mir nicht sicher, was du genau meinst. Kannst du das anders formulieren?",['intro_61'],"[(0, 81)]"
884,20230130_121325_598225,8,user,Naja ob die fachärzte in einem kämmerchen sitzen und die ki falsch programmieren und deshalb die ki dann falsche Entscheidungen trifft oder ob der Arzt am Patienten die Fehlentscheidung trifft ist ja egal,['Z.K15-1'],"[(0, 204)]"
885,20230130_121325_598225,9,bot,"Das verstehe ich. Um auch noch einmal eine andere Seite zu beleuchten: Patient:innen sind bei schwerwiegenden medizinischen Entscheidungen keine rationalen Entscheider:innen. Die Berücksichtigung ihrer Gefühlslage, bis hin zur Verzweiflung, ist essentiell. Hier stößt eine medKI an ihre Grenzen, da ihr echtes Einfühlungsvermögen gänzlich fehlt.","['intro_1', 'z_trans_13', 'Z.K7']","[(0, 18), (18, 71), (71, 346)]"
886,20230130_121325_598225,10,user,Da hast du Recht. Das ist ein Argument gegen die ki,['CONSENT'],"[(0, 51)]"
887,20230130_121325_598225,11,bot,"Ich bin mir nicht sicher, was du genau meinst. Kannst du das anders ausdrücken?",['intro_62'],"[(0, 80)]"
888,20230130_121325_598225,12,user,Vielleicht kann man die KI emotional intelligent trainieren,['OTHER'],"[(0, 59)]"
889,20230130_121325_598225,13,bot,"Das ist möglich. Um auch noch einmal eine andere Seite zu beleuchten: MedKIs führen dazu, dass Patient:innen alleine bleiben, weil sie keine menschliche Zuwendung bekommen. Persönlicher Kontakt mit Ärzt:innen und aufmunternder Zuspruch kann schon zu einer Verbesserung des Zustands beitragen.","['intro_2', 'z_trans_13', 'Z.K1']","[(0, 17), (17, 70), (70, 293)]"
890,20230130_121325_598225,14,user,Da hast du Recht. Vielleicht könnte man eine Mischung aus medki und ärzten durchsetzen,"['CONSENT', 'NZ.K10']","[(0, 18), (18, 86)]"
891,20230130_121325_598225,15,bot,"Ich bin mir nicht sicher, was du genau meinst. Kannst du das anders ausdrücken?",['intro_62'],"[(0, 80)]"
892,20230130_121325_598225,16,user,"Falls es mängel an ärzten gibt, kann man mit medki arbeiten, aber auch der menschliche Kontakt ist wichtig. Also eine Mischung aus beidem",['NZ.K10'],"[(0, 137)]"
893,20230130_121325_598225,17,bot,Das verstehe ich. Aber zu beachten ist: Eine medKI kann nicht alle Lebensumstände der Patient:innen in die Untersuchung mit einbeziehen. Das Umfeld und die Lebenssituation der Patient:innen können jedoch für die Diagnostik und die passende Therapieentscheidung enorm wichtig sein.,"['intro_1', 'z_trans_12', 'Z.K2']","[(0, 18), (18, 40), (40, 281)]"
894,20230130_121325_598225,18,user,Wieso kann das die medki nicht?,['FAQ.3'],"[(0, 31)]"
895,20230130_121325_598225,19,bot,"Wenn ich richtig verstanden habe, fragst du  woher die KI ihr Wissen bezieht. Viele glauben, dass eine medKI ein komplexes neuronales Netz sein würde, das mit ausreichend Patientendaten trainiert ist. Im Gegensatz dazu gehen wir davon aus, dass eine medKI auch die verfügbare Literatur, wie Lehrbücher und Fachartikel versteht und mit Fällen aus Patientendaten kombiniert und dadurch auch verständliche Erklärungen generieren kann. Ihre Leistungsfähigkeit ist trotzdem entscheidend von der Korrektheit und Vollständigkeit der konkreten Falldaten abhängig.   Was denkst du denn darüber: Bei der Diagnostik und Therapieentscheidung sind die Erklärungen der Ergebnisse wichtig, da letztlich die Patient:innen ihrer Therapie zustimmen müssen. Eine medKI tut sich schwer, eine auf das intellektuelle Niveau der Patient:innen angepasste Erklärung zu liefern.","['intro_37', 'FAQ.3', 'FAQ.3-1', 'faq_trans_2', 'Z.K5']","[(0, 45), (45, 78), (78, 558), (558, 586), (586, 853)]"
896,20230130_121325_598225,20,user,Ah ok das verstehe ich,['CONSENT'],"[(0, 22)]"
897,20230130_121325_598225,21,bot,"Ich bin mir nicht sicher, was du genau meinst. Kannst du das anders ausdrücken?",['intro_62'],"[(0, 80)]"
898,20230130_121325_598225,22,user,Das ist natürlich ein Nachteil der medki,['OTHER'],"[(0, 40)]"
899,20230130_121325_598225,23,bot,"Das mag sein. Ansprechen möchte ich noch: Patient:innen haben kein Vertrauen in die medKI, da diese unpersönlich ist. Dies könnte beispielsweise bei älteren Patient:innen zu Skepsis führen.","['intro_3', 'z_trans_11', 'Z.K10']","[(0, 14), (14, 42), (42, 190)]"
900,20230130_121325_598225,24,user,"Aber möglicherweise könnte man den älteren Menschen diese Skepsis nehmen, indem man ihnen sagt, dass das medki gut isr",['Z.K10-2'],"[(0, 118)]"
901,20230130_121325_598225,25,bot,"Du sagst, dass Menschen der KI vertrauen, da sie sich mit der Zeit mehr und mehr an sie gewöhnen werden. Da gebe ich dir recht. Ansprechen möchte ich noch: Bei Fehlentscheidungen der medKI gibt es wenig Verständnis, die Hersteller könnten dafür verantwortlich gemacht werden und es werden hohe Schadensersatzforderungen entstehen, so dass keine Anreize zum praktischen Einsatz existieren.","['intro_27', 'Z.K10-2', 'intro_6', 'z_trans_11', 'Z.K3']","[(0, 15), (15, 105), (105, 128), (128, 156), (156, 389)]"
902,20230130_140317_525469,0,user,Mehr Daten zur Beurteilung,['Z.P6'],"[(0, 27)]"
903,20230130_140317_525469,1,bot,"Ich bin mir nicht sicher, was du genau meinst. Kannst du das anders formulieren?",['intro_61'],"[(0, 81)]"
904,20230130_140317_525469,2,user,Die Ki hat mehr Daten zur beurteilung von den Symptomen. Somit kann sie genauere einschätzungen Liefern zu Behandlungen und maßnahmen als ein Artzt,['Z.P6'],"[(0, 147)]"
905,20230130_140317_525469,3,bot,"Das mag sein. Ansprechen möchte ich noch: Eine medKI kann zwar den Ärztemangel lindern, aber dafür wird mehr medizinisches Fachpersonal (u.a.  Pflegeberufe, Praxishelfer:innen, medizinische Fachassistent:innnen usw.) einschl. neuer, ähnlicher Berufsbilder benötigt.","['intro_3', 'z_trans_11', 'Z.P1-1']","[(0, 14), (14, 42), (42, 267)]"
906,20230130_140317_525469,4,user,Warum benötigt man mehr personal?,['OTHER'],"[(0, 33)]"
907,20230130_140317_525469,5,bot,"Ich bin mir nicht sicher, was du genau meinst. Kannst du das anders ausdrücken?",['intro_62'],"[(0, 80)]"
908,20230130_140317_525469,6,user,Aber die Aussagekraft der Ki sorgt dennoch für bessere Krankheitsverläufe. Das lässt sich statistisch beweisen vermute ich.,['Z.P6'],"[(0, 123)]"
